20:06:57.276824 IP 192.168.10.101.49204 > 171.25.178.74.9523: UDP, length 270
20:06:57.310778 IP 171.25.178.74.9523 > 192.168.10.101.49204: UDP, length 325
20:06:57.417403 IP 192.168.10.199.37999 > 3.250.123.105.31004: tcp 282
20:06:57.459293 IP 3.250.123.105.31004 > 192.168.10.199.37999: tcp 0
20:06:57.459361 IP 3.250.123.105.31004 > 192.168.10.199.37999: tcp 142
20:06:57.463615 IP 192.168.10.39.62992 > 255.255.255.255.62976: UDP, length 317
20:06:57.473587 IP 192.168.10.199.37999 > 3.250.123.105.31004: tcp 0
20:06:58.030795 IP 192.168.10.24.46386 > 91.82.92.228.110: tcp 0
20:06:58.087999 ARP, Request who-has 192.168.10.31 tell 192.168.10.173, length 46
20:06:58.170740 IP 192.168.10.37.49154 > 148.6.0.1.123: UDP, length 48
20:06:58.175636 IP 148.6.0.1.123 > 192.168.10.37.49154: UDP, length 48
20:06:58.253187 IP6 fe80::208:a2ff:fe0e:fd02 > ff02::1: ICMP6, router advertisement, length 56
20:06:58.528758 ARP, Request who-has 192.168.10.168 tell 192.168.10.91, length 46
20:06:58.770354 IP 172.16.32.242.54826 > 192.168.10.2.1433: tcp 1
20:06:58.770922 IP 192.168.10.2.1433 > 172.16.32.242.54826: tcp 0
20:06:58.809180 IP 192.168.10.2.1433 > 172.16.32.242.54826: tcp 1
20:06:58.823194 IP 172.16.32.242.54826 > 192.168.10.2.1433: tcp 0
20:06:58.888479 ARP, Request who-has 192.168.10.31 tell 192.168.10.173, length 46
20:06:58.927058 IP 192.168.10.139.58855 > 239.255.255.250.1900: UDP, length 174
20:06:59.218903 IP 192.168.10.139.60596 > 142.251.39.10.443: UDP, length 33
20:06:59.225000 IP 142.251.39.10.443 > 192.168.10.139.60596: UDP, length 25
20:06:59.263585 IP 192.168.10.17.443 > 192.241.215.10.56788: tcp 0
20:06:59.356528 ARP, Request who-has 192.168.10.168 tell 192.168.10.91, length 46
20:06:59.443267 IP 192.168.10.246.443 > 192.241.205.120.38170: tcp 0
20:06:59.520097 IP 172.16.32.242.58117 > 192.168.10.2.1433: tcp 1
20:06:59.520516 IP 192.168.10.2.1433 > 172.16.32.242.58117: tcp 0
20:06:59.574841 IP 192.168.10.2.1433 > 172.16.32.242.58117: tcp 1
20:06:59.588785 IP 172.16.32.242.58117 > 192.168.10.2.1433: tcp 0
20:06:59.888236 ARP, Request who-has 192.168.10.31 tell 192.168.10.173, length 46
20:06:59.938777 IP 192.168.10.139.58855 > 239.255.255.250.1900: UDP, length 174
20:07:00.060769 IP 192.168.10.173.64931 > 142.251.39.10.443: UDP, length 33
20:07:00.077861 IP 192.168.10.73.5678 > 255.255.255.255.5678: UDP, length 79
20:07:00.090319 IP 142.251.39.10.443 > 192.168.10.173.64931: UDP, length 25
20:07:00.211453 ARP, Request who-has 192.168.10.1 tell 192.168.10.18, length 46
20:07:00.211457 ARP, Reply 192.168.10.1 is-at 00:08:a2:0e:fd:02, length 28
20:07:00.270998 IP 172.16.32.242.54871 > 192.168.10.2.1433: tcp 142
20:07:00.272101 IP 192.168.10.2.1433 > 172.16.32.242.54871: tcp 43
20:07:00.286328 IP 172.16.32.242.54871 > 192.168.10.2.1433: tcp 86
20:07:00.287164 IP 192.168.10.2.1433 > 172.16.32.242.54871: tcp 53
20:07:00.303673 IP 172.16.32.242.54866 > 192.168.10.2.1433: tcp 142
20:07:00.303915 ARP, Request who-has 192.168.10.5 tell 192.168.10.206, length 46
20:07:00.304602 IP 192.168.10.2.1433 > 172.16.32.242.54866: tcp 43
20:07:00.318630 IP 172.16.32.242.54866 > 192.168.10.2.1433: tcp 86
20:07:00.319439 IP 192.168.10.2.1433 > 172.16.32.242.54866: tcp 53
20:07:00.333749 IP 172.16.32.242.54866 > 192.168.10.2.1433: tcp 1289
20:07:00.333802 IP 172.16.32.242.54866 > 192.168.10.2.1433: tcp 744
20:07:00.334268 IP 192.168.10.2.1433 > 172.16.32.242.54866: tcp 0
20:07:00.337496 IP 192.168.10.2.1433 > 172.16.32.242.54866: tcp 1289
20:07:00.337507 IP 192.168.10.2.1433 > 172.16.32.242.54866: tcp 1289
20:07:00.337514 IP 192.168.10.2.1433 > 172.16.32.242.54866: tcp 1289
20:07:00.337529 IP 192.168.10.2.1433 > 172.16.32.242.54866: tcp 1289
20:07:00.337537 IP 192.168.10.2.1433 > 172.16.32.242.54866: tcp 1289
20:07:00.337543 IP 192.168.10.2.1433 > 172.16.32.242.54866: tcp 27
20:07:00.348333 IP 172.16.32.242.54871 > 192.168.10.2.1433: tcp 0
20:07:00.352163 IP 172.16.32.242.54866 > 192.168.10.2.1433: tcp 0
20:07:00.352187 IP 172.16.32.242.54866 > 192.168.10.2.1433: tcp 0
20:07:00.352284 IP 172.16.32.242.54866 > 192.168.10.2.1433: tcp 0
20:07:00.356543 ARP, Request who-has 192.168.10.168 tell 192.168.10.91, length 46
20:07:00.360157 IP 172.16.32.242.54866 > 192.168.10.2.1433: tcp 1289
20:07:00.360249 IP 172.16.32.242.54866 > 192.168.10.2.1433: tcp 1289
20:07:00.360332 IP 172.16.32.242.54866 > 192.168.10.2.1433: tcp 1289
20:07:00.360451 IP 172.16.32.242.54866 > 192.168.10.2.1433: tcp 1289
20:07:00.360529 IP 172.16.32.242.54866 > 192.168.10.2.1433: tcp 1289
20:07:00.360555 IP 172.16.32.242.54866 > 192.168.10.2.1433: tcp 653
20:07:00.360754 IP 192.168.10.2.1433 > 172.16.32.242.54866: tcp 0
20:07:00.360836 IP 192.168.10.2.1433 > 172.16.32.242.54866: tcp 0
20:07:00.418234 IP 192.168.10.2.1433 > 172.16.32.242.54866: tcp 353
20:07:00.473279 IP 172.16.32.242.54866 > 192.168.10.2.1433: tcp 0
20:07:00.586271 IP6 fe80::c225:e9ff:fe4b:81d5.546 > ff02::1:2.547: UDP, length 66
20:07:00.854476 AT 65280.129.6 > 0.6:  at-#6 25
20:07:00.880147 IP 192.168.10.180.59617 > 116.202.208.24.443: tcp 1
20:07:00.903169 IP 116.202.208.24.443 > 192.168.10.180.59617: tcp 0
20:07:00.908218 IP 192.168.10.199.49808 > 54.246.34.179.31004: tcp 282
20:07:00.947465 IP 192.168.10.139.58855 > 239.255.255.250.1900: UDP, length 174
20:07:00.952979 IP 54.246.34.179.31004 > 192.168.10.199.49808: tcp 142
20:07:00.953982 IP 192.168.10.199.49808 > 54.246.34.179.31004: tcp 0
20:07:01.224194 ARP, Request who-has 192.168.10.5 tell 192.168.10.206, length 46
20:07:01.960478 IP 192.168.10.139.58855 > 239.255.255.250.1900: UDP, length 174
20:07:02.222597 ARP, Request who-has 192.168.10.5 tell 192.168.10.206, length 46
20:07:02.603359 IP 192.168.10.199.36901 > 52.50.192.84.31004: tcp 1400
20:07:02.603373 IP 192.168.10.199.36901 > 52.50.192.84.31004: tcp 185
20:07:02.648171 IP 52.50.192.84.31004 > 192.168.10.199.36901: tcp 0
20:07:02.653047 AT 65280.128.6 > 0.6:  at-#6 25
20:07:02.999080 IP 192.168.10.199.49808 > 54.246.34.179.31004: tcp 256
20:07:02.999654 IP 192.168.10.199.49808 > 54.246.34.179.31004: tcp 256
20:07:03.000344 IP 192.168.10.199.49808 > 54.246.34.179.31004: tcp 256
20:07:03.044293 IP 54.246.34.179.31004 > 192.168.10.199.49808: tcp 0
20:07:03.088804 IP 54.246.34.179.31004 > 192.168.10.199.49808: tcp 0
20:07:03.134974 ARP, Request who-has 192.168.10.31 tell 192.168.10.173, length 46
20:07:03.730286 IP6 fe80::208:a2ff:fe0e:fd02 > ff02::1: ICMP6, router advertisement, length 56
20:07:03.772148 IP 192.168.10.251.5678 > 255.255.255.255.5678: UDP, length 141
20:07:03.772193 CDPv1, ttl: 120s, Device-ID 'MikroTik', length 107
20:07:03.817720 IP6 fe80::208:a2ff:fe0e:fd02 > ff02::16: HBH ICMP6, multicast listener report v2, 1 group record(s), length 28
20:07:03.824348 ARP, Request who-has 192.168.10.20 (ff:ff:ff:ff:ff:ff) tell 192.168.10.20, length 46
20:07:03.890196 ARP, Request who-has 192.168.10.31 tell 192.168.10.173, length 46
20:07:04.375502 IP 192.168.10.80.52834 > 52.38.226.146.8883: tcp 31
20:07:04.548235 IP 52.38.226.146.8883 > 192.168.10.80.52834: tcp 31
20:07:04.548616 IP 192.168.10.80.52834 > 52.38.226.146.8883: tcp 0
20:07:04.877086 ARP, Request who-has 192.168.10.31 tell 192.168.10.173, length 46
20:07:05.014820 ARP, Request who-has 192.168.10.1 tell 192.168.10.94, length 46
20:07:05.014824 ARP, Reply 192.168.10.1 is-at 00:08:a2:0e:fd:02, length 28
20:07:05.176387 IP 192.168.10.173.52073 > 34.120.160.131.443: tcp 29
20:07:05.180894 IP 34.120.160.131.443 > 192.168.10.173.52073: tcp 0
20:07:05.196837 IP 192.168.10.18.38769 > 142.93.235.17.4000: UDP, length 148
20:07:05.217717 IP6 fe80::208:a2ff:fe0e:fd02 > ff02::16: HBH ICMP6, multicast listener report v2, 1 group record(s), length 28
20:07:05.270693 IP6 fe80::c820:21ff:fede:1745.50700 > 2606:4700::6810:da54.80: tcp 0
20:07:05.275912 IP 192.168.10.139.56776 > 172.217.19.106.443: tcp 1
20:07:05.280360 IP 172.217.19.106.443 > 192.168.10.139.56776: tcp 0
20:07:05.622333 IP6 fe80::c225:e9ff:fe4b:81d5.546 > ff02::1:2.547: UDP, length 66
20:07:05.833434 IP 142.251.39.10.443 > 192.168.10.139.60596: UDP, length 79
20:07:05.838637 IP 192.168.10.139.60596 > 142.251.39.10.443: UDP, length 33
20:07:06.041723 IP 192.168.10.139.60596 > 142.251.39.10.443: UDP, length 33
20:07:06.048952 IP 142.251.39.10.443 > 192.168.10.139.60596: UDP, length 25
20:07:06.260448 IP 192.168.10.139.60596 > 142.251.39.10.443: UDP, length 33
20:07:06.266585 IP 142.251.39.10.443 > 192.168.10.139.60596: UDP, length 25
20:07:06.267255 IP6 fe80::c820:21ff:fede:1745.50700 > 2606:4700::6810:da54.80: tcp 0
20:07:06.475149 IP 192.168.10.139.60596 > 142.251.39.10.443: UDP, length 33
20:07:06.481387 IP 142.251.39.10.443 > 192.168.10.139.60596: UDP, length 25
20:07:06.528868 ARP, Request who-has 192.168.10.168 tell 192.168.10.91, length 46
20:07:06.630288 IP6 fe80::c225:e9ff:fe4b:81d5.546 > ff02::1:2.547: UDP, length 66
20:07:06.695756 IP 192.168.10.139.60596 > 142.251.39.10.443: UDP, length 33
20:07:06.702998 IP 142.251.39.10.443 > 192.168.10.139.60596: UDP, length 25
20:07:06.707728 IP 172.16.32.242.54830 > 192.168.10.2.1433: tcp 1
20:07:06.708084 IP 192.168.10.2.1433 > 172.16.32.242.54830: tcp 0
20:07:06.778337 IP 192.168.10.2.1433 > 172.16.32.242.54830: tcp 1
20:07:06.792519 IP 172.16.32.242.54830 > 192.168.10.2.1433: tcp 0
20:07:06.800816 IP 142.251.39.10.443 > 192.168.10.173.64931: UDP, length 392
20:07:06.802308 IP 142.251.39.10.443 > 192.168.10.173.64931: UDP, length 25
20:07:06.802837 IP 192.168.10.173.64931 > 142.251.39.10.443: UDP, length 33
20:07:06.806546 IP 192.168.10.173.51533 > 142.251.39.10.443: UDP, length 1250
20:07:06.806675 IP 192.168.10.173.51533 > 142.251.39.10.443: UDP, length 76
20:07:06.806905 IP 192.168.10.173.51533 > 142.251.39.10.443: UDP, length 514
20:07:06.833216 IP 142.251.39.10.443 > 192.168.10.173.51533: UDP, length 1250
20:07:06.833580 IP 142.251.39.10.443 > 192.168.10.173.51533: UDP, length 628
20:07:06.833594 IP 142.251.39.10.443 > 192.168.10.173.51533: UDP, length 26
20:07:06.834379 IP 192.168.10.173.51533 > 142.251.39.10.443: UDP, length 79
20:07:06.834524 IP 192.168.10.173.51533 > 142.251.39.10.443: UDP, length 33
20:07:06.838866 IP 142.251.39.10.443 > 192.168.10.173.51533: UDP, length 92
20:07:06.838876 IP 142.251.39.10.443 > 192.168.10.173.51533: UDP, length 25
20:07:06.839443 IP 192.168.10.173.51533 > 142.251.39.10.443: UDP, length 33
20:07:06.916516 IP 192.168.10.139.60596 > 142.251.39.10.443: UDP, length 33
20:07:06.922432 IP 142.251.39.10.443 > 192.168.10.139.60596: UDP, length 25
20:07:06.948029 IP 142.251.39.10.443 > 192.168.10.173.51533: UDP, length 294
20:07:06.948798 IP 192.168.10.173.51533 > 142.251.39.10.443: UDP, length 35
20:07:06.949919 IP 142.251.39.10.443 > 192.168.10.173.51533: UDP, length 25
20:07:06.950762 IP 192.168.10.173.64931 > 142.251.39.10.443: UDP, length 479
20:07:06.953311 IP 142.251.39.10.443 > 192.168.10.173.51533: UDP, length 25
20:07:06.955567 IP 142.251.39.10.443 > 192.168.10.173.64931: UDP, length 28
20:07:06.976069 IP 192.168.10.173.51533 > 142.251.39.10.443: UDP, length 33
20:07:06.981027 IP 192.168.10.173.64931 > 142.251.39.10.443: UDP, length 33
20:07:07.035035 ARP, Request who-has 192.168.10.1 tell 192.168.10.93, length 46
20:07:07.035044 ARP, Reply 192.168.10.1 is-at 00:08:a2:0e:fd:02, length 28
20:07:07.073875 IP 142.251.39.10.443 > 192.168.10.173.64931: UDP, length 85
20:07:07.074514 IP 192.168.10.173.64931 > 142.251.39.10.443: UDP, length 36
20:07:07.104511 IP 142.251.39.10.443 > 192.168.10.173.64931: UDP, length 25
20:07:07.124447 IP 185.14.184.154.443 > 192.168.10.139.53462: tcp 0
20:07:07.126292 IP 192.168.10.139.53462 > 185.14.184.154.443: tcp 0
20:07:07.137209 IP 192.168.10.139.60596 > 142.251.39.10.443: UDP, length 33
20:07:07.143827 IP 142.251.39.10.443 > 192.168.10.139.60596: UDP, length 25
20:07:07.316326 IP 192.168.10.173.64931 > 142.251.39.10.443: UDP, length 33
20:07:07.346843 IP 142.251.39.10.443 > 192.168.10.173.64931: UDP, length 25
20:07:07.356947 ARP, Request who-has 192.168.10.168 tell 192.168.10.91, length 46
20:07:07.443309 IP 192.168.10.246.443 > 192.241.205.120.38170: tcp 0
20:07:07.450792 IP 192.168.10.16.46656 > 192.168.10.1.10051: tcp 0
20:07:07.554397 IP 192.168.10.173.64931 > 142.251.39.10.443: UDP, length 33
20:07:07.554510 ARP, Request who-has 192.168.10.31 tell 192.168.10.173, length 46
20:07:07.560947 IP 192.168.10.139.60596 > 142.251.39.10.443: UDP, length 33
20:07:07.567206 IP 142.251.39.10.443 > 192.168.10.139.60596: UDP, length 25
20:07:07.584028 IP 142.251.39.10.443 > 192.168.10.173.64931: UDP, length 25
20:07:07.789676 IP 192.168.10.173.64931 > 142.251.39.10.443: UDP, length 33
20:07:07.819355 IP 142.251.39.10.443 > 192.168.10.173.64931: UDP, length 25
20:07:08.025595 IP 192.168.10.173.64931 > 142.251.39.10.443: UDP, length 33
20:07:08.055615 IP 142.251.39.10.443 > 192.168.10.173.64931: UDP, length 25
20:07:08.260914 IP 192.168.10.173.64931 > 142.251.39.10.443: UDP, length 33
20:07:08.271261 IP6 fe80::c820:21ff:fede:1745.50700 > 2606:4700::6810:da54.80: tcp 0
20:07:08.290375 IP 142.251.39.10.443 > 192.168.10.173.64931: UDP, length 25
20:07:08.356914 ARP, Request who-has 192.168.10.168 tell 192.168.10.91, length 46
20:07:08.379194 IP 192.168.10.139.60596 > 142.251.39.10.443: UDP, length 33
20:07:08.385608 IP 142.251.39.10.443 > 192.168.10.139.60596: UDP, length 25
20:07:08.386057 ARP, Request who-has 192.168.10.31 tell 192.168.10.173, length 46
20:07:08.476044 IP 192.168.10.16.46656 > 192.168.10.1.10051: tcp 0
20:07:08.496298 IP 192.168.10.173.64931 > 142.251.39.10.443: UDP, length 33
20:07:08.526462 IP 142.251.39.10.443 > 192.168.10.173.64931: UDP, length 25
20:07:08.718318 IP6 fe80::c225:e9ff:fe4b:81d5.546 > ff02::1:2.547: UDP, length 66
20:07:08.938852 IP 192.168.10.173.64931 > 142.251.39.10.443: UDP, length 33
20:07:08.969113 IP 142.251.39.10.443 > 192.168.10.173.64931: UDP, length 25
20:07:09.150802 ARP, Request who-has 192.168.10.5 tell 192.168.10.139, length 46
20:07:09.378046 ARP, Request who-has 192.168.10.31 tell 192.168.10.173, length 46
20:07:09.588184 ARP, Request who-has 192.168.10.1 tell 192.168.10.80, length 46
20:07:09.588188 ARP, Reply 192.168.10.1 is-at 00:08:a2:0e:fd:02, length 28
20:07:09.770940 IP 192.168.10.173.64931 > 142.251.39.10.443: UDP, length 33
20:07:09.801441 IP 142.251.39.10.443 > 192.168.10.173.64931: UDP, length 25
20:07:09.801620 ARP, Request who-has 192.168.10.5 tell 192.168.10.139, length 46
20:07:09.996781 IP 192.168.10.139.60596 > 142.251.39.10.443: UDP, length 33
20:07:10.000089 IP 192.168.10.240.123 > 148.6.0.1.123: UDP, length 48
20:07:10.003338 IP 142.251.39.10.443 > 192.168.10.139.60596: UDP, length 25
20:07:10.005104 IP 148.6.0.1.123 > 192.168.10.240.123: UDP, length 48
20:07:10.283310 IP6 fe80::c820:21ff:fede:1745 > fe80::208:a2ff:fe0e:fd02: ICMP6, neighbor solicitation, who has fe80::208:a2ff:fe0e:fd02, length 32
20:07:10.283367 IP6 fe80::208:a2ff:fe0e:fd02 > fe80::c820:21ff:fede:1745: ICMP6, neighbor advertisement, tgt is fe80::208:a2ff:fe0e:fd02, length 24
20:07:10.763950 IP6 fe80::208:a2ff:fe0e:fd02 > ff02::1: ICMP6, router advertisement, length 56
20:07:10.800298 ARP, Request who-has 192.168.10.5 tell 192.168.10.139, length 46
20:07:10.875559 AT 65280.129.6 > 0.6:  at-#6 25
20:07:10.910857 IP 192.168.10.180.59617 > 116.202.208.24.443: tcp 1
20:07:10.933899 IP 116.202.208.24.443 > 192.168.10.180.59617: tcp 0
20:07:11.407930 IP 192.168.10.173.64931 > 142.251.39.10.443: UDP, length 33
20:07:11.437508 IP 142.251.39.10.443 > 192.168.10.173.64931: UDP, length 25
20:07:11.615676 IPX 00000000.00:c0:ee:96:38:e5.4da9 > 00000000.ff:ff:ff:ff:ff:ff.0453: ipx-rip-req ffffffff/0.0
20:07:11.836599 IP 192.168.10.74.5678 > 255.255.255.255.5678: UDP, length 80
20:07:12.283319 IP6 fe80::c820:21ff:fede:1745.50700 > 2606:4700::6810:da54.80: tcp 0
20:07:12.335713 IPX 00000000.00:c0:ee:96:38:e5.4da9 > 00000000.ff:ff:ff:ff:ff:ff.0453: ipx-rip-req ffffffff/0.0
20:07:12.459215 ARP, Request who-has 192.168.10.1 tell 192.168.10.246, length 46
20:07:12.459219 ARP, Reply 192.168.10.1 is-at 00:08:a2:0e:fd:02, length 28
20:07:12.476036 ARP, Request who-has 192.168.10.1 tell 192.168.10.16, length 46
20:07:12.476039 ARP, Reply 192.168.10.1 is-at 00:08:a2:0e:fd:02, length 28
20:07:12.674132 AT 65280.128.6 > 0.6:  at-#6 25
20:07:12.858376 IP6 fe80::c225:e9ff:fe4b:81d5.546 > ff02::1:2.547: UDP, length 66
20:07:13.027740 ARP, Request who-has 192.168.10.31 tell 192.168.10.173, length 46
20:07:13.055725 IPX 00000000.00:c0:ee:96:38:e5.4da9 > 00000000.ff:ff:ff:ff:ff:ff.0453: ipx-rip-req ffffffff/0.0
20:07:13.219674 IP 192.168.10.139.60596 > 142.251.39.10.443: UDP, length 33
20:07:13.225762 IP 142.251.39.10.443 > 192.168.10.139.60596: UDP, length 25
20:07:13.755824 IPX 00000000.00:c0:ee:96:38:e5.4da9 > 00000000.ff:ff:ff:ff:ff:ff.0453: ipx-rip-req ffffffff/0.0
20:07:13.877130 ARP, Request who-has 192.168.10.31 tell 192.168.10.173, length 46
20:07:14.030587 IP 192.168.10.3.138 > 192.168.10.255.138: UDP, length 201
20:07:14.070921 IP 192.168.10.24.46386 > 91.82.92.228.110: tcp 0
20:07:14.116615 IP 192.168.10.19.137 > 192.168.10.255.137: UDP, length 50
20:07:14.145347 IP 172.16.32.242.54828 > 192.168.10.2.1433: tcp 1
20:07:14.145861 IP 192.168.10.2.1433 > 172.16.32.242.54828: tcp 0
20:07:14.200577 IP 192.168.10.2.1433 > 172.16.32.242.54828: tcp 1
20:07:14.214632 IP 172.16.32.242.54828 > 192.168.10.2.1433: tcp 0
20:07:14.332837 IP 192.168.10.173.49402 > 142.250.102.188.5228: tcp 26
20:07:14.357856 IP 142.250.102.188.5228 > 192.168.10.173.49402: tcp 0
20:07:14.360514 IP 142.250.102.188.5228 > 192.168.10.173.49402: tcp 26
20:07:14.410805 IP 192.168.10.173.49402 > 142.250.102.188.5228: tcp 0
20:07:14.476182 IPX 00000000.00:c0:ee:96:38:e5.4daa > 00000000.ff:ff:ff:ff:ff:ff.0453: ipx-rip-req ffffffff/0.0
20:07:14.610340 IP 18.195.122.69.443 > 192.168.10.18.58234: tcp 0
20:07:14.610398 IP 192.168.10.18.58234 > 18.195.122.69.443: tcp 0
20:07:14.646428 IP 192.168.10.173.64931 > 142.251.39.10.443: UDP, length 33
20:07:14.675948 IP 142.251.39.10.443 > 192.168.10.173.64931: UDP, length 25
20:07:14.881487 ARP, Request who-has 192.168.10.31 tell 192.168.10.173, length 46
20:07:14.910978 IP 172.16.32.242.58115 > 192.168.10.2.1433: tcp 1
20:07:14.911500 IP 192.168.10.2.1433 > 172.16.32.242.58115: tcp 0
20:07:14.966234 IP 192.168.10.2.1433 > 172.16.32.242.58115: tcp 1
20:07:14.980825 IP 172.16.32.242.58115 > 192.168.10.2.1433: tcp 0
20:07:15.013349 ARP, Request who-has 192.168.10.1 tell 192.168.10.240, length 46
20:07:15.013352 ARP, Reply 192.168.10.1 is-at 00:08:a2:0e:fd:02, length 28
20:07:15.081693 IP6 fe80::208:a2ff:fe0e:fd02 > fe80::c820:21ff:fede:1745: ICMP6, neighbor solicitation, who has fe80::c820:21ff:fede:1745, length 32
20:07:15.082077 IP6 fe80::c820:21ff:fede:1745 > fe80::208:a2ff:fe0e:fd02: ICMP6, neighbor advertisement, tgt is fe80::c820:21ff:fede:1745, length 24
20:07:15.196032 IPX 00000000.00:c0:ee:96:38:e5.4daa > 00000000.ff:ff:ff:ff:ff:ff.0453: ipx-rip-req ffffffff/0.0
20:07:15.204484 IP 192.168.10.18.38769 > 142.93.235.17.4000: UDP, length 148
20:07:15.249999 IP 192.168.10.249.49620 > 192.168.10.1.10051: tcp 0
20:07:15.277690 IP 192.168.10.101.49204 > 171.25.178.74.9523: UDP, length 270
20:07:15.311656 IP 171.25.178.74.9523 > 192.168.10.101.49204: UDP, length 325
20:07:15.391681 IP 192.168.10.17.443 > 192.241.215.10.56788: tcp 0
20:07:15.661311 IP 172.16.32.242.58117 > 192.168.10.2.1433: tcp 142
20:07:15.662404 IP 192.168.10.2.1433 > 172.16.32.242.58117: tcp 43
20:07:15.676625 IP 172.16.32.242.58117 > 192.168.10.2.1433: tcp 86
20:07:15.677517 IP 192.168.10.2.1433 > 172.16.32.242.58117: tcp 53
20:07:15.694153 IP 172.16.32.242.54828 > 192.168.10.2.1433: tcp 142
20:07:15.695104 IP 192.168.10.2.1433 > 172.16.32.242.54828: tcp 43
20:07:15.709156 IP 172.16.32.242.54828 > 192.168.10.2.1433: tcp 86
20:07:15.710016 IP 192.168.10.2.1433 > 172.16.32.242.54828: tcp 53
20:07:15.724311 IP 172.16.32.242.54828 > 192.168.10.2.1433: tcp 1289
20:07:15.724383 IP 172.16.32.242.54828 > 192.168.10.2.1433: tcp 744
20:07:15.724883 IP 192.168.10.2.1433 > 172.16.32.242.54828: tcp 0
20:07:15.728050 IP 192.168.10.2.1433 > 172.16.32.242.54828: tcp 1289
20:07:15.728061 IP 192.168.10.2.1433 > 172.16.32.242.54828: tcp 1289
20:07:15.728068 IP 192.168.10.2.1433 > 172.16.32.242.54828: tcp 1289
20:07:15.728082 IP 192.168.10.2.1433 > 172.16.32.242.54828: tcp 1289
20:07:15.728091 IP 192.168.10.2.1433 > 172.16.32.242.54828: tcp 1289
20:07:15.728096 IP 192.168.10.2.1433 > 172.16.32.242.54828: tcp 27
20:07:15.739006 IP 172.16.32.242.58117 > 192.168.10.2.1433: tcp 0
20:07:15.742609 IP 172.16.32.242.54828 > 192.168.10.2.1433: tcp 0
20:07:15.742745 IP 172.16.32.242.54828 > 192.168.10.2.1433: tcp 0
20:07:15.742825 IP 172.16.32.242.54828 > 192.168.10.2.1433: tcp 0
20:07:15.752997 IP 172.16.32.242.54828 > 192.168.10.2.1433: tcp 1289
20:07:15.753074 IP 172.16.32.242.54828 > 192.168.10.2.1433: tcp 1289
20:07:15.753151 IP 172.16.32.242.54828 > 192.168.10.2.1433: tcp 1289
20:07:15.753246 IP 172.16.32.242.54828 > 192.168.10.2.1433: tcp 1289
20:07:15.753334 IP 172.16.32.242.54828 > 192.168.10.2.1433: tcp 1289
20:07:15.753375 IP 172.16.32.242.54828 > 192.168.10.2.1433: tcp 653
20:07:15.753737 IP 192.168.10.2.1433 > 172.16.32.242.54828: tcp 0
20:07:15.809193 IP 192.168.10.2.1433 > 172.16.32.242.54828: tcp 353
20:07:15.864062 IP 172.16.32.242.54828 > 192.168.10.2.1433: tcp 0
20:07:15.916073 IPX 00000000.00:c0:ee:96:38:e5.4daa > 00000000.ff:ff:ff:ff:ff:ff.0453: ipx-rip-req ffffffff/0.0
20:07:16.119423 IP 192.168.10.19.137 > 192.168.10.255.137: UDP, length 50
20:07:16.616127 IPX 00000000.00:c0:ee:96:38:e5.4daa > 00000000.ff:ff:ff:ff:ff:ff.0453: ipx-rip-req ffffffff/0.0
20:07:16.982719 IP 192.168.10.180.58754 > 239.255.255.250.1900: UDP, length 175
20:07:17.120931 IP 192.168.10.19.137 > 192.168.10.255.137: UDP, length 50
20:07:17.161286 IP 172.16.32.242.54828 > 192.168.10.2.1433: tcp 142
20:07:17.162433 IP 192.168.10.2.1433 > 172.16.32.242.54828: tcp 43
20:07:17.176634 IP 172.16.32.242.54828 > 192.168.10.2.1433: tcp 86
20:07:17.177621 IP 192.168.10.2.1433 > 172.16.32.242.54828: tcp 53
20:07:17.192093 IP 172.16.32.242.54828 > 192.168.10.2.1433: tcp 1289
20:07:17.192159 IP 172.16.32.242.54828 > 192.168.10.2.1433: tcp 1286
20:07:17.192685 IP 192.168.10.2.1433 > 172.16.32.242.54828: tcp 0
20:07:17.336442 (NOV-ETHII) IPX 00000000.00:c0:ee:96:38:e5.4dab > 00000000.ff:ff:ff:ff:ff:ff.0453: ipx-rip-req ffffffff/0.0
20:07:17.338760 IP 192.168.10.2.1433 > 172.16.32.242.54828: tcp 518
20:07:17.353520 IP 172.16.32.242.54828 > 192.168.10.2.1433: tcp 142
20:07:17.354454 IP 192.168.10.2.1433 > 172.16.32.242.54828: tcp 43
20:07:17.368518 IP 172.16.32.242.54828 > 192.168.10.2.1433: tcp 86
20:07:17.369357 IP 192.168.10.2.1433 > 172.16.32.242.54828: tcp 53
20:07:17.383668 IP 172.16.32.242.54828 > 192.168.10.2.1433: tcp 1289
20:07:17.383701 IP 172.16.32.242.54828 > 192.168.10.2.1433: tcp 149
20:07:17.384186 IP 192.168.10.2.1433 > 172.16.32.242.54828: tcp 0
20:07:17.385887 IP 192.168.10.2.1433 > 172.16.32.242.54828: tcp 595
20:07:17.442287 IP 172.16.32.242.54828 > 192.168.10.2.1433: tcp 0
20:07:17.491423 IP 192.168.10.101.9522 > 239.12.255.253.9522: UDP, length 98
20:07:17.994891 IP 192.168.10.180.58754 > 239.255.255.250.1900: UDP, length 175
20:07:18.056274 (NOV-ETHII) IPX 00000000.00:c0:ee:96:38:e5.4dab > 00000000.ff:ff:ff:ff:ff:ff.0453: ipx-rip-req ffffffff/0.0
20:07:18.122474 IP 192.168.10.19.137 > 192.168.10.255.137: UDP, length 50
20:07:18.228905 ARP, Request who-has 192.168.10.31 tell 192.168.10.173, length 46
20:07:18.258160 IP 192.168.10.157.54321 > 213.33.117.249.49049: UDP, length 68
20:07:18.292703 IP 213.33.117.249.49049 > 192.168.10.157.54321: UDP, length 52
20:07:18.776377 (NOV-ETHII) IPX 00000000.00:c0:ee:96:38:e5.4dab > 00000000.ff:ff:ff:ff:ff:ff.0453: ipx-rip-req ffffffff/0.0
20:07:18.888123 ARP, Request who-has 192.168.10.31 tell 192.168.10.173, length 46
20:07:18.997981 IP 192.168.10.180.58754 > 239.255.255.250.1900: UDP, length 175
20:07:19.124106 IP 192.168.10.19.138 > 192.168.10.255.138: UDP, length 183
20:07:19.159023 ARP, Request who-has 192.168.10.5 tell 192.168.10.139, length 46
20:07:19.219497 IP6 fe80::208:a2ff:fe0e:fd02 > ff02::1: ICMP6, router advertisement, length 56
20:07:19.417710 IP6 fe80::208:a2ff:fe0e:fd02 > ff02::16: HBH ICMP6, multicast listener report v2, 1 group record(s), length 28
20:07:19.476481 (NOV-ETHII) IPX 00000000.00:c0:ee:96:38:e5.4dab > 00000000.ff:ff:ff:ff:ff:ff.0453: ipx-rip-req ffffffff/0.0
20:07:19.526099 IP 192.168.10.8.5678 > 255.255.255.255.5678: UDP, length 140
20:07:19.526220 CDPv1, ttl: 120s, Device-ID 'CsomiepLaborClient', length 99
20:07:19.637743 IP 192.168.10.139.60596 > 142.251.39.10.443: UDP, length 33
20:07:19.643914 IP 142.251.39.10.443 > 192.168.10.139.60596: UDP, length 25
20:07:19.804488 ARP, Request who-has 192.168.10.5 tell 192.168.10.139, length 46
20:07:19.876816 ARP, Request who-has 192.168.10.31 tell 192.168.10.173, length 46
20:07:19.900459 IP 192.168.10.199.36901 > 52.50.192.84.31004: tcp 282
20:07:19.912085 IP 192.168.10.3.62198 > 192.168.10.1.53: UDP, length 76
20:07:19.945286 IP 52.50.192.84.31004 > 192.168.10.199.36901: tcp 142
20:07:19.945699 IP 192.168.10.199.36901 > 52.50.192.84.31004: tcp 0
20:07:19.969519 IP 192.168.10.1.53 > 192.168.10.3.62198: UDP, length 92
20:07:19.970064 ARP, Request who-has 192.168.10.157 tell 192.168.10.3, length 46
20:07:19.978853 IP 192.168.10.3.61365 > 192.168.10.1.53: UDP, length 76
20:07:19.995838 IP 192.168.10.1.53 > 192.168.10.3.61365: UDP, length 147
20:07:20.000524 IP 192.168.10.157.46424 > 40.113.176.164.8883: tcp 0
20:07:20.001071 IP 192.168.10.180.58754 > 239.255.255.250.1900: UDP, length 175
20:07:20.029473 IP 40.113.176.164.8883 > 192.168.10.157.46424: tcp 0
20:07:20.040490 IP 192.168.10.157.46424 > 40.113.176.164.8883: tcp 0
20:07:20.052860 IP 192.168.10.157.46424 > 40.113.176.164.8883: tcp 337
20:07:20.082880 IP 40.113.176.164.8883 > 192.168.10.157.46424: tcp 1460
20:07:20.082894 IP 40.113.176.164.8883 > 192.168.10.157.46424: tcp 1460
20:07:20.082907 IP 40.113.176.164.8883 > 192.168.10.157.46424: tcp 1037
20:07:20.093315 IP 192.168.10.157.46424 > 40.113.176.164.8883: tcp 0
20:07:20.093326 IP 192.168.10.157.46424 > 40.113.176.164.8883: tcp 0
20:07:20.187128 ARP, Request who-has 192.168.10.1 (00:08:a2:0e:fd:02) tell 192.168.10.249, length 46
20:07:20.187132 ARP, Reply 192.168.10.1 is-at 00:08:a2:0e:fd:02, length 28
20:07:20.196758 (NOV-ETHII) IPX 00000000.00:c0:ee:96:38:e5.4dac > 00000000.ff:ff:ff:ff:ff:ff.0453: ipx-rip-req ffffffff/0.0
20:07:20.198607 IP 192.168.10.246.47668 > 192.168.10.1.10051: tcp 0
20:07:20.236883 ARP, Request who-has 192.168.10.6 tell 192.168.10.3, length 46
20:07:20.238032 IP 192.168.10.173.61404 > 195.228.254.46.443: tcp 1
20:07:20.242990 IP 195.228.254.46.443 > 192.168.10.173.61404: tcp 0
20:07:20.299318 IP6 fe80::c820:21ff:fede:1745.50700 > 2606:4700::6810:da54.80: tcp 0
20:07:20.358961 IP 192.168.10.80.46448 > 185.125.190.57.123: UDP, length 48
20:07:20.390291 IP 185.125.190.57.123 > 192.168.10.80.46448: UDP, length 48
20:07:20.465258 IP 192.168.10.91.58791 > 192.168.10.1.53: UDP, length 31
20:07:20.478233 IP 192.168.10.1.53 > 192.168.10.91.58791: UDP, length 70
20:07:20.486111 IP 192.168.10.91.60499 > 91.228.166.14.80: tcp 0
20:07:20.507644 IP 91.228.166.14.80 > 192.168.10.91.60499: tcp 0
20:07:20.508235 IP 192.168.10.91.60499 > 91.228.166.14.80: tcp 0
20:07:20.511623 ARP, Request who-has 192.168.10.1 tell 192.168.10.17, length 46
20:07:20.511627 ARP, Reply 192.168.10.1 is-at 00:08:a2:0e:fd:02, length 28
20:07:20.514564 IP 192.168.10.91.60499 > 91.228.166.14.80: tcp 536
20:07:20.536227 IP 91.228.166.14.80 > 192.168.10.91.60499: tcp 0
20:07:20.536239 IP 91.228.166.14.80 > 192.168.10.91.60499: tcp 341
20:07:20.541842 IP 192.168.10.91.60499 > 91.228.166.14.80: tcp 536
20:07:20.563562 IP 91.228.166.14.80 > 192.168.10.91.60499: tcp 294
20:07:20.566196 IP 192.168.10.91.60499 > 91.228.166.14.80: tcp 0
20:07:20.587825 IP 91.228.166.14.80 > 192.168.10.91.60499: tcp 0
20:07:20.588186 IP 192.168.10.91.60499 > 91.228.166.14.80: tcp 0
20:07:20.707039 IP 192.168.10.157.46424 > 40.113.176.164.8883: tcp 178
20:07:20.736914 IP 40.113.176.164.8883 > 192.168.10.157.46424: tcp 91
20:07:20.752624 IP 192.168.10.157.46424 > 40.113.176.164.8883: tcp 0
20:07:20.765189 IP 192.168.10.157.46424 > 40.113.176.164.8883: tcp 309
20:07:20.782508 IP6 fe80::c225:e9ff:fe4b:81d5.546 > ff02::1:2.547: UDP, length 66
20:07:20.810093 ARP, Request who-has 192.168.10.5 tell 192.168.10.139, length 46
20:07:20.837508 IP 40.113.176.164.8883 > 192.168.10.157.46424: tcp 0
20:07:20.896609 AT 65280.129.6 > 0.6:  at-#6 25
20:07:20.916626 (NOV-ETHII) IPX 00000000.00:c0:ee:96:38:e5.4dac > 00000000.ff:ff:ff:ff:ff:ff.0453: ipx-rip-req ffffffff/0.0
20:07:20.941320 IP 192.168.10.180.59617 > 116.202.208.24.443: tcp 1
20:07:20.964349 IP 116.202.208.24.443 > 192.168.10.180.59617: tcp 0
20:07:21.085910 IP 192.168.10.173.64931 > 142.251.39.10.443: UDP, length 33
20:07:21.115999 IP 142.251.39.10.443 > 192.168.10.173.64931: UDP, length 25
20:07:21.195390 IP 192.168.10.246.47668 > 192.168.10.1.10051: tcp 0
20:07:21.414446 IP 192.168.10.80.52834 > 52.38.226.146.8883: tcp 152
20:07:21.472355 IP 192.168.10.79.49154 > 148.6.0.1.123: UDP, length 48
20:07:21.477394 IP 148.6.0.1.123 > 192.168.10.79.49154: UDP, length 48
20:07:21.628278 IP 52.38.226.146.8883 > 192.168.10.80.52834: tcp 0
20:07:21.636638 (NOV-ETHII) IPX 00000000.00:c0:ee:96:38:e5.4dac > 00000000.ff:ff:ff:ff:ff:ff.0453: ipx-rip-req ffffffff/0.0
20:07:21.992244 IP 192.168.10.139.53462 > 185.14.184.154.443: tcp 1
20:07:22.022175 IP 185.14.184.154.443 > 192.168.10.139.53462: tcp 0
20:07:22.336751 (NOV-ETHII) IPX 00000000.00:c0:ee:96:38:e5.4dac > 00000000.ff:ff:ff:ff:ff:ff.0453: ipx-rip-req ffffffff/0.0
20:07:22.417699 IP6 fe80::208:a2ff:fe0e:fd02 > ff02::16: HBH ICMP6, multicast listener report v2, 1 group record(s), length 28
20:07:22.552213 IP 52.38.226.146.8883 > 192.168.10.80.52834: tcp 128
20:07:22.552730 IP 192.168.10.80.52834 > 52.38.226.146.8883: tcp 0
20:07:22.695253 AT 65280.128.6 > 0.6:  at-#6 25
20:07:23.085828 IP 192.168.10.70.53601 > 159.122.182.201.5938: tcp 24
20:07:23.113860 IP 159.122.182.201.5938 > 192.168.10.70.53601: tcp 24
20:07:23.251520 ARP, Request who-has 192.168.10.31 tell 192.168.10.173, length 46
20:07:23.319481 IP 192.168.10.70.53601 > 159.122.182.201.5938: tcp 0
20:07:23.443398 IP 192.168.10.246.443 > 192.241.205.120.38170: tcp 0
20:07:23.518407 IP 192.168.10.139.58856 > 239.255.255.250.1900: UDP, length 175
20:07:23.879504 ARP, Request who-has 192.168.10.31 tell 192.168.10.173, length 46
20:07:24.533080 IP 192.168.10.139.58856 > 239.255.255.250.1900: UDP, length 175
20:07:24.883848 ARP, Request who-has 192.168.10.31 tell 192.168.10.173, length 46
20:07:25.161884 IP 172.16.32.242.54828 > 192.168.10.2.1433: tcp 142
20:07:25.162900 IP 192.168.10.2.1433 > 172.16.32.242.54828: tcp 43
20:07:25.176963 IP 172.16.32.242.54828 > 192.168.10.2.1433: tcp 86
20:07:25.177838 IP 192.168.10.2.1433 > 172.16.32.242.54828: tcp 53
20:07:25.193124 IP 172.16.32.242.54828 > 192.168.10.2.1433: tcp 300
20:07:25.194417 IP 192.168.10.2.1433 > 172.16.32.242.54828: tcp 104
20:07:25.201495 IP 192.168.10.18.38769 > 142.93.235.17.4000: UDP, length 148
20:07:25.208775 IP 172.16.32.242.54828 > 192.168.10.2.1433: tcp 1289
20:07:25.208884 IP 172.16.32.242.54828 > 192.168.10.2.1433: tcp 1289
20:07:25.208982 IP 172.16.32.242.54828 > 192.168.10.2.1433: tcp 1289
20:07:25.209022 IP 172.16.32.242.54828 > 192.168.10.2.1433: tcp 667
20:07:25.209553 IP 192.168.10.2.1433 > 172.16.32.242.54828: tcp 0
20:07:25.213231 IP 192.168.10.2.1433 > 172.16.32.242.54828: tcp 1255
20:07:25.234132 IP 172.16.32.242.54828 > 192.168.10.2.1433: tcp 1289
20:07:25.234233 IP 172.16.32.242.54828 > 192.168.10.2.1433: tcp 1289
20:07:25.234345 IP 172.16.32.242.54828 > 192.168.10.2.1433: tcp 1289
20:07:25.234421 IP 172.16.32.242.54828 > 192.168.10.2.1433: tcp 771
20:07:25.234910 IP 192.168.10.2.1433 > 172.16.32.242.54828: tcp 0
20:07:25.244471 IP 192.168.10.2.1433 > 172.16.32.242.54828: tcp 1166
20:07:25.259317 IP 172.16.32.242.54828 > 192.168.10.2.1433: tcp 1289
20:07:25.259444 IP 172.16.32.242.54828 > 192.168.10.2.1433: tcp 1289
20:07:25.259583 IP 172.16.32.242.54828 > 192.168.10.2.1433: tcp 1289
20:07:25.259659 IP 172.16.32.242.54828 > 192.168.10.2.1433: tcp 664
20:07:25.260078 IP 192.168.10.2.1433 > 172.16.32.242.54828: tcp 0
20:07:25.266928 IP 192.168.10.2.1433 > 172.16.32.242.54828: tcp 1026
20:07:25.281693 IP 172.16.32.242.54828 > 192.168.10.2.1433: tcp 1289
20:07:25.281827 IP 172.16.32.242.54828 > 192.168.10.2.1433: tcp 1289
20:07:25.281907 IP 172.16.32.242.54828 > 192.168.10.2.1433: tcp 1289
20:07:25.282034 IP 172.16.32.242.54828 > 192.168.10.2.1433: tcp 1289
20:07:25.282149 IP 172.16.32.242.54828 > 192.168.10.2.1433: tcp 1289
20:07:25.282321 IP 172.16.32.242.54828 > 192.168.10.2.1433: tcp 1289
20:07:25.282347 IP 172.16.32.242.54828 > 192.168.10.2.1433: tcp 282
20:07:25.282385 IP 192.168.10.2.1433 > 172.16.32.242.54828: tcp 0
20:07:25.282489 IP 172.16.32.242.54828 > 192.168.10.2.1433: tcp 1289
20:07:25.282514 IP 172.16.32.242.54828 > 192.168.10.2.1433: tcp 253
20:07:25.282596 IP 192.168.10.2.1433 > 172.16.32.242.54828: tcp 0
20:07:25.282705 IP 192.168.10.2.1433 > 172.16.32.242.54828: tcp 0
20:07:25.282891 IP 192.168.10.2.1433 > 172.16.32.242.54828: tcp 16
20:07:25.283525 IP 192.168.10.2.1433 > 172.16.32.242.54828: tcp 242
20:07:25.297660 IP 172.16.32.242.54828 > 192.168.10.2.1433: tcp 0
20:07:25.534268 IP 192.168.10.139.58856 > 239.255.255.250.1900: UDP, length 175
20:07:25.786953 IP6 fe80::220:6bff:fe41:5596.546 > ff02::1:2.547: UDP, length 42
20:07:26.349309 IP 142.251.39.10.443 > 192.168.10.139.60596: UDP, length 79
20:07:26.349416 IP 142.251.39.10.443 > 192.168.10.139.60596: UDP, length 25
20:07:26.352462 IP 192.168.10.139.60596 > 142.251.39.10.443: UDP, length 33
20:07:26.381555 IP 192.168.10.139.50370 > 142.251.39.10.443: UDP, length 1250
20:07:26.381852 IP 192.168.10.139.50370 > 142.251.39.10.443: UDP, length 73
20:07:26.382331 IP 192.168.10.139.50370 > 142.251.39.10.443: UDP, length 510
20:07:26.407274 IP 142.251.39.10.443 > 192.168.10.139.50370: UDP, length 1250
20:07:26.407611 IP 142.251.39.10.443 > 192.168.10.139.50370: UDP, length 628
20:07:26.407621 IP 142.251.39.10.443 > 192.168.10.139.50370: UDP, length 26
20:07:26.409706 IP 192.168.10.139.50370 > 142.251.39.10.443: UDP, length 78
20:07:26.410099 IP 192.168.10.139.50370 > 142.251.39.10.443: UDP, length 33
20:07:26.414194 IP 142.251.39.10.443 > 192.168.10.139.50370: UDP, length 92
20:07:26.414203 IP 142.251.39.10.443 > 192.168.10.139.50370: UDP, length 25
20:07:26.415482 IP 192.168.10.139.50370 > 142.251.39.10.443: UDP, length 33
20:07:26.521814 IP 142.251.39.10.443 > 192.168.10.139.50370: UDP, length 292
20:07:26.523011 IP 142.251.39.10.443 > 192.168.10.139.50370: UDP, length 25
20:07:26.524178 IP 192.168.10.139.50370 > 142.251.39.10.443: UDP, length 35
20:07:26.526932 IP 192.168.10.139.60596 > 142.251.39.10.443: UDP, length 511
20:07:26.528624 IP 142.251.39.10.443 > 192.168.10.139.50370: UDP, length 25
20:07:26.531682 IP 142.251.39.10.443 > 192.168.10.139.60596: UDP, length 28
20:07:26.541134 IP 192.168.10.139.60596 > 142.251.39.10.443: UDP, length 33
20:07:26.541165 IP 192.168.10.139.58856 > 239.255.255.250.1900: UDP, length 175
20:07:26.558622 IP 142.251.39.10.443 > 192.168.10.139.50370: UDP, length 25
20:07:26.559342 IP 192.168.10.139.50370 > 142.251.39.10.443: UDP, length 33
20:07:26.560107 IP 192.168.10.139.50370 > 142.251.39.10.443: UDP, length 33
20:07:26.649752 IP 142.251.39.10.443 > 192.168.10.139.60596: UDP, length 86
20:07:26.652096 IP 192.168.10.139.60596 > 142.251.39.10.443: UDP, length 36
20:07:26.658002 IP 142.251.39.10.443 > 192.168.10.139.60596: UDP, length 25
20:07:26.742481 IP 192.168.10.199.54393 > 8.8.8.8.53: UDP, length 36
20:07:26.747101 IP 8.8.8.8.53 > 192.168.10.199.54393: UDP, length 52
20:07:26.876153 IP 192.168.10.139.60596 > 142.251.39.10.443: UDP, length 33
20:07:26.882525 IP 142.251.39.10.443 > 192.168.10.139.60596: UDP, length 25
20:07:26.935662 ARP, Request who-has 192.168.10.173 (ff:ff:ff:ff:ff:ff) tell 192.168.10.37, length 46
20:07:27.094985 IP 192.168.10.139.60596 > 142.251.39.10.443: UDP, length 33
20:07:27.101847 IP 142.251.39.10.443 > 192.168.10.139.60596: UDP, length 25
20:07:27.103126 IP 192.168.10.199.37999 > 3.250.123.105.31004: tcp 282
20:07:27.145056 IP 3.250.123.105.31004 > 192.168.10.199.37999: tcp 142
20:07:27.148176 IP 192.168.10.199.37999 > 3.250.123.105.31004: tcp 0
20:07:27.315563 IP 192.168.10.139.60596 > 142.251.39.10.443: UDP, length 33
20:07:27.321558 IP 142.251.39.10.443 > 192.168.10.139.60596: UDP, length 25
20:07:27.463750 IP 192.168.10.39.62992 > 255.255.255.255.62976: UDP, length 317
20:07:27.538344 IP 192.168.10.139.60596 > 142.251.39.10.443: UDP, length 33
20:07:27.544218 IP 142.251.39.10.443 > 192.168.10.139.60596: UDP, length 25
20:07:27.600539 ARP, Request who-has 192.168.10.1 (00:08:a2:0e:fd:02) tell 192.168.10.70, length 46
20:07:27.600546 ARP, Reply 192.168.10.1 is-at 00:08:a2:0e:fd:02, length 28
20:07:27.748202 IP 142.251.39.10.443 > 192.168.10.173.64931: UDP, length 391
20:07:27.757436 IP 192.168.10.139.60596 > 142.251.39.10.443: UDP, length 33
20:07:27.763320 IP 142.251.39.10.443 > 192.168.10.139.60596: UDP, length 25
20:07:27.774081 IP 192.168.10.173.64931 > 142.251.39.10.443: UDP, length 33
20:07:27.962651 IP 192.168.10.173.64931 > 142.251.39.10.443: UDP, length 33
20:07:27.978222 IP 192.168.10.139.60596 > 142.251.39.10.443: UDP, length 33
20:07:27.984455 IP 142.251.39.10.443 > 192.168.10.139.60596: UDP, length 25
20:07:27.992769 IP 142.251.39.10.443 > 192.168.10.173.64931: UDP, length 25
20:07:28.058928 IP6 fe80::208:a2ff:fe0e:fd02 > ff02::1: ICMP6, router advertisement, length 56
20:07:28.100784 IP 192.168.10.70.53601 > 159.122.182.201.5938: tcp 24
20:07:28.150274 IP 192.168.10.139.55493 > 142.250.102.188.5228: tcp 1
20:07:28.168729 IP 159.122.182.201.5938 > 192.168.10.70.53601: tcp 0
20:07:28.170920 IP 192.168.10.37.49154 > 148.6.0.1.123: UDP, length 48
20:07:28.175432 IP 142.250.102.188.5228 > 192.168.10.139.55493: tcp 0
20:07:28.175863 IP 148.6.0.1.123 > 192.168.10.37.49154: UDP, length 48
20:07:28.198421 IP 192.168.10.173.64931 > 142.251.39.10.443: UDP, length 33
20:07:28.228093 IP 142.251.39.10.443 > 192.168.10.173.64931: UDP, length 25
20:07:28.277211 ARP, Request who-has 192.168.10.31 tell 192.168.10.173, length 46
20:07:28.386772 IP 192.168.10.139.60596 > 142.251.39.10.443: UDP, length 33
20:07:28.392665 IP 142.251.39.10.443 > 192.168.10.139.60596: UDP, length 25
20:07:28.433736 IP 192.168.10.173.64931 > 142.251.39.10.443: UDP, length 33
20:07:28.463476 IP 142.251.39.10.443 > 192.168.10.173.64931: UDP, length 25
20:07:28.467368 IP 192.168.10.2.63922 > 192.168.10.1.10051: tcp 0
20:07:28.668494 IP 192.168.10.173.64931 > 142.251.39.10.443: UDP, length 33
20:07:28.674225 IP 142.251.39.10.443 > 192.168.10.173.64931: UDP, length 25
20:07:28.786186 IP 172.16.32.242.54826 > 192.168.10.2.1433: tcp 1
20:07:28.786670 IP 192.168.10.2.1433 > 172.16.32.242.54826: tcp 0
20:07:28.826145 IP 192.168.10.2.1433 > 172.16.32.242.54826: tcp 1
20:07:28.840184 IP 172.16.32.242.54826 > 192.168.10.2.1433: tcp 0
20:07:28.889127 ARP, Request who-has 192.168.10.31 tell 192.168.10.173, length 46
20:07:28.889339 IP 192.168.10.173.64931 > 142.251.39.10.443: UDP, length 33
20:07:28.896173 IP 142.251.39.10.443 > 192.168.10.173.64931: UDP, length 25
20:07:29.087289 ARP, Request who-has 192.168.10.5 tell 192.168.10.70, length 46
20:07:29.108961 IP 192.168.10.173.64931 > 142.251.39.10.443: UDP, length 33
20:07:29.115417 IP 142.251.39.10.443 > 192.168.10.173.64931: UDP, length 25
20:07:29.197421 IP 192.168.10.139.60596 > 142.251.39.10.443: UDP, length 33
20:07:29.203261 IP 142.251.39.10.443 > 192.168.10.139.60596: UDP, length 25
20:07:29.228830 ARP, Request who-has 192.168.10.5 tell 192.168.10.139, length 46
20:07:29.517096 IP 192.168.10.173.64931 > 142.251.39.10.443: UDP, length 33
