12:16:06.640175 IP 192.168.50.110.58328 > 239.255.255.250.1900: UDP, length 174
12:16:07.640094 IP 192.168.50.110.57621 > 192.168.50.255.57621: UDP, length 44
12:16:07.655527 IP 192.168.50.110.58328 > 239.255.255.250.1900: UDP, length 174
12:16:08.265328 IP 192.168.50.139.49673 > 192.168.50.255.1947: UDP, length 40
12:16:08.577078 IP 192.168.50.101.54135 > 192.168.50.1.53: UDP, length 36
12:16:08.577150 IP 192.168.50.1.53 > 192.168.50.101.54135: UDP, length 111
12:16:08.655911 IP 192.168.50.110.58328 > 239.255.255.250.1900: UDP, length 174
12:16:09.031402 IP 192.168.50.110.51121 > 35.186.224.40.443: tcp 43
12:16:09.040397 IP 35.186.224.40.443 > 192.168.50.110.51121: tcp 0
12:16:09.057471 IP 35.186.224.40.443 > 192.168.50.110.51121: tcp 40
12:16:09.109342 IP 192.168.50.110.51121 > 35.186.224.40.443: tcp 0
12:16:09.625579 ARP, Request who-has 169.254.169.254 tell 192.168.50.110, length 42
12:16:10.186697 ARP, Request who-has 169.254.169.254 tell 192.168.50.110, length 42
12:16:11.186369 ARP, Request who-has 169.254.169.254 tell 192.168.50.110, length 42
12:16:11.341135 IP 192.168.50.250.33422 > 87.97.60.77.110: tcp 0
12:16:11.352249 IP 87.97.60.77.110 > 192.168.50.250.33422: tcp 0
12:16:11.352505 IP 192.168.50.250.33422 > 87.97.60.77.110: tcp 0
12:16:11.375769 IP 87.97.60.77.110 > 192.168.50.250.33422: tcp 21
12:16:11.375971 IP 192.168.50.250.33422 > 87.97.60.77.110: tcp 0
12:16:11.376362 IP 192.168.50.250.33422 > 87.97.60.77.110: tcp 15
12:16:11.385624 IP 87.97.60.77.110 > 192.168.50.250.33422: tcp 0
12:16:11.385772 IP 87.97.60.77.110 > 192.168.50.250.33422: tcp 5
12:16:11.386002 IP 192.168.50.250.33422 > 87.97.60.77.110: tcp 11
12:16:11.395650 IP 87.97.60.77.110 > 192.168.50.250.33422: tcp 0
12:16:11.410481 IP 87.97.60.77.110 > 192.168.50.250.33422: tcp 16
12:16:11.410741 IP 192.168.50.250.33422 > 87.97.60.77.110: tcp 6
12:16:11.420535 IP 87.97.60.77.110 > 192.168.50.250.33422: tcp 0
12:16:11.420545 IP 87.97.60.77.110 > 192.168.50.250.33422: tcp 9
12:16:11.420848 IP 192.168.50.250.33422 > 87.97.60.77.110: tcp 6
12:16:11.430377 IP 87.97.60.77.110 > 192.168.50.250.33422: tcp 0
12:16:11.431631 IP 87.97.60.77.110 > 192.168.50.250.33422: tcp 18
12:16:11.431818 IP 192.168.50.250.33422 > 87.97.60.77.110: tcp 0
12:16:11.441649 IP 87.97.60.77.110 > 192.168.50.250.33422: tcp 0
12:16:13.227853 IP 52.183.118.135.10101 > 192.168.50.115.41953: tcp 1
12:16:13.565985 IP 192.168.50.115.41953 > 52.183.118.135.10101: tcp 0
12:16:13.713463 IP 52.183.118.135.10101 > 192.168.50.115.41953: tcp 1
12:16:13.718015 IP 192.168.50.115.41953 > 52.183.118.135.10101: tcp 0
12:16:13.732714 IP 52.183.118.135.10101 > 192.168.50.115.41953: tcp 32
12:16:13.734655 IP 192.168.50.115.41953 > 52.183.118.135.10101: tcp 0
12:16:14.456280 IP 192.168.50.135.51450 > 20.199.120.85.443: tcp 101
12:16:14.481348 IP 20.199.120.85.443 > 192.168.50.135.51450: tcp 171
12:16:14.533252 IP 192.168.50.135.51450 > 20.199.120.85.443: tcp 0
12:16:16.843206 IP 192.168.50.110.51507 > 109.199.62.243.443: tcp 1
12:16:16.847971 IP 109.199.62.243.443 > 192.168.50.110.51507: tcp 0
12:16:20.483098 IP 192.168.50.110.51223 > 91.228.167.187.8883: tcp 31
12:16:20.495720 IP 91.228.167.187.8883 > 192.168.50.110.51223: tcp 31
12:16:20.545439 IP 192.168.50.110.51223 > 91.228.167.187.8883: tcp 0
12:16:20.707316 IP 104.199.65.124.4070 > 192.168.50.110.51119: tcp 11
12:16:20.764149 IP 192.168.50.110.51119 > 104.199.65.124.4070: tcp 0
12:16:22.697592 IP 192.168.50.139.59641 > 52.114.74.211.443: tcp 59
12:16:22.727174 IP 52.114.74.211.443 > 192.168.50.139.59641: tcp 48
12:16:22.779736 IP 192.168.50.139.59641 > 52.114.74.211.443: tcp 0
12:16:25.032301 IP 192.168.50.110.52954 > 62.112.211.190.443: tcp 0
12:16:25.037016 IP 62.112.211.190.443 > 192.168.50.110.52954: tcp 0
12:16:25.038402 IP 192.168.50.110.52954 > 62.112.211.190.443: tcp 0
12:16:25.039926 IP 192.168.50.110.52954 > 62.112.211.190.443: tcp 266
12:16:25.044558 IP 62.112.211.190.443 > 192.168.50.110.52954: tcp 0
12:16:25.047549 IP 62.112.211.190.443 > 192.168.50.110.52954: tcp 1460
12:16:25.047561 IP 62.112.211.190.443 > 192.168.50.110.52954: tcp 1460
12:16:25.047575 IP 62.112.211.190.443 > 192.168.50.110.52954: tcp 1176
12:16:25.049522 IP 192.168.50.110.52954 > 62.112.211.190.443: tcp 0
12:16:25.050507 IP 62.112.211.190.443 > 192.168.50.110.52954: tcp 677
12:16:25.058489 IP 192.168.50.110.52954 > 62.112.211.190.443: tcp 80
12:16:25.061234 IP 192.168.50.110.52954 > 62.112.211.190.443: tcp 89
12:16:25.061966 IP 192.168.50.110.52954 > 62.112.211.190.443: tcp 1460
12:16:25.061976 IP 192.168.50.110.52954 > 62.112.211.190.443: tcp 864
12:16:25.063154 IP 62.112.211.190.443 > 192.168.50.110.52954: tcp 0
12:16:25.066004 IP 62.112.211.190.443 > 192.168.50.110.52954: tcp 0
12:16:25.066732 IP 62.112.211.190.443 > 192.168.50.110.52954: tcp 0
12:16:25.070251 IP 62.112.211.190.443 > 192.168.50.110.52954: tcp 87
12:16:25.070261 IP 62.112.211.190.443 > 192.168.50.110.52954: tcp 167
12:16:25.071908 IP 192.168.50.110.52954 > 62.112.211.190.443: tcp 0
12:16:25.072246 IP 192.168.50.110.52954 > 62.112.211.190.443: tcp 31
12:16:25.077166 IP 62.112.211.190.443 > 192.168.50.110.52954: tcp 0
12:16:25.108568 IP 62.112.211.190.443 > 192.168.50.110.52954: tcp 1391
12:16:25.108724 IP 62.112.211.190.443 > 192.168.50.110.52954: tcp 1171
12:16:25.111296 IP 192.168.50.110.52954 > 62.112.211.190.443: tcp 0
12:16:25.341874 IP 192.168.50.110.51124 > 35.186.224.47.443: tcp 35
12:16:25.350603 IP 35.186.224.47.443 > 192.168.50.110.51124: tcp 0
12:16:25.379300 IP 35.186.224.47.443 > 192.168.50.110.51124: tcp 31
12:16:25.435388 IP 192.168.50.110.51124 > 35.186.224.47.443: tcp 0
12:16:27.105954 IP 192.168.50.139.51667 > 192.168.50.1.53: UDP, length 43
12:16:27.109439 IP 192.168.50.139.55935 > 192.168.50.1.53: UDP, length 36
12:16:27.109523 IP 192.168.50.1.53 > 192.168.50.139.55935: UDP, length 111
12:16:27.134543 IP 192.168.50.139.51667 > 1.1.1.1.53: UDP, length 43
12:16:27.138546 IP 192.168.50.1.53 > 192.168.50.139.51667: UDP, length 75
12:16:27.139376 IP 1.1.1.1.53 > 192.168.50.139.51667: UDP, length 75
12:16:27.151522 IP 192.168.50.139.61702 > 104.18.42.171.443: tcp 0
12:16:27.156149 IP 104.18.42.171.443 > 192.168.50.139.61702: tcp 0
12:16:27.158078 IP 192.168.50.139.61702 > 104.18.42.171.443: tcp 0
12:16:27.185987 IP 192.168.50.110.52892 > 35.186.224.25.443: tcp 1
12:16:27.190399 IP 35.186.224.25.443 > 192.168.50.110.52892: tcp 0
12:16:27.246065 IP 192.168.50.139.61702 > 104.18.42.171.443: tcp 517
12:16:27.250617 IP 104.18.42.171.443 > 192.168.50.139.61702: tcp 0
12:16:27.251617 IP 104.18.42.171.443 > 192.168.50.139.61702: tcp 1460
12:16:27.251629 IP 104.18.42.171.443 > 192.168.50.139.61702: tcp 630
12:16:27.255382 IP 192.168.50.139.61702 > 104.18.42.171.443: tcp 0
12:16:28.155094 IP 192.168.50.139.64498 > 192.168.50.1.53: UDP, length 28
12:16:28.155175 IP 192.168.50.1.53 > 192.168.50.139.64498: UDP, length 60
12:16:28.160586 IP 192.168.50.139.61702 > 104.18.42.171.443: tcp 64
12:16:28.163051 IP 192.168.50.139.58669 > 8.8.8.8.443: UDP, length 1250
12:16:28.163102 IP 192.168.50.139.61702 > 104.18.42.171.443: tcp 92
12:16:28.163692 IP 192.168.50.139.61702 > 104.18.42.171.443: tcp 126
12:16:28.164200 IP 192.168.50.139.61702 > 104.18.42.171.443: tcp 159
12:16:28.165158 IP 104.18.42.171.443 > 192.168.50.139.61702: tcp 0
12:16:28.165247 IP 104.18.42.171.443 > 192.168.50.139.61702: tcp 528
12:16:28.167632 IP 104.18.42.171.443 > 192.168.50.139.61702: tcp 0
12:16:28.167694 IP 104.18.42.171.443 > 192.168.50.139.61702: tcp 31
12:16:28.168112 IP 8.8.8.8.443 > 192.168.50.139.58669: UDP, length 1250
12:16:28.168585 IP 104.18.42.171.443 > 192.168.50.139.61702: tcp 35
12:16:28.169745 IP 104.18.42.171.443 > 192.168.50.139.61702: tcp 594
12:16:28.172588 IP 192.168.50.139.61702 > 104.18.42.171.443: tcp 0
12:16:28.172679 IP 192.168.50.139.61702 > 104.18.42.171.443: tcp 31
12:16:28.175531 IP 192.168.50.139.61702 > 104.18.42.171.443: tcp 0
12:16:28.175540 IP 192.168.50.139.61703 > 204.79.197.203.443: tcp 0
12:16:28.176312 IP 192.168.50.139.58669 > 8.8.8.8.443: UDP, length 1250
12:16:28.183925 IP 204.79.197.203.443 > 192.168.50.139.61703: tcp 0
12:16:28.185759 IP 192.168.50.139.61703 > 204.79.197.203.443: tcp 0
12:16:28.186410 IP 192.168.50.139.61703 > 204.79.197.203.443: tcp 517
12:16:28.189159 IP 8.8.8.8.443 > 192.168.50.139.58669: UDP, length 1250
12:16:28.189173 IP 8.8.8.8.443 > 192.168.50.139.58669: UDP, length 1250
12:16:28.189181 IP 8.8.8.8.443 > 192.168.50.139.58669: UDP, length 1250
12:16:28.189190 IP 8.8.8.8.443 > 192.168.50.139.58669: UDP, length 449
12:16:28.192224 IP 192.168.50.139.58669 > 8.8.8.8.443: UDP, length 41
12:16:28.193003 IP 192.168.50.139.58669 > 8.8.8.8.443: UDP, length 41
12:16:28.193011 IP 192.168.50.139.58669 > 8.8.8.8.443: UDP, length 41
12:16:28.194654 IP 204.79.197.203.443 > 192.168.50.139.61703: tcp 0
12:16:28.195964 IP 204.79.197.203.443 > 192.168.50.139.61703: tcp 1460
12:16:28.195978 IP 204.79.197.203.443 > 192.168.50.139.61703: tcp 1460
12:16:28.195990 IP 204.79.197.203.443 > 192.168.50.139.61703: tcp 1460
12:16:28.196001 IP 204.79.197.203.443 > 192.168.50.139.61703: tcp 1311
12:16:28.197437 IP 8.8.8.8.443 > 192.168.50.139.58669: UDP, length 41
12:16:28.200103 IP 192.168.50.139.61703 > 204.79.197.203.443: tcp 0
12:16:28.218651 IP 104.18.42.171.443 > 192.168.50.139.61702: tcp 0
12:16:28.260382 IP 192.168.50.139.61703 > 204.79.197.203.443: tcp 158
12:16:28.260392 IP 192.168.50.139.61703 > 204.79.197.203.443: tcp 99
12:16:28.261511 IP 192.168.50.139.61703 > 204.79.197.203.443: tcp 1206
12:16:28.268599 IP 204.79.197.203.443 > 192.168.50.139.61703: tcp 0
12:16:28.268638 IP 204.79.197.203.443 > 192.168.50.139.61703: tcp 0
12:16:28.269746 IP 204.79.197.203.443 > 192.168.50.139.61703: tcp 0
12:16:28.269884 IP 204.79.197.203.443 > 192.168.50.139.61703: tcp 342
12:16:28.269964 IP 204.79.197.203.443 > 192.168.50.139.61703: tcp 69
12:16:28.273836 IP 192.168.50.139.61703 > 204.79.197.203.443: tcp 0
12:16:28.273848 IP 192.168.50.139.61703 > 204.79.197.203.443: tcp 38
12:16:28.282051 IP 204.79.197.203.443 > 192.168.50.139.61703: tcp 38
12:16:28.282082 IP 204.79.197.203.443 > 192.168.50.139.61703: tcp 0
12:16:28.312994 IP 204.79.197.203.443 > 192.168.50.139.61703: tcp 1460
12:16:28.313007 IP 204.79.197.203.443 > 192.168.50.139.61703: tcp 1460
12:16:28.313020 IP 204.79.197.203.443 > 192.168.50.139.61703: tcp 1460
12:16:28.313033 IP 204.79.197.203.443 > 192.168.50.139.61703: tcp 1460
12:16:28.313043 IP 204.79.197.203.443 > 192.168.50.139.61703: tcp 635
12:16:28.313053 IP 204.79.197.203.443 > 192.168.50.139.61703: tcp 141
12:16:28.313062 IP 204.79.197.203.443 > 192.168.50.139.61703: tcp 473
12:16:28.313076 IP 204.79.197.203.443 > 192.168.50.139.61703: tcp 1460
12:16:28.313086 IP 204.79.197.203.443 > 192.168.50.139.61703: tcp 1460
12:16:28.313096 IP 204.79.197.203.443 > 192.168.50.139.61703: tcp 716
12:16:28.313105 IP 204.79.197.203.443 > 192.168.50.139.61703: tcp 530
12:16:28.313119 IP 204.79.197.203.443 > 192.168.50.139.61703: tcp 1460
12:16:28.313129 IP 204.79.197.203.443 > 192.168.50.139.61703: tcp 1460
12:16:28.313138 IP 204.79.197.203.443 > 192.168.50.139.61703: tcp 1214
12:16:28.313191 IP 204.79.197.203.443 > 192.168.50.139.61703: tcp 1460
12:16:28.313202 IP 204.79.197.203.443 > 192.168.50.139.61703: tcp 1460
12:16:28.313213 IP 204.79.197.203.443 > 192.168.50.139.61703: tcp 1158
12:16:28.313222 IP 204.79.197.203.443 > 192.168.50.139.61703: tcp 88
12:16:28.313243 IP 204.79.197.203.443 > 192.168.50.139.61703: tcp 1460
12:16:28.313257 IP 204.79.197.203.443 > 192.168.50.139.61703: tcp 1460
12:16:28.313266 IP 204.79.197.203.443 > 192.168.50.139.61703: tcp 1205
12:16:28.313287 IP 204.79.197.203.443 > 192.168.50.139.61703: tcp 1460
12:16:28.313300 IP 204.79.197.203.443 > 192.168.50.139.61703: tcp 1460
12:16:28.313313 IP 204.79.197.203.443 > 192.168.50.139.61703: tcp 1158
12:16:28.313323 IP 204.79.197.203.443 > 192.168.50.139.61703: tcp 88
12:16:28.313374 IP 204.79.197.203.443 > 192.168.50.139.61703: tcp 1460
12:16:28.316156 IP 192.168.50.139.61703 > 204.79.197.203.443: tcp 0
12:16:28.316169 IP 192.168.50.139.61703 > 204.79.197.203.443: tcp 0
12:16:28.316177 IP 192.168.50.139.61703 > 204.79.197.203.443: tcp 0
12:16:28.318336 IP 192.168.50.139.61703 > 204.79.197.203.443: tcp 0
12:16:28.318346 IP 192.168.50.139.61703 > 204.79.197.203.443: tcp 0
12:16:28.318356 IP 192.168.50.139.61703 > 204.79.197.203.443: tcp 0
12:16:28.318365 IP 192.168.50.139.61703 > 204.79.197.203.443: tcp 0
12:16:28.320365 IP 192.168.50.139.61703 > 204.79.197.203.443: tcp 0
12:16:28.320484 IP 192.168.50.139.61703 > 204.79.197.203.443: tcp 0
12:16:28.321743 IP 192.168.50.139.61703 > 204.79.197.203.443: tcp 0
12:16:28.324422 IP 204.79.197.203.443 > 192.168.50.139.61703: tcp 1460
12:16:28.324434 IP 204.79.197.203.443 > 192.168.50.139.61703: tcp 1460
12:16:28.324448 IP 204.79.197.203.443 > 192.168.50.139.61703: tcp 1460
12:16:28.324458 IP 204.79.197.203.443 > 192.168.50.139.61703: tcp 1460
12:16:28.324470 IP 204.79.197.203.443 > 192.168.50.139.61703: tcp 1460
12:16:28.324482 IP 204.79.197.203.443 > 192.168.50.139.61703: tcp 1460
12:16:28.324494 IP 204.79.197.203.443 > 192.168.50.139.61703: tcp 1460
12:16:28.324504 IP 204.79.197.203.443 > 192.168.50.139.61703: tcp 163
12:16:28.329079 IP 192.168.50.139.61703 > 204.79.197.203.443: tcp 0
12:16:28.329091 IP 192.168.50.139.61703 > 204.79.197.203.443: tcp 0
12:16:28.329099 IP 192.168.50.139.61703 > 204.79.197.203.443: tcp 0
12:16:28.329109 IP 192.168.50.139.61703 > 204.79.197.203.443: tcp 0
12:16:28.380374 IP 192.168.50.139.58669 > 8.8.8.8.443: UDP, length 83
12:16:28.380385 IP 192.168.50.139.58669 > 8.8.8.8.443: UDP, length 70
12:16:28.380394 IP 192.168.50.139.58669 > 8.8.8.8.443: UDP, length 34
12:16:28.385346 IP 8.8.8.8.443 > 192.168.50.139.58669: UDP, length 826
12:16:28.385357 IP 8.8.8.8.443 > 192.168.50.139.58669: UDP, length 93
12:16:28.388389 IP 192.168.50.139.58669 > 8.8.8.8.443: UDP, length 33
12:16:28.388398 IP 192.168.50.139.58669 > 8.8.8.8.443: UDP, length 33
12:16:28.409139 IP 8.8.8.8.443 > 192.168.50.139.58669: UDP, length 25
12:16:28.686290 IP 192.168.50.110.51225 > 91.228.167.187.8883: tcp 31
12:16:28.698845 IP 91.228.167.187.8883 > 192.168.50.110.51225: tcp 31
12:16:28.748581 IP 192.168.50.110.51225 > 91.228.167.187.8883: tcp 0
12:16:31.186986 IP 192.168.50.110.51711 > 142.250.27.188.5228: tcp 1
12:16:31.234318 IP 142.250.27.188.5228 > 192.168.50.110.51711: tcp 0
12:16:32.076000 IP 192.168.50.139.61703 > 204.79.197.203.443: tcp 0
12:16:32.076015 IP 192.168.50.139.61702 > 104.18.42.171.443: tcp 0
12:16:32.080759 IP 104.18.42.171.443 > 192.168.50.139.61702: tcp 0
12:16:32.082708 IP 192.168.50.139.61702 > 104.18.42.171.443: tcp 0
12:16:32.084333 IP 204.79.197.203.443 > 192.168.50.139.61703: tcp 0
12:16:32.084379 IP 204.79.197.203.443 > 192.168.50.139.61703: tcp 0
12:16:32.086247 IP 192.168.50.139.61703 > 204.79.197.203.443: tcp 0
12:16:32.958351 IP 192.168.50.101.49668 > 192.168.8.114.161: UDP, length 78
12:16:33.224900 IP 192.168.50.139.61707 > 204.79.197.203.443: tcp 0
12:16:33.233237 IP 204.79.197.203.443 > 192.168.50.139.61707: tcp 0
12:16:33.235068 IP 192.168.50.139.61707 > 204.79.197.203.443: tcp 0
12:16:33.235826 IP 192.168.50.139.61707 > 204.79.197.203.443: tcp 517
12:16:33.244045 IP 204.79.197.203.443 > 192.168.50.139.61707: tcp 0
12:16:33.245358 IP 204.79.197.203.443 > 192.168.50.139.61707: tcp 1460
12:16:33.245372 IP 204.79.197.203.443 > 192.168.50.139.61707: tcp 1460
12:16:33.245384 IP 204.79.197.203.443 > 192.168.50.139.61707: tcp 1460
12:16:33.245396 IP 204.79.197.203.443 > 192.168.50.139.61707: tcp 1311
12:16:33.249269 IP 192.168.50.139.61707 > 204.79.197.203.443: tcp 0
12:16:33.249278 IP 192.168.50.139.61707 > 204.79.197.203.443: tcp 0
12:16:33.258216 IP 192.168.50.139.61707 > 204.79.197.203.443: tcp 158
12:16:33.258226 IP 192.168.50.139.61707 > 204.79.197.203.443: tcp 99
12:16:33.258938 IP 192.168.50.139.61707 > 204.79.197.203.443: tcp 1035
12:16:33.266423 IP 204.79.197.203.443 > 192.168.50.139.61707: tcp 0
12:16:33.267167 IP 204.79.197.203.443 > 192.168.50.139.61707: tcp 0
12:16:33.267758 IP 204.79.197.203.443 > 192.168.50.139.61707: tcp 342
12:16:33.267819 IP 204.79.197.203.443 > 192.168.50.139.61707: tcp 69
12:16:33.270096 IP 192.168.50.139.61707 > 204.79.197.203.443: tcp 0
12:16:33.270646 IP 192.168.50.139.61707 > 204.79.197.203.443: tcp 38
12:16:33.278373 IP 204.79.197.203.443 > 192.168.50.139.61707: tcp 38
12:16:33.278841 IP 204.79.197.203.443 > 192.168.50.139.61707: tcp 0
12:16:33.324812 IP 192.168.50.139.61707 > 204.79.197.203.443: tcp 0
12:16:33.333038 IP 204.79.197.203.443 > 192.168.50.139.61707: tcp 692
12:16:33.411248 IP 192.168.50.139.61707 > 204.79.197.203.443: tcp 0
12:16:33.749793 IP 192.168.50.110.51109 > 192.168.10.2.445: tcp 1
12:16:33.750282 IP 192.168.10.2.445 > 192.168.50.110.51109: tcp 0
12:16:33.995507 ARP, Request who-has 192.168.50.1 tell 192.168.50.103, length 42
12:16:33.995514 ARP, Reply 192.168.50.1 is-at 00:08:a2:0e:fd:02, length 28
12:16:36.062451 IP 192.168.50.110.49668 > 192.168.10.23.161: UDP, length 78
12:16:36.062577 IP 192.168.50.110.49668 > 192.168.10.23.161: UDP, length 78
12:16:36.062833 IP 192.168.50.110.49668 > 192.168.10.23.161: UDP, length 78
12:16:36.062843 IP 192.168.50.110.49668 > 192.168.10.23.161: UDP, length 78
12:16:36.063166 IP 192.168.50.110.49668 > 192.168.10.23.161: UDP, length 78
12:16:36.099386 IP 192.168.10.23.161 > 192.168.50.110.49668: UDP, length 82
12:16:36.144052 IP 192.168.10.23.161 > 192.168.50.110.49668: UDP, length 82
12:16:36.188110 IP 192.168.10.23.161 > 192.168.50.110.49668: UDP, length 82
12:16:36.271429 IP 192.168.10.23.161 > 192.168.50.110.49668: UDP, length 82
12:16:36.352003 IP 192.168.10.23.161 > 192.168.50.110.49668: UDP, length 82
12:16:37.036613 IP 192.168.50.110.52954 > 62.112.211.190.443: tcp 73
12:16:37.041310 IP 62.112.211.190.443 > 192.168.50.110.52954: tcp 0
12:16:37.070150 IP 62.112.211.190.443 > 192.168.50.110.52954: tcp 1391
12:16:37.070252 IP 62.112.211.190.443 > 192.168.50.110.52954: tcp 1189
12:16:37.072686 IP 192.168.50.110.52954 > 62.112.211.190.443: tcp 0
12:16:37.086279 IP 192.168.50.110.52954 > 62.112.211.190.443: tcp 200
12:16:37.092499 IP 62.112.211.190.443 > 192.168.50.110.52954: tcp 1391
12:16:37.092696 IP 62.112.211.190.443 > 192.168.50.110.52954: tcp 1460
12:16:37.092709 IP 62.112.211.190.443 > 192.168.50.110.52954: tcp 1322
12:16:37.093413 IP 62.112.211.190.443 > 192.168.50.110.52954: tcp 1460
12:16:37.093426 IP 62.112.211.190.443 > 192.168.50.110.52954: tcp 1460
12:16:37.094161 IP 62.112.211.190.443 > 192.168.50.110.52954: tcp 1460
12:16:37.094173 IP 62.112.211.190.443 > 192.168.50.110.52954: tcp 1460
12:16:37.094566 IP 192.168.50.110.52954 > 62.112.211.190.443: tcp 0
12:16:37.094879 IP 192.168.50.110.52954 > 62.112.211.190.443: tcp 0
12:16:37.094943 IP 62.112.211.190.443 > 192.168.50.110.52954: tcp 1460
12:16:37.094956 IP 62.112.211.190.443 > 192.168.50.110.52954: tcp 1460
12:16:37.095661 IP 62.112.211.190.443 > 192.168.50.110.52954: tcp 1460
12:16:37.097112 IP 192.168.50.110.52954 > 62.112.211.190.443: tcp 0
12:16:37.099866 IP 62.112.211.190.443 > 192.168.50.110.52954: tcp 1460
12:16:37.099880 IP 62.112.211.190.443 > 192.168.50.110.52954: tcp 1460
12:16:37.099893 IP 62.112.211.190.443 > 192.168.50.110.52954: tcp 1460
12:16:37.100162 IP 62.112.211.190.443 > 192.168.50.110.52954: tcp 1460
12:16:37.100174 IP 62.112.211.190.443 > 192.168.50.110.52954: tcp 1460
12:16:37.100186 IP 62.112.211.190.443 > 192.168.50.110.52954: tcp 1460
12:16:37.100835 IP 62.112.211.190.443 > 192.168.50.110.52954: tcp 1460
12:16:37.100847 IP 62.112.211.190.443 > 192.168.50.110.52954: tcp 1460
12:16:37.100861 IP 62.112.211.190.443 > 192.168.50.110.52954: tcp 1460
12:16:37.100873 IP 62.112.211.190.443 > 192.168.50.110.52954: tcp 1460
12:16:37.101839 IP 62.112.211.190.443 > 192.168.50.110.52954: tcp 1460
12:16:37.101850 IP 62.112.211.190.443 > 192.168.50.110.52954: tcp 1460
12:16:37.101872 IP 62.112.211.190.443 > 192.168.50.110.52954: tcp 1460
12:16:37.101884 IP 62.112.211.190.443 > 192.168.50.110.52954: tcp 1460
12:16:37.101905 IP 62.112.211.190.443 > 192.168.50.110.52954: tcp 1460
12:16:37.102201 IP 192.168.50.110.52954 > 62.112.211.190.443: tcp 0
12:16:37.102545 IP 192.168.50.110.52954 > 62.112.211.190.443: tcp 0
12:16:37.102674 IP 62.112.211.190.443 > 192.168.50.110.52954: tcp 1460
12:16:37.102688 IP 62.112.211.190.443 > 192.168.50.110.52954: tcp 1460
12:16:37.102697 IP 62.112.211.190.443 > 192.168.50.110.52954: tcp 1460
12:16:37.102711 IP 62.112.211.190.443 > 192.168.50.110.52954: tcp 1460
12:16:37.102722 IP 62.112.211.190.443 > 192.168.50.110.52954: tcp 1460
12:16:37.104563 IP 192.168.50.110.52954 > 62.112.211.190.443: tcp 0
12:16:37.105807 IP 192.168.50.139.61707 > 204.79.197.203.443: tcp 0
12:16:37.107208 IP 62.112.211.190.443 > 192.168.50.110.52954: tcp 1460
12:16:37.107220 IP 62.112.211.190.443 > 192.168.50.110.52954: tcp 1460
12:16:37.107241 IP 62.112.211.190.443 > 192.168.50.110.52954: tcp 1460
12:16:37.107253 IP 62.112.211.190.443 > 192.168.50.110.52954: tcp 1460
12:16:37.107275 IP 62.112.211.190.443 > 192.168.50.110.52954: tcp 1460
12:16:37.107307 IP 62.112.211.190.443 > 192.168.50.110.52954: tcp 1460
12:16:37.107687 IP 62.112.211.190.443 > 192.168.50.110.52954: tcp 1460
12:16:37.107699 IP 62.112.211.190.443 > 192.168.50.110.52954: tcp 1460
12:16:37.107713 IP 62.112.211.190.443 > 192.168.50.110.52954: tcp 1460
12:16:37.107724 IP 62.112.211.190.443 > 192.168.50.110.52954: tcp 1460
12:16:37.107737 IP 62.112.211.190.443 > 192.168.50.110.52954: tcp 1460
12:16:37.107749 IP 62.112.211.190.443 > 192.168.50.110.52954: tcp 1460
12:16:37.108491 IP 62.112.211.190.443 > 192.168.50.110.52954: tcp 1460
12:16:37.108503 IP 62.112.211.190.443 > 192.168.50.110.52954: tcp 1460
12:16:37.108557 IP 62.112.211.190.443 > 192.168.50.110.52954: tcp 1460
12:16:37.108566 IP 62.112.211.190.443 > 192.168.50.110.52954: tcp 1460
12:16:37.108580 IP 62.112.211.190.443 > 192.168.50.110.52954: tcp 1460
12:16:37.108590 IP 62.112.211.190.443 > 192.168.50.110.52954: tcp 1460
12:16:37.108602 IP 62.112.211.190.443 > 192.168.50.110.52954: tcp 1460
12:16:37.108614 IP 62.112.211.190.443 > 192.168.50.110.52954: tcp 1460
12:16:37.109184 IP 192.168.50.110.52954 > 62.112.211.190.443: tcp 0
12:16:37.109196 IP 192.168.50.110.52954 > 62.112.211.190.443: tcp 0
12:16:37.109477 IP 62.112.211.190.443 > 192.168.50.110.52954: tcp 1460
12:16:37.109508 IP 62.112.211.190.443 > 192.168.50.110.52954: tcp 1460
12:16:37.109518 IP 62.112.211.190.443 > 192.168.50.110.52954: tcp 1460
12:16:37.109530 IP 62.112.211.190.443 > 192.168.50.110.52954: tcp 1460
12:16:37.109544 IP 62.112.211.190.443 > 192.168.50.110.52954: tcp 1460
12:16:37.109553 IP 62.112.211.190.443 > 192.168.50.110.52954: tcp 1460
12:16:37.109567 IP 62.112.211.190.443 > 192.168.50.110.52954: tcp 1460
12:16:37.109579 IP 62.112.211.190.443 > 192.168.50.110.52954: tcp 1460
12:16:37.109591 IP 62.112.211.190.443 > 192.168.50.110.52954: tcp 1460
12:16:37.109603 IP 62.112.211.190.443 > 192.168.50.110.52954: tcp 1460
12:16:37.111677 IP 192.168.50.110.52954 > 62.112.211.190.443: tcp 0
12:16:37.113915 IP 62.112.211.190.443 > 192.168.50.110.52954: tcp 1460
12:16:37.113927 IP 62.112.211.190.443 > 192.168.50.110.52954: tcp 1460
12:16:37.113949 IP 62.112.211.190.443 > 192.168.50.110.52954: tcp 1460
12:16:37.113960 IP 62.112.211.190.443 > 192.168.50.110.52954: tcp 1460
12:16:37.113974 IP 62.112.211.190.443 > 192.168.50.110.52954: tcp 1460
12:16:37.113985 IP 62.112.211.190.443 > 192.168.50.110.52954: tcp 1460
12:16:37.113998 IP 62.112.211.190.443 > 192.168.50.110.52954: tcp 1460
12:16:37.114009 IP 62.112.211.190.443 > 192.168.50.110.52954: tcp 1460
12:16:37.114022 IP 62.112.211.190.443 > 192.168.50.110.52954: tcp 1460
12:16:37.114040 IP 62.112.211.190.443 > 192.168.50.110.52954: tcp 1460
12:16:37.114076 IP 204.79.197.203.443 > 192.168.50.139.61707: tcp 0
12:16:37.114090 IP 204.79.197.203.443 > 192.168.50.139.61707: tcp 0
12:16:37.114384 IP 62.112.211.190.443 > 192.168.50.110.52954: tcp 1460
12:16:37.114396 IP 62.112.211.190.443 > 192.168.50.110.52954: tcp 1460
12:16:37.114410 IP 62.112.211.190.443 > 192.168.50.110.52954: tcp 1460
12:16:37.114421 IP 62.112.211.190.443 > 192.168.50.110.52954: tcp 1460
12:16:37.114434 IP 62.112.211.190.443 > 192.168.50.110.52954: tcp 1460
12:16:37.114446 IP 62.112.211.190.443 > 192.168.50.110.52954: tcp 1460
12:16:37.114458 IP 62.112.211.190.443 > 192.168.50.110.52954: tcp 1460
12:16:37.114471 IP 62.112.211.190.443 > 192.168.50.110.52954: tcp 1460
12:16:37.114481 IP 62.112.211.190.443 > 192.168.50.110.52954: tcp 170
12:16:37.116285 IP 192.168.50.110.52954 > 62.112.211.190.443: tcp 0
12:16:37.116503 IP 192.168.50.110.52954 > 62.112.211.190.443: tcp 0
12:16:37.117189 IP 192.168.50.139.61709 > 204.79.197.203.443: tcp 0
12:16:37.117196 IP 192.168.50.139.61707 > 204.79.197.203.443: tcp 0
12:16:37.125560 IP 204.79.197.203.443 > 192.168.50.139.61709: tcp 0
12:16:37.128269 IP 192.168.50.139.61709 > 204.79.197.203.443: tcp 0
12:16:37.128339 IP 192.168.50.139.61709 > 204.79.197.203.443: tcp 585
12:16:37.136556 IP 204.79.197.203.443 > 192.168.50.139.61709: tcp 0
12:16:37.136760 IP 204.79.197.203.443 > 192.168.50.139.61709: tcp 150
12:16:37.139266 IP 192.168.50.139.61709 > 204.79.197.203.443: tcp 51
12:16:37.139279 IP 192.168.50.139.61709 > 204.79.197.203.443: tcp 99
12:16:37.139330 IP 192.168.50.139.61709 > 204.79.197.203.443: tcp 1206
12:16:37.147444 IP 204.79.197.203.443 > 192.168.50.139.61709: tcp 0
12:16:37.147531 IP 204.79.197.203.443 > 192.168.50.139.61709: tcp 0
12:16:37.147648 IP 204.79.197.203.443 > 192.168.50.139.61709: tcp 69
12:16:37.150264 IP 192.168.50.139.61709 > 204.79.197.203.443: tcp 38
12:16:37.158439 IP 204.79.197.203.443 > 192.168.50.139.61709: tcp 38
12:16:37.192455 IP 204.79.197.203.443 > 192.168.50.139.61709: tcp 1460
12:16:37.192468 IP 204.79.197.203.443 > 192.168.50.139.61709: tcp 1460
12:16:37.192481 IP 204.79.197.203.443 > 192.168.50.139.61709: tcp 1460
12:16:37.192496 IP 204.79.197.203.443 > 192.168.50.139.61709: tcp 1460
12:16:37.192508 IP 204.79.197.203.443 > 192.168.50.139.61709: tcp 734
12:16:37.192516 IP 204.79.197.203.443 > 192.168.50.139.61709: tcp 43
12:16:37.192525 IP 204.79.197.203.443 > 192.168.50.139.61709: tcp 468
12:16:37.192539 IP 204.79.197.203.443 > 192.168.50.139.61709: tcp 1460
12:16:37.192550 IP 204.79.197.203.443 > 192.168.50.139.61709: tcp 1460
12:16:37.192559 IP 204.79.197.203.443 > 192.168.50.139.61709: tcp 1158
12:16:37.192568 IP 204.79.197.203.443 > 192.168.50.139.61709: tcp 88
12:16:37.192622 IP 204.79.197.203.443 > 192.168.50.139.61709: tcp 1460
12:16:37.192635 IP 204.79.197.203.443 > 192.168.50.139.61709: tcp 1460
12:16:37.192644 IP 204.79.197.203.443 > 192.168.50.139.61709: tcp 1214
12:16:37.192654 IP 204.79.197.203.443 > 192.168.50.139.61709: tcp 44
12:16:37.192681 IP 204.79.197.203.443 > 192.168.50.139.61709: tcp 1460
12:16:37.192695 IP 204.79.197.203.443 > 192.168.50.139.61709: tcp 1460
12:16:37.192705 IP 204.79.197.203.443 > 192.168.50.139.61709: tcp 1147
12:16:37.192715 IP 204.79.197.203.443 > 192.168.50.139.61709: tcp 99
12:16:37.192736 IP 204.79.197.203.443 > 192.168.50.139.61709: tcp 1460
12:16:37.192749 IP 204.79.197.203.443 > 192.168.50.139.61709: tcp 1460
12:16:37.196900 IP 192.168.50.139.61709 > 204.79.197.203.443: tcp 0
12:16:37.196913 IP 192.168.50.139.61709 > 204.79.197.203.443: tcp 0
12:16:37.196920 IP 192.168.50.139.61709 > 204.79.197.203.443: tcp 0
12:16:37.196932 IP 192.168.50.139.61709 > 204.79.197.203.443: tcp 0
12:16:37.196939 IP 192.168.50.139.61709 > 204.79.197.203.443: tcp 0
12:16:37.196946 IP 192.168.50.139.61709 > 204.79.197.203.443: tcp 0
12:16:37.197976 IP 192.168.50.139.61709 > 204.79.197.203.443: tcp 0
12:16:37.197985 IP 192.168.50.139.61709 > 204.79.197.203.443: tcp 0
12:16:37.199446 IP 192.168.50.139.61709 > 204.79.197.203.443: tcp 0
12:16:37.205617 IP 204.79.197.203.443 > 192.168.50.139.61709: tcp 1460
12:16:37.205634 IP 204.79.197.203.443 > 192.168.50.139.61709: tcp 1460
12:16:37.205647 IP 204.79.197.203.443 > 192.168.50.139.61709: tcp 1460
12:16:37.205657 IP 204.79.197.203.443 > 192.168.50.139.61709: tcp 1460
12:16:37.205670 IP 204.79.197.203.443 > 192.168.50.139.61709: tcp 1460
12:16:37.205679 IP 204.79.197.203.443 > 192.168.50.139.61709: tcp 1460
12:16:37.205691 IP 204.79.197.203.443 > 192.168.50.139.61709: tcp 1460
12:16:37.205704 IP 204.79.197.203.443 > 192.168.50.139.61709: tcp 1460
12:16:37.205717 IP 204.79.197.203.443 > 192.168.50.139.61709: tcp 1460
12:16:37.205728 IP 204.79.197.203.443 > 192.168.50.139.61709: tcp 1460
12:16:37.205743 IP 204.79.197.203.443 > 192.168.50.139.61709: tcp 1460
12:16:37.205752 IP 204.79.197.203.443 > 192.168.50.139.61709: tcp 1243
12:16:37.209504 IP 192.168.50.139.61709 > 204.79.197.203.443: tcp 0
12:16:37.211434 IP 192.168.50.139.61709 > 204.79.197.203.443: tcp 0
12:16:37.640824 IP 192.168.50.110.57621 > 192.168.50.255.57621: UDP, length 44
12:16:37.771508 ARP, Request who-has 192.168.50.1 (00:08:a2:0e:fd:02) tell 192.168.50.101, length 42
12:16:37.771514 ARP, Reply 192.168.50.1 is-at 00:08:a2:0e:fd:02, length 28
12:16:39.636259 IP 192.168.50.139.61710 > 104.18.42.171.443: tcp 0
12:16:39.640879 IP 104.18.42.171.443 > 192.168.50.139.61710: tcp 0
12:16:39.644510 IP 192.168.50.139.61710 > 104.18.42.171.443: tcp 0
12:16:39.644542 IP 192.168.50.139.61710 > 104.18.42.171.443: tcp 517
12:16:39.649081 IP 104.18.42.171.443 > 192.168.50.139.61710: tcp 0
12:16:39.650677 IP 104.18.42.171.443 > 192.168.50.139.61710: tcp 1460
12:16:39.650688 IP 104.18.42.171.443 > 192.168.50.139.61710: tcp 629
12:16:39.653310 IP 192.168.50.139.61710 > 104.18.42.171.443: tcp 0
12:16:39.654253 IP 192.168.50.139.61710 > 104.18.42.171.443: tcp 64
12:16:39.654263 IP 192.168.50.139.61710 > 104.18.42.171.443: tcp 92
12:16:39.654275 IP 192.168.50.139.61710 > 104.18.42.171.443: tcp 126
12:16:39.654283 IP 192.168.50.139.61710 > 104.18.42.171.443: tcp 55
12:16:39.654292 IP 192.168.50.139.61710 > 104.18.42.171.443: tcp 159
12:16:39.654299 IP 192.168.50.139.61710 > 104.18.42.171.443: tcp 159
12:16:39.658737 IP 104.18.42.171.443 > 192.168.50.139.61710: tcp 0
12:16:39.658801 IP 104.18.42.171.443 > 192.168.50.139.61710: tcp 0
12:16:39.658813 IP 104.18.42.171.443 > 192.168.50.139.61710: tcp 0
12:16:39.658834 IP 104.18.42.171.443 > 192.168.50.139.61710: tcp 0
12:16:39.658867 IP 104.18.42.171.443 > 192.168.50.139.61710: tcp 0
12:16:39.659565 IP 104.18.42.171.443 > 192.168.50.139.61710: tcp 563
12:16:39.659891 IP 104.18.42.171.443 > 192.168.50.139.61710: tcp 594
12:16:39.660668 IP 104.18.42.171.443 > 192.168.50.139.61710: tcp 531
12:16:39.662365 IP 192.168.50.139.61710 > 104.18.42.171.443: tcp 31
12:16:39.662375 IP 192.168.50.139.61710 > 104.18.42.171.443: tcp 0
12:16:39.663786 IP 192.168.50.139.61711 > 204.79.197.203.443: tcp 0
12:16:39.663798 IP 192.168.50.139.61712 > 2.18.79.7.443: tcp 0
12:16:39.664795 IP 192.168.50.139.61713 > 2.18.79.7.443: tcp 0
12:16:39.666064 IP 192.168.50.139.61710 > 104.18.42.171.443: tcp 55
12:16:39.666075 IP 192.168.50.139.61710 > 104.18.42.171.443: tcp 159
12:16:39.666862 IP 104.18.42.171.443 > 192.168.50.139.61710: tcp 0
12:16:39.666880 IP 192.168.50.139.61710 > 104.18.42.171.443: tcp 55
12:16:39.666892 IP 192.168.50.139.61710 > 104.18.42.171.443: tcp 159
12:16:39.666901 IP 192.168.50.139.61710 > 104.18.42.171.443: tcp 55
12:16:39.666909 IP 192.168.50.139.61710 > 104.18.42.171.443: tcp 159
12:16:39.670573 IP 104.18.42.171.443 > 192.168.50.139.61710: tcp 0
12:16:39.670583 IP 104.18.42.171.443 > 192.168.50.139.61710: tcp 0
12:16:39.671183 IP 104.18.42.171.443 > 192.168.50.139.61710: tcp 35
12:16:39.671357 IP 104.18.42.171.443 > 192.168.50.139.61710: tcp 0
12:16:39.671552 IP 104.18.42.171.443 > 192.168.50.139.61710: tcp 35
12:16:39.671977 IP 104.18.42.171.443 > 192.168.50.139.61710: tcp 35
12:16:39.672116 IP 104.18.42.171.443 > 192.168.50.139.61710: tcp 532
12:16:39.672259 IP 104.18.42.171.443 > 192.168.50.139.61710: tcp 532
12:16:39.672374 IP 104.18.42.171.443 > 192.168.50.139.61710: tcp 532
12:16:39.672640 IP 204.79.197.203.443 > 192.168.50.139.61711: tcp 0
12:16:39.673707 IP 192.168.50.139.61710 > 104.18.42.171.443: tcp 0
12:16:39.674274 IP 192.168.50.139.61710 > 104.18.42.171.443: tcp 0
12:16:39.674284 IP 192.168.50.139.61711 > 204.79.197.203.443: tcp 0
12:16:39.674805 IP 192.168.50.139.61711 > 204.79.197.203.443: tcp 517
12:16:39.683026 IP 204.79.197.203.443 > 192.168.50.139.61711: tcp 0
12:16:39.683776 IP 2.18.79.7.443 > 192.168.50.139.61712: tcp 0
12:16:39.684210 IP 204.79.197.203.443 > 192.168.50.139.61711: tcp 1460
12:16:39.684224 IP 204.79.197.203.443 > 192.168.50.139.61711: tcp 1460
12:16:39.684236 IP 204.79.197.203.443 > 192.168.50.139.61711: tcp 1460
12:16:39.684246 IP 204.79.197.203.443 > 192.168.50.139.61711: tcp 1311
12:16:39.685206 IP 2.18.79.7.443 > 192.168.50.139.61713: tcp 0
12:16:39.686288 IP 192.168.50.139.61712 > 2.18.79.7.443: tcp 0
12:16:39.686320 IP 192.168.50.139.61712 > 2.18.79.7.443: tcp 517
12:16:39.686706 IP 192.168.50.139.61711 > 204.79.197.203.443: tcp 0
12:16:39.687221 IP 192.168.50.139.61711 > 204.79.197.203.443: tcp 0
12:16:39.687733 IP 192.168.50.139.61713 > 2.18.79.7.443: tcp 0
12:16:39.687840 IP 192.168.50.139.61713 > 2.18.79.7.443: tcp 517
12:16:39.706222 IP 2.18.79.7.443 > 192.168.50.139.61712: tcp 0
12:16:39.706677 IP 2.18.79.7.443 > 192.168.50.139.61712: tcp 1460
12:16:39.706691 IP 2.18.79.7.443 > 192.168.50.139.61712: tcp 1460
12:16:39.706703 IP 2.18.79.7.443 > 192.168.50.139.61712: tcp 1176
12:16:39.707709 IP 2.18.79.7.443 > 192.168.50.139.61712: tcp 1460
12:16:39.708159 IP 2.18.79.7.443 > 192.168.50.139.61713: tcp 0
12:16:39.708645 IP 2.18.79.7.443 > 192.168.50.139.61713: tcp 1460
12:16:39.708657 IP 2.18.79.7.443 > 192.168.50.139.61713: tcp 1460
12:16:39.708669 IP 2.18.79.7.443 > 192.168.50.139.61713: tcp 1176
12:16:39.709256 IP 192.168.50.139.61712 > 2.18.79.7.443: tcp 0
12:16:39.710406 IP 192.168.50.139.61712 > 2.18.79.7.443: tcp 0
12:16:39.710830 IP 2.18.79.7.443 > 192.168.50.139.61713: tcp 1460
12:16:39.714172 IP 192.168.50.139.61713 > 2.18.79.7.443: tcp 0
12:16:39.729155 IP 2.18.79.7.443 > 192.168.50.139.61712: tcp 489
12:16:39.734536 IP 2.18.79.7.443 > 192.168.50.139.61713: tcp 489
12:16:39.783364 IP 192.168.50.139.61712 > 2.18.79.7.443: tcp 0
12:16:39.783375 IP 192.168.50.139.61713 > 2.18.79.7.443: tcp 0
12:16:40.031005 IP 192.168.50.110.51121 > 35.186.224.40.443: tcp 43
12:16:40.041318 IP 35.186.224.40.443 > 192.168.50.110.51121: tcp 0
12:16:40.057011 IP 35.186.224.40.443 > 192.168.50.110.51121: tcp 40
12:16:40.108141 IP 192.168.50.110.51121 > 35.186.224.40.443: tcp 0
12:16:40.251517 IP 192.168.50.139.61710 > 104.18.42.171.443: tcp 55
12:16:40.251530 IP 192.168.50.139.61710 > 104.18.42.171.443: tcp 159
12:16:40.251967 IP 192.168.50.139.61710 > 104.18.42.171.443: tcp 55
12:16:40.252111 IP 192.168.50.139.61710 > 104.18.42.171.443: tcp 159
12:16:40.254814 IP 192.168.50.139.61710 > 104.18.42.171.443: tcp 55
12:16:40.254824 IP 192.168.50.139.61710 > 104.18.42.171.443: tcp 159
12:16:40.256113 IP 104.18.42.171.443 > 192.168.50.139.61710: tcp 0
12:16:40.256125 IP 104.18.42.171.443 > 192.168.50.139.61710: tcp 0
12:16:40.256457 IP 104.18.42.171.443 > 192.168.50.139.61710: tcp 0
12:16:40.256600 IP 104.18.42.171.443 > 192.168.50.139.61710: tcp 0
12:16:40.256794 IP 104.18.42.171.443 > 192.168.50.139.61710: tcp 35
12:16:40.257170 IP 104.18.42.171.443 > 192.168.50.139.61710: tcp 35
12:16:40.257828 IP 104.18.42.171.443 > 192.168.50.139.61710: tcp 555
12:16:40.258026 IP 104.18.42.171.443 > 192.168.50.139.61710: tcp 532
12:16:40.259425 IP 104.18.42.171.443 > 192.168.50.139.61710: tcp 0
12:16:40.259932 IP 104.18.42.171.443 > 192.168.50.139.61710: tcp 35
12:16:40.260484 IP 104.18.42.171.443 > 192.168.50.139.61710: tcp 532
12:16:40.265139 IP 192.168.50.139.61710 > 104.18.42.171.443: tcp 0
12:16:40.265841 IP 192.168.50.139.61710 > 104.18.42.171.443: tcp 0
12:16:40.267826 IP 192.168.50.139.61711 > 204.79.197.203.443: tcp 158
12:16:40.270726 IP 192.168.50.139.61712 > 2.18.79.7.443: tcp 80
12:16:40.270731 IP 192.168.50.139.61713 > 2.18.79.7.443: tcp 80
12:16:40.271936 IP 192.168.50.139.60699 > 239.255.255.250.1900: UDP, length 175
12:16:40.272937 IP 192.168.50.139.61715 > 13.107.21.200.443: tcp 0
12:16:40.273372 IP 192.168.50.139.61716 > 108.157.4.121.443: tcp 0
12:16:40.273822 IP 192.168.50.139.61717 > 2.22.22.64.443: tcp 0
12:16:40.274938 IP 192.168.50.139.61718 > 20.234.93.27.443: tcp 0
12:16:40.275058 IP 192.168.50.139.61719 > 204.79.197.200.443: tcp 0
12:16:40.276022 IP 204.79.197.203.443 > 192.168.50.139.61711: tcp 0
12:16:40.276090 IP 192.168.50.139.61720 > 2.18.79.7.443: tcp 0
12:16:40.276860 IP 192.168.50.139.61721 > 2.18.79.7.443: tcp 0
12:16:40.277635 IP 204.79.197.203.443 > 192.168.50.139.61711: tcp 326
12:16:40.277698 IP 204.79.197.203.443 > 192.168.50.139.61711: tcp 69
12:16:40.279484 IP 192.168.50.139.61711 > 204.79.197.203.443: tcp 0
12:16:40.281358 IP 13.107.21.200.443 > 192.168.50.139.61715: tcp 0
12:16:40.283110 IP 192.168.50.139.61715 > 13.107.21.200.443: tcp 0
12:16:40.283201 IP 192.168.50.139.61715 > 13.107.21.200.443: tcp 517
12:16:40.283407 IP 204.79.197.200.443 > 192.168.50.139.61719: tcp 0
12:16:40.285222 IP 192.168.50.139.61719 > 204.79.197.200.443: tcp 0
12:16:40.285312 IP 192.168.50.139.61719 > 204.79.197.200.443: tcp 517
12:16:40.290643 IP 2.18.79.7.443 > 192.168.50.139.61712: tcp 0
12:16:40.291068 IP 2.18.79.7.443 > 192.168.50.139.61713: tcp 0
12:16:40.291168 IP 2.18.79.7.443 > 192.168.50.139.61713: tcp 271
12:16:40.291201 IP 2.18.79.7.443 > 192.168.50.139.61713: tcp 271
12:16:40.291416 IP 13.107.21.200.443 > 192.168.50.139.61715: tcp 0
12:16:40.291734 IP 2.18.79.7.443 > 192.168.50.139.61712: tcp 271
12:16:40.291785 IP 2.18.79.7.443 > 192.168.50.139.61712: tcp 271
12:16:40.292817 IP 13.107.21.200.443 > 192.168.50.139.61715: tcp 1460
12:16:40.292828 IP 13.107.21.200.443 > 192.168.50.139.61715: tcp 1460
12:16:40.292842 IP 13.107.21.200.443 > 192.168.50.139.61715: tcp 1460
12:16:40.292854 IP 13.107.21.200.443 > 192.168.50.139.61715: tcp 1460
12:16:40.292866 IP 13.107.21.200.443 > 192.168.50.139.61715: tcp 1193
12:16:40.293522 IP 204.79.197.200.443 > 192.168.50.139.61719: tcp 0
12:16:40.293577 IP 192.168.50.139.61713 > 2.18.79.7.443: tcp 0
12:16:40.293587 IP 192.168.50.139.61712 > 2.18.79.7.443: tcp 0
12:16:40.294875 IP 204.79.197.200.443 > 192.168.50.139.61719: tcp 1460
12:16:40.294889 IP 204.79.197.200.443 > 192.168.50.139.61719: tcp 1460
12:16:40.294900 IP 204.79.197.200.443 > 192.168.50.139.61719: tcp 1460
12:16:40.294913 IP 204.79.197.200.443 > 192.168.50.139.61719: tcp 1460
12:16:40.294922 IP 204.79.197.200.443 > 192.168.50.139.61719: tcp 1193
12:16:40.295658 IP 192.168.50.139.61715 > 13.107.21.200.443: tcp 0
12:16:40.296004 IP 2.18.79.7.443 > 192.168.50.139.61720: tcp 0
12:16:40.296829 IP 108.157.4.121.443 > 192.168.50.139.61716: tcp 0
12:16:40.296962 IP 2.18.79.7.443 > 192.168.50.139.61721: tcp 0
12:16:40.299321 IP 192.168.50.139.61719 > 204.79.197.200.443: tcp 0
12:16:40.299330 IP 192.168.50.139.61720 > 2.18.79.7.443: tcp 0
12:16:40.299333 IP 192.168.50.139.61716 > 108.157.4.121.443: tcp 0
12:16:40.299722 IP 192.168.50.139.61721 > 2.18.79.7.443: tcp 0
12:16:40.302169 IP 192.168.50.139.61715 > 13.107.21.200.443: tcp 158
12:16:40.302363 IP 192.168.50.139.61720 > 2.18.79.7.443: tcp 517
12:16:40.302440 IP 192.168.50.139.61721 > 2.18.79.7.443: tcp 517
12:16:40.303061 IP 192.168.50.139.61716 > 108.157.4.121.443: tcp 517
12:16:40.303381 IP 2.22.22.64.443 > 192.168.50.139.61717: tcp 0
12:16:40.305660 IP 192.168.50.139.61717 > 2.22.22.64.443: tcp 0
12:16:40.309814 IP 192.168.50.139.61719 > 204.79.197.200.443: tcp 158
12:16:40.309883 IP 192.168.50.139.61717 > 2.22.22.64.443: tcp 517
12:16:40.310404 IP 13.107.21.200.443 > 192.168.50.139.61715: tcp 0
12:16:40.312497 IP 13.107.21.200.443 > 192.168.50.139.61715: tcp 342
12:16:40.312635 IP 13.107.21.200.443 > 192.168.50.139.61715: tcp 69
12:16:40.313561 IP 20.234.93.27.443 > 192.168.50.139.61718: tcp 0
