17:40:20.202055 IP 142.251.39.37.443 > 192.168.10.139.56519: tcp 616
17:40:20.202073 IP 142.251.39.37.443 > 192.168.10.139.56519: tcp 331
17:40:20.202265 IP 192.168.10.139.56519 > 142.251.39.37.443: tcp 0
17:40:20.203244 IP 192.168.10.139.56519 > 142.251.39.37.443: tcp 0
17:40:20.204746 IP 192.168.10.139.56519 > 142.251.39.37.443: tcp 35
17:40:20.208052 IP 142.251.39.37.443 > 192.168.10.139.56519: tcp 223
17:40:20.208078 IP 142.251.39.37.443 > 192.168.10.139.56519: tcp 138
17:40:20.208150 IP 142.251.39.37.443 > 192.168.10.139.56519: tcp 39
17:40:20.209852 IP 192.168.10.139.56519 > 142.251.39.37.443: tcp 0
17:40:20.210889 IP 192.168.10.139.56519 > 142.251.39.37.443: tcp 39
17:40:20.214268 IP 142.251.39.37.443 > 192.168.10.139.56519: tcp 0
17:40:20.220627 IP 142.251.39.37.443 > 192.168.10.139.56519: tcp 0
17:40:20.359949 IP 192.168.10.246.46808 > 192.168.10.1.10051: tcp 0
17:40:21.356490 IP 192.168.10.246.46808 > 192.168.10.1.10051: tcp 0
17:40:21.422337 IP 192.168.10.79.49154 > 148.6.0.1.123: UDP, length 48
17:40:21.427292 IP 148.6.0.1.123 > 192.168.10.79.49154: UDP, length 48
17:40:21.906482 IP6 fe80::208:a2ff:fe0e:fd02 > ff02::1: ICMP6, router advertisement, length 56
17:40:22.012664 IP 192.168.10.139.52848 > 142.251.39.10.443: UDP, length 33
17:40:22.019209 IP 142.251.39.10.443 > 192.168.10.139.52848: UDP, length 25
17:40:22.110778 IP 142.251.39.74.443 > 192.168.10.173.62098: UDP, length 393
17:40:22.112629 IP 192.168.10.173.62098 > 142.251.39.74.443: UDP, length 33
17:40:22.625867 IP 192.168.10.24.46268 > 91.82.92.228.110: tcp 0
17:40:22.732783 IP 192.168.10.91.138 > 192.168.10.255.138: UDP, length 201
17:40:22.988695 ARP, Request who-has 192.168.10.1 tell 192.168.10.31, length 46
17:40:22.988703 ARP, Reply 192.168.10.1 is-at 00:08:a2:0e:fd:02, length 28
17:40:23.632441 ARP, Request who-has 192.168.10.168 tell 192.168.10.91, length 46
17:40:23.832750 IP 192.168.10.2.61265 > 192.168.10.1.10051: tcp 0
17:40:24.142727 IP 192.168.10.139.55266 > 142.251.39.14.443: UDP, length 1246
17:40:24.142969 IP 192.168.10.139.55266 > 142.251.39.14.443: UDP, length 603
17:40:24.147777 IP 142.251.39.14.443 > 192.168.10.139.55266: UDP, length 27
17:40:24.173792 IP 142.251.39.14.443 > 192.168.10.139.55266: UDP, length 25
17:40:24.175122 IP 192.168.10.139.55266 > 142.251.39.14.443: UDP, length 33
17:40:24.179208 IP 142.251.39.14.443 > 192.168.10.139.55266: UDP, length 570
17:40:24.179439 IP 142.251.39.14.443 > 192.168.10.139.55266: UDP, length 72
17:40:24.180697 IP 192.168.10.139.55266 > 142.251.39.14.443: UDP, length 35
17:40:24.210594 IP 142.251.39.14.443 > 192.168.10.139.55266: UDP, length 25
17:40:24.212005 IP 192.168.10.139.55266 > 142.251.39.14.443: UDP, length 33
17:40:24.213616 IP 142.251.39.14.443 > 192.168.10.139.55266: UDP, length 25
17:40:24.215564 IP 192.168.10.139.55266 > 142.251.39.14.443: UDP, length 33
17:40:24.460485 ARP, Request who-has 192.168.10.168 tell 192.168.10.91, length 46
17:40:25.036039 IP 192.168.10.18.38769 > 142.93.235.17.4000: UDP, length 148
17:40:25.209587 IP 192.168.10.199.36901 > 52.50.192.84.31004: tcp 1400
17:40:25.209602 IP 192.168.10.199.36901 > 52.50.192.84.31004: tcp 277
17:40:25.252724 IP 52.50.192.84.31004 > 192.168.10.199.36901: tcp 0
17:40:25.361718 IP 192.168.10.199.49808 > 54.246.34.179.31004: tcp 282
17:40:25.368467 ARP, Request who-has 192.168.10.1 tell 192.168.10.246, length 46
17:40:25.368472 ARP, Reply 192.168.10.1 is-at 00:08:a2:0e:fd:02, length 28
17:40:25.404685 IP 54.246.34.179.31004 > 192.168.10.199.49808: tcp 0
17:40:25.422522 IP 192.168.10.199.59628 > 49.51.172.104.6002: UDP, length 160
17:40:25.425886 IP 192.168.10.199.59628 > 49.51.172.104.6002: UDP, length 160
17:40:25.426820 IP 192.168.10.199.59628 > 49.51.172.104.6002: UDP, length 160
17:40:25.430914 IP 192.168.10.199.59628 > 49.51.172.104.6002: UDP, length 160
17:40:25.432363 IP 192.168.10.199.59628 > 49.51.172.104.6002: UDP, length 160
17:40:25.441002 IP 49.51.172.104.6002 > 192.168.10.199.59628: UDP, length 196
17:40:25.444344 IP 49.51.172.104.6002 > 192.168.10.199.59628: UDP, length 196
17:40:25.445339 IP 49.51.172.104.6002 > 192.168.10.199.59628: UDP, length 196
17:40:25.447278 IP 192.168.10.199.59628 > 49.51.172.104.6002: UDP, length 160
17:40:25.447310 IP 192.168.10.199.59628 > 49.51.172.104.6002: UDP, length 160
17:40:25.447319 IP 192.168.10.199.59628 > 49.51.172.104.6002: UDP, length 160
17:40:25.447342 IP 192.168.10.199.59628 > 49.51.172.104.6002: UDP, length 160
17:40:25.447353 IP 192.168.10.199.59628 > 49.51.172.104.6002: UDP, length 160
17:40:25.449353 IP 49.51.172.104.6002 > 192.168.10.199.59628: UDP, length 196
17:40:25.450800 IP 49.51.172.104.6002 > 192.168.10.199.59628: UDP, length 196
17:40:25.460519 ARP, Request who-has 192.168.10.168 tell 192.168.10.91, length 46
17:40:25.469457 IP 54.246.34.179.31004 > 192.168.10.199.49808: tcp 142
17:40:25.471434 IP 192.168.10.199.49808 > 54.246.34.179.31004: tcp 0
17:40:25.827828 IP 172.16.32.242.58115 > 192.168.10.2.1433: tcp 142
17:40:25.828743 IP 192.168.10.2.1433 > 172.16.32.242.58115: tcp 43
17:40:25.842845 IP 172.16.32.242.58115 > 192.168.10.2.1433: tcp 86
17:40:25.843384 IP 192.168.10.2.1433 > 172.16.32.242.58115: tcp 53
17:40:25.846164 IP 192.168.10.180.59617 > 116.202.208.24.443: tcp 1
17:40:25.857628 IP 172.16.32.242.58115 > 192.168.10.2.1433: tcp 1289
17:40:25.857703 IP 172.16.32.242.58115 > 192.168.10.2.1433: tcp 1286
17:40:25.858055 IP 192.168.10.2.1433 > 172.16.32.242.58115: tcp 0
17:40:25.869281 IP 116.202.208.24.443 > 192.168.10.180.59617: tcp 0
17:40:25.958734 IP 192.168.10.2.1433 > 172.16.32.242.58115: tcp 1289
17:40:25.958745 IP 192.168.10.2.1433 > 172.16.32.242.58115: tcp 1289
17:40:25.958752 IP 192.168.10.2.1433 > 172.16.32.242.58115: tcp 1289
17:40:25.958759 IP 192.168.10.2.1433 > 172.16.32.242.58115: tcp 1289
17:40:25.958774 IP 192.168.10.2.1433 > 172.16.32.242.58115: tcp 1289
17:40:25.958782 IP 192.168.10.2.1433 > 172.16.32.242.58115: tcp 1289
17:40:25.958787 IP 192.168.10.2.1433 > 172.16.32.242.58115: tcp 282
17:40:25.973452 IP 172.16.32.242.58115 > 192.168.10.2.1433: tcp 0
17:40:25.973541 IP 172.16.32.242.58115 > 192.168.10.2.1433: tcp 0
17:40:25.973656 IP 172.16.32.242.58115 > 192.168.10.2.1433: tcp 0
17:40:26.014946 IP 172.16.32.242.58115 > 192.168.10.2.1433: tcp 0
17:40:26.019705 IP 192.168.10.2.1433 > 172.16.32.242.58115: tcp 1289
17:40:26.019716 IP 192.168.10.2.1433 > 172.16.32.242.58115: tcp 1289
17:40:26.019723 IP 192.168.10.2.1433 > 172.16.32.242.58115: tcp 1289
17:40:26.019730 IP 192.168.10.2.1433 > 172.16.32.242.58115: tcp 1035
17:40:26.034069 IP 172.16.32.242.58115 > 192.168.10.2.1433: tcp 0
17:40:26.034169 IP 172.16.32.242.58115 > 192.168.10.2.1433: tcp 0
17:40:26.034312 IP 172.16.32.242.58115 > 192.168.10.2.1433: tcp 16
17:40:26.036484 IP 172.16.32.242.58115 > 192.168.10.2.1433: tcp 142
17:40:26.036902 IP 192.168.10.2.1433 > 172.16.32.242.58115: tcp 0
17:40:26.037312 IP 192.168.10.2.1433 > 172.16.32.242.58115: tcp 43
17:40:26.051311 IP 172.16.32.242.58115 > 192.168.10.2.1433: tcp 86
17:40:26.052047 IP 192.168.10.2.1433 > 172.16.32.242.58115: tcp 53
17:40:26.066187 IP 172.16.32.242.58115 > 192.168.10.2.1433: tcp 1289
17:40:26.066216 IP 172.16.32.242.58115 > 192.168.10.2.1433: tcp 149
17:40:26.066737 IP 192.168.10.2.1433 > 172.16.32.242.58115: tcp 0
17:40:26.068466 IP 192.168.10.2.1433 > 172.16.32.242.58115: tcp 595
17:40:26.124360 IP 172.16.32.242.58115 > 192.168.10.2.1433: tcp 0
17:40:26.462989 IP 192.168.10.199.59628 > 49.51.172.104.6002: UDP, length 160
17:40:26.463019 IP 192.168.10.199.59628 > 49.51.172.104.6002: UDP, length 160
17:40:26.463030 IP 192.168.10.199.59628 > 49.51.172.104.6002: UDP, length 160
17:40:26.463052 IP 192.168.10.199.59628 > 49.51.172.104.6002: UDP, length 160
17:40:26.779007 IP 192.168.10.199.59628 > 49.51.172.104.6002: UDP, length 160
17:40:27.195411 IP 192.168.10.139.55493 > 142.250.102.188.5228: tcp 26
17:40:27.220553 IP 142.250.102.188.5228 > 192.168.10.139.55493: tcp 0
17:40:27.223387 IP 142.250.102.188.5228 > 192.168.10.139.55493: tcp 26
17:40:27.272802 IP 192.168.10.139.55493 > 142.250.102.188.5228: tcp 0
17:40:27.461657 IP 192.168.10.199.59628 > 49.51.172.104.6002: UDP, length 160
17:40:27.461688 IP 192.168.10.199.59628 > 49.51.172.104.6002: UDP, length 160
17:40:27.461697 IP 192.168.10.199.59628 > 49.51.172.104.6002: UDP, length 160
17:40:27.461720 IP 192.168.10.199.59628 > 49.51.172.104.6002: UDP, length 160
17:40:27.461753 IP 192.168.10.199.59628 > 49.51.172.104.6002: UDP, length 160
17:40:27.635834 ARP, Request who-has 192.168.10.1 tell 192.168.10.24, length 46
17:40:27.635840 ARP, Reply 192.168.10.1 is-at 00:08:a2:0e:fd:02, length 28
17:40:27.647989 IP 192.168.10.39.62992 > 255.255.255.255.62976: UDP, length 317
17:40:27.715790 IP 142.251.39.10.443 > 192.168.10.139.52848: UDP, length 79
17:40:27.716825 IP 142.251.39.10.443 > 192.168.10.139.52848: UDP, length 25
17:40:27.719479 IP 192.168.10.139.52848 > 142.251.39.10.443: UDP, length 33
17:40:27.736833 IP 192.168.10.139.57446 > 8.8.4.4.443: UDP, length 1250
17:40:27.737189 IP 192.168.10.139.57446 > 8.8.4.4.443: UDP, length 80
17:40:27.737596 IP 192.168.10.139.57446 > 8.8.4.4.443: UDP, length 246
17:40:27.762935 IP 8.8.4.4.443 > 192.168.10.139.57446: UDP, length 1250
17:40:27.763115 IP 8.8.4.4.443 > 192.168.10.139.57446: UDP, length 628
17:40:27.763123 IP 8.8.4.4.443 > 192.168.10.139.57446: UDP, length 26
17:40:27.765840 IP 192.168.10.139.57446 > 8.8.4.4.443: UDP, length 79
17:40:27.766154 IP 192.168.10.139.57446 > 8.8.4.4.443: UDP, length 33
17:40:27.770356 IP 8.8.4.4.443 > 192.168.10.139.57446: UDP, length 92
17:40:27.770364 IP 8.8.4.4.443 > 192.168.10.139.57446: UDP, length 25
17:40:27.771677 IP 192.168.10.139.57446 > 8.8.4.4.443: UDP, length 33
17:40:27.801289 IP 8.8.4.4.443 > 192.168.10.139.57446: UDP, length 794
17:40:27.801493 IP 8.8.4.4.443 > 192.168.10.139.57446: UDP, length 25
17:40:27.803511 IP 192.168.10.139.57446 > 8.8.4.4.443: UDP, length 35
17:40:27.805849 IP 192.168.10.139.57027 > 142.250.201.202.443: UDP, length 1250
17:40:27.806498 IP 192.168.10.139.57027 > 142.250.201.202.443: UDP, length 80
17:40:27.806834 IP 192.168.10.139.57027 > 142.250.201.202.443: UDP, length 509
17:40:27.807978 IP 8.8.4.4.443 > 192.168.10.139.57446: UDP, length 25
17:40:27.831700 IP 142.250.201.202.443 > 192.168.10.139.57027: UDP, length 1250
17:40:27.832005 IP 142.250.201.202.443 > 192.168.10.139.57027: UDP, length 628
17:40:27.832013 IP 142.250.201.202.443 > 192.168.10.139.57027: UDP, length 26
17:40:27.834588 IP 192.168.10.139.57027 > 142.250.201.202.443: UDP, length 79
17:40:27.834877 IP 192.168.10.139.57027 > 142.250.201.202.443: UDP, length 33
17:40:27.835293 IP 192.168.10.139.57446 > 8.8.4.4.443: UDP, length 33
17:40:27.839099 IP 142.250.201.202.443 > 192.168.10.139.57027: UDP, length 92
17:40:27.839109 IP 142.250.201.202.443 > 192.168.10.139.57027: UDP, length 25
17:40:27.839167 IP 8.8.4.4.443 > 192.168.10.139.57446: UDP, length 25
17:40:27.841198 IP 192.168.10.139.57446 > 8.8.4.4.443: UDP, length 33
17:40:27.841516 IP 192.168.10.139.57027 > 142.250.201.202.443: UDP, length 33
17:40:27.952840 IP 142.250.201.202.443 > 192.168.10.139.57027: UDP, length 292
17:40:27.954189 IP 142.250.201.202.443 > 192.168.10.139.57027: UDP, length 25
17:40:27.955357 IP 192.168.10.139.57027 > 142.250.201.202.443: UDP, length 35
17:40:27.958339 IP 192.168.10.139.52848 > 142.251.39.10.443: UDP, length 536
17:40:27.959869 IP 142.250.201.202.443 > 192.168.10.139.57027: UDP, length 25
17:40:27.963048 IP 142.251.39.10.443 > 192.168.10.139.52848: UDP, length 31
17:40:27.972545 IP 192.168.10.139.52848 > 142.251.39.10.443: UDP, length 33
17:40:27.988564 IP 192.168.10.139.57027 > 142.250.201.202.443: UDP, length 33
17:40:27.990394 IP 142.250.201.202.443 > 192.168.10.139.57027: UDP, length 25
17:40:27.992488 IP 192.168.10.139.57027 > 142.250.201.202.443: UDP, length 33
17:40:28.087996 IP 142.251.39.10.443 > 192.168.10.139.52848: UDP, length 94
17:40:28.090307 IP 192.168.10.139.52848 > 142.251.39.10.443: UDP, length 39
17:40:28.096292 IP 142.251.39.10.443 > 192.168.10.139.52848: UDP, length 25
17:40:28.120555 IP 192.168.10.37.49154 > 148.6.0.1.123: UDP, length 48
17:40:28.125511 IP 148.6.0.1.123 > 192.168.10.37.49154: UDP, length 48
17:40:28.191706 IP 192.168.10.139.56520 > 194.143.245.39.443: tcp 1
17:40:28.195966 IP 194.143.245.39.443 > 192.168.10.139.56520: tcp 0
17:40:28.460659 ARP, Request who-has 192.168.10.179 tell 192.168.10.91, length 46
17:40:28.462091 IP 192.168.10.199.59628 > 49.51.172.104.6002: UDP, length 160
17:40:28.462105 IP 192.168.10.199.59628 > 49.51.172.104.6002: UDP, length 160
17:40:28.462123 IP 192.168.10.199.59628 > 49.51.172.104.6002: UDP, length 160
17:40:28.462154 IP 192.168.10.199.59628 > 49.51.172.104.6002: UDP, length 160
17:40:28.467807 IP 192.168.10.199.59628 > 49.51.172.104.6002: UDP, length 160
17:40:28.681830 IP6 fe80::220:6bff:fe41:5596.546 > ff02::1:2.547: UDP, length 42
17:40:28.784690 ARP, Reply 192.168.10.93 is-at 24:52:6a:9e:fa:67, length 46
17:40:28.812095 IP6 fe80::208:a2ff:fe0e:fd02 > ff02::1: ICMP6, router advertisement, length 56
17:40:28.940324 IP6 fe80::208:a2ff:fe0e:fd02 > ff02::16: HBH ICMP6, multicast listener report v2, 1 group record(s), length 28
17:40:29.015284 ARP, Request who-has 192.168.10.5 tell 192.168.10.70, length 46
17:40:29.375766 IP 185.14.184.154.443 > 192.168.10.139.53462: tcp 0
17:40:29.377667 IP 192.168.10.139.53462 > 185.14.184.154.443: tcp 0
17:40:29.459921 IP 192.168.10.199.59628 > 49.51.172.104.6002: UDP, length 160
17:40:29.459936 IP 192.168.10.199.59628 > 49.51.172.104.6002: UDP, length 160
17:40:29.459955 IP 192.168.10.199.59628 > 49.51.172.104.6002: UDP, length 160
17:40:29.459987 IP 192.168.10.199.59628 > 49.51.172.104.6002: UDP, length 160
17:40:29.464929 IP 192.168.10.199.59628 > 49.51.172.104.6002: UDP, length 160
17:40:29.546047 ARP, Request who-has 192.168.10.5 tell 192.168.10.70, length 46
17:40:29.740283 IP6 fe80::208:a2ff:fe0e:fd02 > ff02::16: HBH ICMP6, multicast listener report v2, 1 group record(s), length 28
17:40:29.742367 IP 192.168.10.199.40965 > 52.17.1.242.6800: tcp 281
17:40:29.785385 IP 52.17.1.242.6800 > 192.168.10.199.40965: tcp 142
17:40:29.829565 IP 192.168.10.199.40965 > 52.17.1.242.6800: tcp 0
17:40:30.421324 IP 172.16.32.242.54828 > 192.168.10.2.1433: tcp 1
17:40:30.421720 IP 192.168.10.2.1433 > 172.16.32.242.54828: tcp 0
17:40:30.457540 IP 192.168.10.2.1433 > 172.16.32.242.54828: tcp 1
17:40:30.459835 IP 192.168.10.199.59628 > 49.51.172.128.6003: UDP, length 160
17:40:30.464169 IP 192.168.10.199.59628 > 49.51.172.128.6003: UDP, length 160
17:40:30.464181 IP 192.168.10.199.59628 > 49.51.172.128.6003: UDP, length 160
17:40:30.464203 IP 192.168.10.199.59628 > 49.51.172.128.6003: UDP, length 160
17:40:30.464919 IP 192.168.10.199.59628 > 49.51.172.128.6003: UDP, length 160
17:40:30.471524 IP 172.16.32.242.54828 > 192.168.10.2.1433: tcp 0
17:40:30.478485 IP 49.51.172.128.6003 > 192.168.10.199.59628: UDP, length 196
17:40:30.482719 IP 49.51.172.128.6003 > 192.168.10.199.59628: UDP, length 196
17:40:30.482728 IP 49.51.172.128.6003 > 192.168.10.199.59628: UDP, length 196
17:40:30.482766 IP 49.51.172.128.6003 > 192.168.10.199.59628: UDP, length 196
17:40:30.483504 IP 49.51.172.128.6003 > 192.168.10.199.59628: UDP, length 196
17:40:30.546065 ARP, Request who-has 192.168.10.5 tell 192.168.10.70, length 46
17:40:30.774106 IP 192.168.10.199.37939 > 49.51.172.104.6002: tcp 0
17:40:30.779994 IP 192.168.10.199 > 49.51.172.128: ICMP 192.168.10.199 udp port 59628 unreachable, length 232
17:40:30.783591 IP 192.168.10.199 > 49.51.172.128: ICMP 192.168.10.199 udp port 59628 unreachable, length 232
17:40:30.792619 IP 49.51.172.104.6002 > 192.168.10.199.37939: tcp 0
17:40:30.800276 IP 192.168.10.199 > 49.51.172.128: ICMP 192.168.10.199 udp port 59628 unreachable, length 232
17:40:30.800995 IP 192.168.10.199 > 49.51.172.128: ICMP 192.168.10.199 udp port 59628 unreachable, length 232
17:40:30.802408 IP 192.168.10.199.37939 > 49.51.172.104.6002: tcp 0
17:40:30.802463 IP 192.168.10.199.37939 > 49.51.172.104.6002: tcp 198
17:40:30.820908 IP 49.51.172.104.6002 > 192.168.10.199.37939: tcp 0
17:40:30.821019 IP 49.51.172.104.6002 > 192.168.10.199.37939: tcp 64
17:40:30.839830 IP 192.168.10.199.37939 > 49.51.172.104.6002: tcp 0
17:40:30.839861 IP 192.168.10.199.37939 > 49.51.172.104.6002: tcp 0
17:40:30.858353 IP 49.51.172.104.6002 > 192.168.10.199.37939: tcp 0
17:40:30.876332 IP 192.168.10.199.37939 > 49.51.172.104.6002: tcp 0
17:40:31.210854 ARP, Request who-has 192.168.10.179 tell 192.168.10.91, length 46
17:40:31.218273 IP 172.16.32.242.54866 > 192.168.10.2.1433: tcp 1
17:40:31.218700 IP 192.168.10.2.1433 > 172.16.32.242.54866: tcp 0
17:40:31.254398 IP 192.168.10.2.1433 > 172.16.32.242.54866: tcp 1
17:40:31.268339 IP 172.16.32.242.54866 > 192.168.10.2.1433: tcp 0
17:40:31.692605 IP 40.113.176.164.8883 > 192.168.10.157.45724: tcp 69
17:40:31.692738 IP 40.113.176.164.8883 > 192.168.10.157.45724: tcp 0
17:40:31.757498 IP 192.168.10.157.45724 > 40.113.176.164.8883: tcp 0
17:40:31.960772 ARP, Request who-has 192.168.10.179 tell 192.168.10.91, length 46
17:40:31.968595 IP 172.16.32.242.58115 > 192.168.10.2.1433: tcp 142
17:40:31.969752 IP 192.168.10.2.1433 > 172.16.32.242.58115: tcp 43
17:40:31.984163 IP 172.16.32.242.58115 > 192.168.10.2.1433: tcp 86
17:40:31.985125 IP 192.168.10.2.1433 > 172.16.32.242.58115: tcp 53
17:40:32.001974 IP 172.16.32.242.58117 > 192.168.10.2.1433: tcp 142
17:40:32.002967 IP 192.168.10.2.1433 > 172.16.32.242.58117: tcp 43
17:40:32.017073 IP 172.16.32.242.58117 > 192.168.10.2.1433: tcp 86
17:40:32.018045 IP 192.168.10.2.1433 > 172.16.32.242.58117: tcp 53
17:40:32.032307 IP 172.16.32.242.58117 > 192.168.10.2.1433: tcp 1289
17:40:32.032392 IP 172.16.32.242.58117 > 192.168.10.2.1433: tcp 744
17:40:32.032931 IP 192.168.10.2.1433 > 172.16.32.242.58117: tcp 0
17:40:32.036250 IP 192.168.10.2.1433 > 172.16.32.242.58117: tcp 1289
17:40:32.036261 IP 192.168.10.2.1433 > 172.16.32.242.58117: tcp 1289
17:40:32.036268 IP 192.168.10.2.1433 > 172.16.32.242.58117: tcp 1289
17:40:32.036275 IP 192.168.10.2.1433 > 172.16.32.242.58117: tcp 1289
17:40:32.036290 IP 192.168.10.2.1433 > 172.16.32.242.58117: tcp 1289
17:40:32.036296 IP 192.168.10.2.1433 > 172.16.32.242.58117: tcp 27
17:40:32.046239 IP 172.16.32.242.58115 > 192.168.10.2.1433: tcp 0
17:40:32.050700 IP 172.16.32.242.58117 > 192.168.10.2.1433: tcp 0
17:40:32.050812 IP 172.16.32.242.58117 > 192.168.10.2.1433: tcp 0
17:40:32.050900 IP 172.16.32.242.58117 > 192.168.10.2.1433: tcp 0
17:40:32.058400 IP 172.16.32.242.58117 > 192.168.10.2.1433: tcp 1289
17:40:32.058510 IP 172.16.32.242.58117 > 192.168.10.2.1433: tcp 1289
17:40:32.058570 IP 172.16.32.242.58117 > 192.168.10.2.1433: tcp 1289
17:40:32.058666 IP 172.16.32.242.58117 > 192.168.10.2.1433: tcp 1289
17:40:32.058768 IP 172.16.32.242.58117 > 192.168.10.2.1433: tcp 1289
17:40:32.058794 IP 172.16.32.242.58117 > 192.168.10.2.1433: tcp 653
17:40:32.059101 IP 192.168.10.2.1433 > 172.16.32.242.58117: tcp 0
17:40:32.115033 IP 192.168.10.2.1433 > 172.16.32.242.58117: tcp 353
17:40:32.171270 IP 172.16.32.242.58117 > 192.168.10.2.1433: tcp 0
17:40:32.301268 IP 192.168.10.2.1433 > 172.16.32.242.54830: tcp 1
17:40:32.311961 IP 172.16.32.242.54830 > 192.168.10.2.1433: tcp 1
17:40:32.312345 IP 192.168.10.2.1433 > 172.16.32.242.54830: tcp 0
17:40:32.315178 IP 172.16.32.242.54830 > 192.168.10.2.1433: tcp 0
17:40:32.379959 IP 192.168.10.253.123 > 162.159.200.123.123: UDP, length 48
17:40:32.384596 IP 162.159.200.123.123 > 192.168.10.253.123: UDP, length 48
17:40:32.551351 ARP, Reply 192.168.10.94 is-at 24:52:6a:9e:fc:64, length 46
17:40:32.692874 IP 192.168.10.3.60794 > 192.168.10.1.53: UDP, length 76
17:40:32.730883 IP 192.168.10.1.53 > 192.168.10.3.60794: UDP, length 92
17:40:32.740625 IP 192.168.10.157.45724 > 40.113.176.164.8883: tcp 69
17:40:32.740660 IP 192.168.10.157.45724 > 40.113.176.164.8883: tcp 0
17:40:32.753681 IP 192.168.10.157.34360 > 40.113.176.163.8883: tcp 0
17:40:32.782484 IP 40.113.176.164.8883 > 192.168.10.157.45724: tcp 0
17:40:32.782780 IP 40.113.176.163.8883 > 192.168.10.157.34360: tcp 0
17:40:32.794960 IP 192.168.10.157.34360 > 40.113.176.163.8883: tcp 0
17:40:32.844870 IP 192.168.10.101.49204 > 171.25.178.74.9523: UDP, length 270
17:40:32.864280 IP 192.168.10.157.34360 > 40.113.176.163.8883: tcp 347
17:40:32.878757 IP 171.25.178.74.9523 > 192.168.10.101.49204: UDP, length 325
17:40:32.895868 IP 40.113.176.163.8883 > 192.168.10.157.34360: tcp 1460
17:40:32.895885 IP 40.113.176.163.8883 > 192.168.10.157.34360: tcp 1460
17:40:32.895895 IP 40.113.176.163.8883 > 192.168.10.157.34360: tcp 1039
17:40:32.960791 ARP, Request who-has 192.168.10.179 tell 192.168.10.91, length 46
17:40:32.976797 IP 192.168.10.157.34360 > 40.113.176.163.8883: tcp 0
17:40:32.984530 IP 40.113.176.163.8883 > 192.168.10.157.34360: tcp 1460
17:40:33.004932 IP 192.168.10.157.34360 > 40.113.176.163.8883: tcp 0
17:40:33.017465 IP 192.168.10.157.34360 > 40.113.176.163.8883: tcp 0
17:40:33.140939 IP 172.16.32.242.58117 > 192.168.10.2.1433: tcp 142
17:40:33.142126 IP 192.168.10.2.1433 > 172.16.32.242.58117: tcp 43
17:40:33.156236 IP 172.16.32.242.58117 > 192.168.10.2.1433: tcp 86
17:40:33.157061 IP 192.168.10.2.1433 > 172.16.32.242.58117: tcp 53
17:40:33.165211 IP 192.168.10.2.138 > 192.168.10.255.138: UDP, length 201
17:40:33.172489 IP 172.16.32.242.58117 > 192.168.10.2.1433: tcp 300
17:40:33.173892 IP 192.168.10.2.1433 > 172.16.32.242.58117: tcp 104
17:40:33.188485 IP 172.16.32.242.58117 > 192.168.10.2.1433: tcp 1289
17:40:33.188594 IP 172.16.32.242.58117 > 192.168.10.2.1433: tcp 1289
17:40:33.188732 IP 172.16.32.242.58117 > 192.168.10.2.1433: tcp 1289
17:40:33.188996 IP 172.16.32.242.58117 > 192.168.10.2.1433: tcp 667
17:40:33.189147 IP 192.168.10.2.1433 > 172.16.32.242.58117: tcp 0
17:40:33.189213 IP 192.168.10.2.1433 > 172.16.32.242.58117: tcp 0
17:40:33.196976 IP 192.168.10.2.1433 > 172.16.32.242.58117: tcp 1255
17:40:33.217768 IP 172.16.32.242.58117 > 192.168.10.2.1433: tcp 1289
17:40:33.217805 IP 172.16.32.242.58117 > 192.168.10.2.1433: tcp 1289
17:40:33.217937 IP 172.16.32.242.58117 > 192.168.10.2.1433: tcp 1289
17:40:33.217978 IP 172.16.32.242.58117 > 192.168.10.2.1433: tcp 771
17:40:33.218422 IP 192.168.10.2.1433 > 172.16.32.242.58117: tcp 0
17:40:33.229885 IP 192.168.10.2.1433 > 172.16.32.242.58117: tcp 1166
17:40:33.244765 IP 172.16.32.242.58117 > 192.168.10.2.1433: tcp 1289
17:40:33.244822 IP 172.16.32.242.58117 > 192.168.10.2.1433: tcp 1289
17:40:33.244859 IP 172.16.32.242.58117 > 192.168.10.2.1433: tcp 1289
17:40:33.244893 IP 172.16.32.242.58117 > 192.168.10.2.1433: tcp 664
17:40:33.245459 IP 192.168.10.2.1433 > 172.16.32.242.58117: tcp 0
17:40:33.250029 IP 192.168.10.2.1433 > 172.16.32.242.58117: tcp 1026
17:40:33.264811 IP 172.16.32.242.58117 > 192.168.10.2.1433: tcp 1289
17:40:33.264854 IP 172.16.32.242.58117 > 192.168.10.2.1433: tcp 1289
17:40:33.264882 IP 172.16.32.242.58117 > 192.168.10.2.1433: tcp 1289
17:40:33.265079 IP 172.16.32.242.58117 > 192.168.10.2.1433: tcp 1289
17:40:33.265189 IP 172.16.32.242.58117 > 192.168.10.2.1433: tcp 1289
17:40:33.265286 IP 172.16.32.242.58117 > 192.168.10.2.1433: tcp 1289
17:40:33.265312 IP 172.16.32.242.58117 > 192.168.10.2.1433: tcp 282
17:40:33.265476 IP 172.16.32.242.58117 > 192.168.10.2.1433: tcp 1289
17:40:33.265527 IP 192.168.10.2.1433 > 172.16.32.242.58117: tcp 0
17:40:33.265607 IP 172.16.32.242.58117 > 192.168.10.2.1433: tcp 253
17:40:33.265626 IP 192.168.10.2.1433 > 172.16.32.242.58117: tcp 0
17:40:33.265817 IP 192.168.10.2.1433 > 172.16.32.242.58117: tcp 0
17:40:33.265955 IP 192.168.10.2.1433 > 172.16.32.242.58117: tcp 16
17:40:33.266517 IP 192.168.10.2.1433 > 172.16.32.242.58117: tcp 242
17:40:33.280630 IP 172.16.32.242.58117 > 192.168.10.2.1433: tcp 0
17:40:33.308190 IP 192.168.10.157.34360 > 40.113.176.163.8883: tcp 178
17:40:33.340887 IP 40.113.176.163.8883 > 192.168.10.157.34360: tcp 91
17:40:33.353964 IP 192.168.10.157.34360 > 40.113.176.163.8883: tcp 0
17:40:33.356190 IP 192.168.10.157.34360 > 40.113.176.163.8883: tcp 341
17:40:33.397465 IP 40.113.176.163.8883 > 192.168.10.157.34360: tcp 69
17:40:33.397577 IP 40.113.176.163.8883 > 192.168.10.157.34360: tcp 0
17:40:33.450617 IP 192.168.10.157.34360 > 40.113.176.163.8883: tcp 0
17:40:33.728112 IP 192.168.10.3.61678 > 192.168.10.1.53: UDP, length 76
17:40:33.736891 IP 192.168.10.1.53 > 192.168.10.3.61678: UDP, length 92
17:40:33.743041 IP 192.168.10.157.45736 > 40.113.176.164.8883: tcp 0
17:40:33.772088 IP 40.113.176.164.8883 > 192.168.10.157.45736: tcp 0
17:40:33.776551 IP 192.168.10.157.45736 > 40.113.176.164.8883: tcp 0
17:40:33.779292 IP 10.90.90.95.138 > 10.90.90.255.138: UDP, length 201
17:40:33.784908 IP 192.168.10.157.45736 > 40.113.176.164.8883: tcp 337
17:40:33.815526 IP 40.113.176.164.8883 > 192.168.10.157.45736: tcp 1460
17:40:33.815543 IP 40.113.176.164.8883 > 192.168.10.157.45736: tcp 1460
17:40:33.815555 IP 40.113.176.164.8883 > 192.168.10.157.45736: tcp 1037
17:40:33.820187 IP 192.168.10.157.45736 > 40.113.176.164.8883: tcp 0
17:40:33.820199 IP 192.168.10.157.45736 > 40.113.176.164.8883: tcp 0
17:40:34.151718 IP 192.168.10.157.45736 > 40.113.176.164.8883: tcp 178
17:40:34.172727 IP 192.168.10.23.50426 > 87.97.60.77.110: tcp 0
17:40:34.181666 IP 40.113.176.164.8883 > 192.168.10.157.45736: tcp 91
17:40:34.184742 IP 87.97.60.77.110 > 192.168.10.23.50426: tcp 0
17:40:34.185034 IP 192.168.10.23.50426 > 87.97.60.77.110: tcp 0
17:40:34.204887 IP 87.97.60.77.110 > 192.168.10.23.50426: tcp 21
17:40:34.205104 IP 192.168.10.23.50426 > 87.97.60.77.110: tcp 0
17:40:34.205236 IP 192.168.10.23.50426 > 87.97.60.77.110: tcp 15
17:40:34.214836 IP 87.97.60.77.110 > 192.168.10.23.50426: tcp 0
17:40:34.214846 IP 87.97.60.77.110 > 192.168.10.23.50426: tcp 5
17:40:34.215203 IP 192.168.10.23.50426 > 87.97.60.77.110: tcp 11
17:40:34.224748 IP 87.97.60.77.110 > 192.168.10.23.50426: tcp 0
17:40:34.237819 IP 192.168.10.157.45736 > 40.113.176.164.8883: tcp 0
17:40:34.237909 IP 192.168.10.157.45736 > 40.113.176.164.8883: tcp 309
17:40:34.244618 IP 87.97.60.77.110 > 192.168.10.23.50426: tcp 16
17:40:34.244911 IP 192.168.10.23.50426 > 87.97.60.77.110: tcp 6
17:40:34.254608 IP 87.97.60.77.110 > 192.168.10.23.50426: tcp 0
17:40:34.254619 IP 87.97.60.77.110 > 192.168.10.23.50426: tcp 9
17:40:34.254917 IP 192.168.10.23.50426 > 87.97.60.77.110: tcp 6
17:40:34.264461 IP 87.97.60.77.110 > 192.168.10.23.50426: tcp 0
17:40:34.265745 IP 87.97.60.77.110 > 192.168.10.23.50426: tcp 18
17:40:34.265986 IP 192.168.10.23.50426 > 87.97.60.77.110: tcp 0
17:40:34.276974 IP 87.97.60.77.110 > 192.168.10.23.50426: tcp 0
17:40:34.314973 IP 40.113.176.164.8883 > 192.168.10.157.45736: tcp 0
17:40:34.376011 IP 192.168.10.229.5678 > 255.255.255.255.5678: UDP, length 148
17:40:34.995340 IP 192.168.10.70.53601 > 159.122.182.201.5938: tcp 1460
17:40:34.995384 IP 192.168.10.70.53601 > 159.122.182.201.5938: tcp 589
17:40:35.023442 IP 159.122.182.201.5938 > 192.168.10.70.53601: tcp 0
17:40:35.025437 IP 159.122.182.201.5938 > 192.168.10.70.53601: tcp 1460
17:40:35.025469 IP 159.122.182.201.5938 > 192.168.10.70.53601: tcp 1131
17:40:35.026034 IP 192.168.10.70.53601 > 159.122.182.201.5938: tcp 0
17:40:35.036027 IP 192.168.10.18.38769 > 142.93.235.17.4000: UDP, length 148
17:40:35.042108 IP 192.168.10.70.53601 > 159.122.182.201.5938: tcp 800
17:40:35.073157 IP 159.122.182.201.5938 > 192.168.10.70.53601: tcp 802
17:40:35.083821 IP 192.168.10.70.53601 > 159.122.182.201.5938: tcp 274
17:40:35.112029 IP 159.122.182.201.5938 > 192.168.10.70.53601: tcp 200
17:40:35.113565 IP 159.122.182.201.5938 > 192.168.10.70.53601: tcp 1460
17:40:35.113575 IP 159.122.182.201.5938 > 192.168.10.70.53601: tcp 761
17:40:35.114062 IP 192.168.10.70.53601 > 159.122.182.201.5938: tcp 0
17:40:35.117007 IP 192.168.10.139.57446 > 8.8.4.4.443: UDP, length 195
17:40:35.121768 IP 8.8.4.4.443 > 192.168.10.139.57446: UDP, length 27
17:40:35.126091 IP 192.168.10.70.53601 > 159.122.182.201.5938: tcp 1460
17:40:35.126131 IP 192.168.10.70.53601 > 159.122.182.201.5938: tcp 959
17:40:35.135774 IP 8.8.4.4.443 > 192.168.10.139.57446: UDP, length 579
17:40:35.135895 IP 8.8.4.4.443 > 192.168.10.139.57446: UDP, length 25
17:40:35.138116 IP 192.168.10.139.57446 > 8.8.4.4.443: UDP, length 35
17:40:35.140096 IP 192.168.10.139.57144 > 142.250.180.227.443: UDP, length 1250
17:40:35.140421 IP 192.168.10.139.57144 > 142.250.180.227.443: UDP, length 73
17:40:35.141008 IP 192.168.10.139.57144 > 142.250.180.227.443: UDP, length 572
17:40:35.154121 IP 159.122.182.201.5938 > 192.168.10.70.53601: tcp 0
17:40:35.157540 IP 159.122.182.201.5938 > 192.168.10.70.53601: tcp 800
17:40:35.165934 IP 142.250.180.227.443 > 192.168.10.139.57144: UDP, length 1250
17:40:35.166256 IP 142.250.180.227.443 > 192.168.10.139.57144: UDP, length 628
17:40:35.166265 IP 142.250.180.227.443 > 192.168.10.139.57144: UDP, length 26
17:40:35.166494 IP 142.250.180.227.443 > 192.168.10.139.57144: UDP, length 25
17:40:35.167943 IP 8.8.4.4.443 > 192.168.10.139.57446: UDP, length 25
17:40:35.168979 IP 192.168.10.139.57144 > 142.250.180.227.443: UDP, length 79
17:40:35.169293 IP 192.168.10.139.57144 > 142.250.180.227.443: UDP, length 33
17:40:35.169626 IP 192.168.10.139.57446 > 8.8.4.4.443: UDP, length 33
17:40:35.170985 IP 8.8.4.4.443 > 192.168.10.139.57446: UDP, length 25
17:40:35.172692 IP 192.168.10.70.53601 > 159.122.182.201.5938: tcp 802
17:40:35.173071 IP 192.168.10.139.57446 > 8.8.4.4.443: UDP, length 33
17:40:35.173401 IP 142.250.180.227.443 > 192.168.10.139.57144: UDP, length 92
17:40:35.174621 IP 192.168.10.139.57144 > 142.250.180.227.443: UDP, length 33
17:40:35.198032 IP 142.250.180.227.443 > 192.168.10.139.57144: UDP, length 625
17:40:35.198097 IP 142.250.180.227.443 > 192.168.10.139.57144: UDP, length 25
17:40:35.200497 IP 192.168.10.139.57144 > 142.250.180.227.443: UDP, length 35
17:40:35.202354 IP 159.122.182.201.5938 > 192.168.10.70.53601: tcp 409
17:40:35.204905 IP 142.250.180.227.443 > 192.168.10.139.57144: UDP, length 25
17:40:35.204919 IP 192.168.10.70.53601 > 159.122.182.201.5938: tcp 200
17:40:35.216089 ARP, Request who-has 192.168.10.3 tell 192.168.10.70, length 46
17:40:35.216926 IP 192.168.10.3.60653 > 192.168.10.1.53: UDP, length 50
17:40:35.226594 ARP, Request who-has 192.168.10.179 tell 192.168.10.91, length 46
17:40:35.235494 IP 142.250.180.227.443 > 192.168.10.139.57144: UDP, length 25
17:40:35.237651 IP 192.168.10.139.57144 > 142.250.180.227.443: UDP, length 33
17:40:35.272341 IP 159.122.182.201.5938 > 192.168.10.70.53601: tcp 0
17:40:35.355460 IP 192.168.10.1.53 > 192.168.10.3.60653: UDP, length 289
17:40:35.356010 ARP, Request who-has 192.168.10.70 tell 192.168.10.3, length 46
17:40:35.359793 IP 192.168.10.70.60664 > 20.50.2.7.443: tcp 0
17:40:35.388663 IP 20.50.2.7.443 > 192.168.10.70.60664: tcp 0
17:40:35.389175 IP 192.168.10.70.60664 > 20.50.2.7.443: tcp 0
17:40:35.394952 IP 192.168.10.70.60664 > 20.50.2.7.443: tcp 217
17:40:35.425811 IP 20.50.2.7.443 > 192.168.10.70.60664: tcp 1460
17:40:35.425830 IP 20.50.2.7.443 > 192.168.10.70.60664: tcp 1460
17:40:35.425842 IP 20.50.2.7.443 > 192.168.10.70.60664: tcp 1460
17:40:35.425852 IP 20.50.2.7.443 > 192.168.10.70.60664: tcp 633
17:40:35.426837 IP 192.168.10.70.60664 > 20.50.2.7.443: tcp 0
17:40:35.441524 IP6 fe80::217:c8ff:fe95:9796.546 > ff02::1:2.547: UDP, length 36
17:40:35.442725 IP 192.168.10.70.60664 > 20.50.2.7.443: tcp 182
17:40:35.472221 IP 20.50.2.7.443 > 192.168.10.70.60664: tcp 107
17:40:35.474050 IP 192.168.10.70.60664 > 20.50.2.7.443: tcp 629
17:40:35.526952 IP 20.50.2.7.443 > 192.168.10.70.60664: tcp 1460
17:40:35.526966 IP 20.50.2.7.443 > 192.168.10.70.60664: tcp 1460
17:40:35.526977 IP 20.50.2.7.443 > 192.168.10.70.60664: tcp 1460
17:40:35.526988 IP 20.50.2.7.443 > 192.168.10.70.60664: tcp 1460
17:40:35.526997 IP 20.50.2.7.443 > 192.168.10.70.60664: tcp 1460
17:40:35.527008 IP 20.50.2.7.443 > 192.168.10.70.60664: tcp 1460
17:40:35.527020 IP 20.50.2.7.443 > 192.168.10.70.60664: tcp 1460
17:40:35.527031 IP 20.50.2.7.443 > 192.168.10.70.60664: tcp 1460
17:40:35.527043 IP 20.50.2.7.443 > 192.168.10.70.60664: tcp 1460
17:40:35.527054 IP 20.50.2.7.443 > 192.168.10.70.60664: tcp 1460
17:40:35.527065 IP 20.50.2.7.443 > 192.168.10.70.60664: tcp 1460
17:40:35.527078 IP 20.50.2.7.443 > 192.168.10.70.60664: tcp 1460
17:40:35.527089 IP 20.50.2.7.443 > 192.168.10.70.60664: tcp 1075
17:40:35.527920 IP 192.168.10.70.60664 > 20.50.2.7.443: tcp 0
17:40:35.527984 IP 192.168.10.70.60664 > 20.50.2.7.443: tcp 0
17:40:35.796630 IP 52.40.161.235.443 > 192.168.10.130.49997: tcp 93
17:40:35.860917 IP 192.168.10.7.5678 > 255.255.255.255.5678: UDP, length 139
17:40:35.876813 IP 192.168.10.180.59617 > 116.202.208.24.443: tcp 1
17:40:35.883782 IP 116.202.208.24.443 > 192.168.10.180.59617: tcp 0
17:40:35.883993 IP 192.168.10.180.59617 > 116.202.208.24.443: tcp 0
17:40:35.899807 IP 116.202.208.24.443 > 192.168.10.180.59617: tcp 0
17:40:35.915431 ARP, Request who-has 192.168.10.5 tell 192.168.10.206, length 46
17:40:35.960863 ARP, Request who-has 192.168.10.179 tell 192.168.10.91, length 46
17:40:36.710779 ARP, Request who-has 192.168.10.5 tell 192.168.10.206, length 46
17:40:36.765688 IP6 fe80::c225:e9ff:fe4b:81d5.546 > ff02::1:2.547: UDP, length 66
17:40:36.790364 ARP, Request who-has 192.168.10.5 tell 192.168.10.139, length 46
17:40:36.811536 IP6 fe80::208:a2ff:fe0e:fd02 > ff02::1: ICMP6, router advertisement, length 56
17:40:36.811842 IP 192.168.10.13.5678 > 255.255.255.255.5678: UDP, length 133
17:40:36.888997 IP 192.168.10.94.36518 > 192.168.25.205.21: tcp 0
17:40:36.889031 IP 192.168.25.205.21 > 192.168.10.94.36518: tcp 0
17:40:36.946506 IP 192.168.10.94.36518 > 192.168.25.205.21: tcp 0
17:40:36.960962 ARP, Request who-has 192.168.10.179 tell 192.168.10.91, length 46
17:40:37.035061 IP 192.168.10.19.123 > 66.220.9.122.123: UDP, length 48
17:40:37.116566 IP 51.104.167.245.443 > 192.168.10.91.57848: tcp 0
17:40:37.121880 IP 192.168.10.173.62098 > 142.251.39.74.443: UDP, length 33
17:40:37.127600 IP 142.251.39.74.443 > 192.168.10.173.62098: UDP, length 26
17:40:37.194229 IP 66.220.9.122.123 > 192.168.10.19.123: UDP, length 48
17:40:37.392256 ARP, Request who-has 192.168.10.1 tell 192.168.10.253, length 46
17:40:37.392260 ARP, Reply 192.168.10.1 is-at 00:08:a2:0e:fd:02, length 28
17:40:37.709179 ARP, Request who-has 192.168.10.5 tell 192.168.10.206, length 46
17:40:37.765122 ARP, Request who-has 192.168.10.5 tell 192.168.10.139, length 46
17:40:37.853606 IP6 fe80::c225:e9ff:fe4b:81d5.546 > ff02::1:2.547: UDP, length 66
17:40:38.465541 IP 192.168.10.199.60321 > 8.8.8.8.53: UDP, length 36
17:40:38.470163 IP 8.8.8.8.53 > 192.168.10.199.60321: UDP, length 52
17:40:38.760850 ARP, Request who-has 192.168.10.5 tell 192.168.10.139, length 46
17:40:39.202558 ARP, Request who-has 192.168.10.5 tell 192.168.10.70, length 46
17:40:39.283731 4c:1d:96:d3:76:83 > ff:ff:ff:ff:ff:ff Null Unnumbered, xid, Flags [Response], length 46: 01 02
17:40:39.283790 40:90:e0:36:cf:b2 > ff:ff:ff:ff:ff:ff Null Unnumbered, xid, Flags [Response], length 46: 01 02
17:40:39.973427 IP 192.168.10.157.54321 > 85.31.3.249.49049: UDP, length 68
17:40:40.003638 IP 85.31.3.249.49049 > 192.168.10.157.54321: UDP, length 52
17:40:40.023856 IP 159.122.182.201.5938 > 192.168.10.70.53601: tcp 24
17:40:40.046050 ARP, Request who-has 192.168.10.5 tell 192.168.10.70, length 46
17:40:40.109619 IP6 fe80::c225:e9ff:fe4b:81d5.546 > ff02::1:2.547: UDP, length 66
17:40:40.233647 IP 192.168.10.70.53601 > 159.122.182.201.5938: tcp 0
17:40:41.046062 ARP, Request who-has 192.168.10.5 tell 192.168.10.70, length 46
17:40:41.711400 ARP, Request who-has 192.168.10.1 (00:08:a2:0e:fd:02) tell 192.168.10.173, length 46
17:40:41.711405 ARP, Reply 192.168.10.1 is-at 00:08:a2:0e:fd:02, length 28
17:40:41.748309 IP 192.168.10.199.38425 > 52.16.133.176.6800: tcp 281
17:40:41.793113 IP 52.16.133.176.6800 > 192.168.10.199.38425: tcp 142
17:40:41.801640 IP 192.168.10.199.38425 > 52.16.133.176.6800: tcp 0
17:40:42.049129 ARP, Request who-has 192.168.10.1 tell 192.168.10.19, length 46
17:40:42.049133 ARP, Reply 192.168.10.1 is-at 00:08:a2:0e:fd:02, length 28
17:40:42.609347 IP 192.168.10.70.60665 > 192.168.10.1.10051: tcp 0
17:40:42.757240 IP 142.251.39.74.443 > 192.168.10.173.62098: UDP, length 394
17:40:42.760068 IP 192.168.10.173.62098 > 142.251.39.74.443: UDP, length 33
17:40:42.973421 IP 192.168.10.139.52848 > 142.251.39.10.443: UDP, length 33
17:40:42.979347 IP 142.251.39.10.443 > 192.168.10.139.52848: UDP, length 25
17:40:43.226933 ARP, Request who-has 192.168.10.179 tell 192.168.10.91, length 46
17:40:43.961256 ARP, Request who-has 192.168.10.179 tell 192.168.10.91, length 46
17:40:44.481852 IP 185.14.184.154.443 > 192.168.10.139.53462: tcp 0
17:40:44.483170 IP 192.168.10.139.53462 > 185.14.184.154.443: tcp 0
17:40:44.793149 IP 192.168.10.2.57627 > 1.1.1.1.53: UDP, length 46
17:40:44.797883 IP 1.1.1.1.53 > 192.168.10.2.57627: UDP, length 62
17:40:44.801451 IP 192.168.10.2.61242 > 91.228.167.132.80: tcp 0
17:40:44.802445 IP 192.168.10.2.61269 > 91.228.167.170.80: tcp 0
17:40:44.814106 IP 91.228.167.132.80 > 192.168.10.2.61242: tcp 0
17:40:44.815003 IP 91.228.167.170.80 > 192.168.10.2.61269: tcp 0
17:40:44.815502 IP 192.168.10.2.61269 > 91.228.167.170.80: tcp 0
17:40:44.818185 IP 192.168.10.2.61269 > 91.228.167.170.80: tcp 563
17:40:44.825660 IP6 fe80::c225:e9ff:fe4b:81d5.546 > ff02::1:2.547: UDP, length 66
17:40:44.830844 IP 91.228.167.170.80 > 192.168.10.2.61269: tcp 0
17:40:44.831210 IP 91.228.167.170.80 > 192.168.10.2.61269: tcp 294
17:40:44.833184 IP 192.168.10.2.61269 > 91.228.167.170.80: tcp 0
17:40:44.845698 IP 91.228.167.170.80 > 192.168.10.2.61269: tcp 0
17:40:44.846199 IP 192.168.10.2.61269 > 91.228.167.170.80: tcp 0
17:40:44.961255 ARP, Request who-has 192.168.10.179 tell 192.168.10.91, length 46
17:40:45.035012 IP 192.168.10.18.38769 > 142.93.235.17.4000: UDP, length 148
17:40:45.108419 IPX 00000000.00:c0:ee:96:38:e5.4bbd > 00000000.ff:ff:ff:ff:ff:ff.0453: ipx-rip-req ffffffff/0.0
17:40:45.245886 IP 91.228.165.160.8883 > 192.168.10.130.49768: tcp 0
17:40:45.260280 IP 192.168.10.199.55761 > 52.16.133.176.6800: tcp 281
17:40:45.304716 IP 52.16.133.176.6800 > 192.168.10.199.55761: tcp 142
17:40:45.314304 IP 192.168.10.199.55761 > 52.16.133.176.6800: tcp 0
17:40:45.399498 IP 192.168.10.237.5678 > 255.255.255.255.5678: UDP, length 165
17:40:45.400809 IP 192.168.10.231.5678 > 255.255.255.255.5678: UDP, length 164
17:40:45.412008 IP 192.168.10.234.5678 > 255.255.255.255.5678: UDP, length 165
17:40:45.462852 IP 192.168.10.240.5678 > 255.255.255.255.5678: UDP, length 166
17:40:45.463512 IP 192.168.10.239.5678 > 255.255.255.255.5678: UDP, length 164
17:40:45.474361 IP 192.168.10.236.5678 > 255.255.255.255.5678: UDP, length 165
17:40:45.518292 IP 91.228.165.160.8883 > 192.168.10.130.49768: tcp 0
17:40:45.645371 IP 192.168.10.235.5678 > 255.255.255.255.5678: UDP, length 160
17:40:45.645639 IP 192.168.10.233.5678 > 255.255.255.255.5678: UDP, length 165
17:40:45.736963 IP6 fe80::208:a2ff:fe0e:fd02 > ff02::1: ICMP6, router advertisement, length 56
17:40:45.740231 IP6 fe80::208:a2ff:fe0e:fd02 > ff02::16: HBH ICMP6, multicast listener report v2, 1 group record(s), length 28
17:40:45.788455 IPX 00000000.00:c0:ee:96:38:e5.4bbd > 00000000.ff:ff:ff:ff:ff:ff.0453: ipx-rip-req ffffffff/0.0
17:40:45.806310 IP 91.228.165.160.8883 > 192.168.10.130.49768: tcp 0
17:40:45.843350 IP 172.16.32.242.54826 > 192.168.10.2.1433: tcp 1
17:40:45.843846 IP 192.168.10.2.1433 > 172.16.32.242.54826: tcp 0
17:40:45.895525 IP 192.168.10.2.1433 > 172.16.32.242.54826: tcp 1
17:40:45.906103 IP 192.168.10.180.59617 > 116.202.208.24.443: tcp 1
17:40:45.909500 IP 172.16.32.242.54826 > 192.168.10.2.1433: tcp 0
17:40:45.929161 IP 116.202.208.24.443 > 192.168.10.180.59617: tcp 0
17:40:45.940281 IP6 fe80::208:a2ff:fe0e:fd02 > ff02::16: HBH ICMP6, multicast listener report v2, 1 group record(s), length 28
17:40:46.133305 ARP, Request who-has 192.168.10.5 tell 192.168.10.206, length 46
