11:44:11.558681 IP 91.83.167.9.36850 > 84.1.119.110.10051: tcp 24
11:44:11.558697 IP 91.83.167.9.36850 > 84.1.119.110.10051: tcp 0
11:44:11.558998 IP 84.1.119.110.10051 > 91.83.167.9.36850: tcp 0
11:44:11.560090 IP 172.217.20.10.443 > 84.1.119.110.41366: UDP, length 25
11:44:11.560421 IP 84.1.119.110.4133 > 17.188.17.102.443: tcp 0
11:44:11.560435 IP 84.1.119.110.4133 > 17.188.17.102.443: tcp 0
11:44:11.560445 IP 84.1.119.110.4133 > 17.188.17.102.443: tcp 0
11:44:11.560468 IP 84.1.119.110.4133 > 17.188.17.102.443: tcp 0
11:44:11.560470 IP 84.1.119.110.4133 > 17.188.17.102.443: tcp 39
11:44:11.560739 IP 84.1.119.110.4133 > 17.188.17.102.443: tcp 24
11:44:11.560863 IP 84.1.119.110.4133 > 17.188.17.102.443: tcp 0
11:44:11.562959 IP 91.83.167.9.36850 > 84.1.119.110.10051: tcp 0
11:44:11.562979 IP 193.227.198.3.51474 > 84.1.119.110.10051: tcp 0
11:44:11.564171 IP 193.227.198.3.51474 > 84.1.119.110.10051: tcp 328
11:44:11.564322 IP 84.1.119.110.10051 > 193.227.198.3.51474: tcp 0
11:44:11.564827 IP 84.1.119.110.10051 > 193.227.198.3.51474: tcp 258
11:44:11.588591 IP 193.227.198.3.51474 > 84.1.119.110.10051: tcp 0
11:44:11.588862 IP 193.227.198.3.51474 > 84.1.119.110.10051: tcp 64
11:44:11.588994 IP 84.1.119.110.10051 > 193.227.198.3.51474: tcp 0
11:44:11.589118 IP 84.1.119.110.10051 > 193.227.198.3.51474: tcp 79
11:44:11.608774 IP 84.1.119.110 > 8.8.8.8: ICMP echo request, id 13550, seq 21567, length 9
11:44:11.612703 IP 193.227.198.3.51474 > 84.1.119.110.10051: tcp 243
11:44:11.612904 IP 84.1.119.110.10051 > 193.227.198.3.51474: tcp 0
11:44:11.613033 IP 193.227.198.3.51474 > 84.1.119.110.10051: tcp 0
11:44:11.613837 IP 84.1.119.110.10051 > 193.227.198.3.51474: tcp 83
11:44:11.613860 IP 84.1.119.110.10051 > 193.227.198.3.51474: tcp 24
11:44:11.620005 IP 17.188.17.102.443 > 84.1.119.110.4133: tcp 0
11:44:11.620274 IP 17.188.17.102.443 > 84.1.119.110.4133: tcp 0
11:44:11.620556 IP 17.188.17.102.443 > 84.1.119.110.4133: tcp 0
11:44:11.622232 IP 8.8.8.8 > 84.1.119.110: ICMP echo reply, id 13550, seq 21567, length 9
11:44:11.623019 IP 84.1.119.110.4133 > 17.188.17.102.443: tcp 63
11:44:11.636827 IP 193.227.198.3.51474 > 84.1.119.110.10051: tcp 0
11:44:11.637081 IP 193.227.198.3.51474 > 84.1.119.110.10051: tcp 24
11:44:11.637214 IP 84.1.119.110.10051 > 193.227.198.3.51474: tcp 0
11:44:11.637345 IP 193.227.198.3.51474 > 84.1.119.110.10051: tcp 0
11:44:11.637479 IP 84.1.119.110.10051 > 193.227.198.3.51474: tcp 0
11:44:11.640631 IP 193.227.198.3.51474 > 84.1.119.110.10051: tcp 0
11:44:11.681382 IP 17.188.17.102.443 > 84.1.119.110.4133: tcp 0
11:44:11.683310 IP 84.1.119.110.4133 > 17.188.17.102.443: tcp 0
11:44:11.720525 IP 78.131.75.196.65039 > 84.1.119.110.10051: tcp 24
11:44:11.720727 IP 84.1.119.110.10051 > 78.131.75.196.65039: tcp 0
11:44:11.807843 IP 78.131.75.196 > 84.1.119.110: ICMP echo request, id 43865, seq 6257, length 9
11:44:11.807857 IP 84.1.119.110 > 78.131.75.196: ICMP echo reply, id 43865, seq 6257, length 9
11:44:11.840362 IP 78.131.75.196.65056 > 84.1.119.110.10051: tcp 24
11:44:11.840622 IP 84.1.119.110.10051 > 78.131.75.196.65056: tcp 0
11:44:11.841595 IP 78.131.75.196.65060 > 84.1.119.110.10051: tcp 24
11:44:11.841796 IP 84.1.119.110.10051 > 78.131.75.196.65060: tcp 0
11:44:11.872854 IP 78.131.75.196.65047 > 84.1.119.110.10051: tcp 24
11:44:11.873159 IP 84.1.119.110.10051 > 78.131.75.196.65047: tcp 0
11:44:11.874576 IP 194.149.53.174.28301 > 84.1.119.110.10051: tcp 24
11:44:11.874849 IP 84.1.119.110.10051 > 194.149.53.174.28301: tcp 0
11:44:11.900630 IP 84.1.119.110.25593 > 79.120.134.178.1194: UDP, length 724
11:44:11.923248 IP 84.1.119.110.17020 > 31.13.84.23.443: tcp 29
11:44:11.933637 IP 78.131.75.196.64801 > 84.1.119.110.10051: tcp 0
11:44:11.942200 IP 194.149.53.174.19239 > 84.1.119.110.10051: tcp 0
11:44:11.942628 IP 84.1.119.110.10051 > 194.149.53.174.19239: tcp 0
11:44:11.943722 IP 31.13.84.23.443 > 84.1.119.110.17020: tcp 0
11:44:11.959608 IP 84.1.119.110.57081 > 142.250.184.238.443: UDP, length 925
11:44:11.960611 IP 194.149.53.174.19239 > 84.1.119.110.10051: tcp 329
11:44:11.960740 IP 194.149.53.174.19239 > 84.1.119.110.10051: tcp 0
11:44:11.960988 IP 84.1.119.110.10051 > 194.149.53.174.19239: tcp 0
11:44:11.961112 IP 84.1.119.110.10051 > 194.149.53.174.19239: tcp 0
11:44:11.961654 IP 84.1.119.110.10051 > 194.149.53.174.19239: tcp 258
11:44:11.981764 IP 194.149.53.174.19239 > 84.1.119.110.10051: tcp 0
11:44:11.983829 IP 31.13.84.23.443 > 84.1.119.110.17020: tcp 25
11:44:11.986326 IP 194.149.53.174.19239 > 84.1.119.110.10051: tcp 64
11:44:11.986609 IP 84.1.119.110.10051 > 194.149.53.174.19239: tcp 0
11:44:11.986734 IP 84.1.119.110.17020 > 31.13.84.23.443: tcp 0
11:44:11.986736 IP 84.1.119.110.10051 > 194.149.53.174.19239: tcp 79
11:44:11.994851 IP 142.250.184.238.443 > 84.1.119.110.57081: UDP, length 37
11:44:12.003098 IP 84.1.119.110.57081 > 142.250.184.238.443: UDP, length 33
11:44:12.004878 IP 194.149.53.174.19239 > 84.1.119.110.10051: tcp 0
11:44:12.007554 IP 142.250.184.238.443 > 84.1.119.110.57081: UDP, length 92
11:44:12.007815 IP 142.250.184.238.443 > 84.1.119.110.57081: UDP, length 26
11:44:12.008666 IP 84.1.119.110.57081 > 142.250.184.238.443: UDP, length 39
11:44:12.010464 IP 194.149.53.174.19239 > 84.1.119.110.10051: tcp 238
11:44:12.010714 IP 84.1.119.110.10051 > 194.149.53.174.19239: tcp 0
11:44:12.011740 IP 84.1.119.110.10051 > 194.149.53.174.19239: tcp 83
11:44:12.011865 IP 84.1.119.110.10051 > 194.149.53.174.19239: tcp 24
11:44:12.017027 IP 84.1.119.110.57081 > 142.250.184.238.443: UDP, length 33
11:44:12.025500 IP 185.63.46.240.15212 > 84.1.119.110.10051: tcp 0
11:44:12.025757 IP 84.1.119.110.10051 > 185.63.46.240.15212: tcp 0
11:44:12.029450 IP 194.149.53.174.19239 > 84.1.119.110.10051: tcp 0
11:44:12.032385 IP 194.149.53.174.19239 > 84.1.119.110.10051: tcp 0
11:44:12.032614 IP 84.1.119.110.10051 > 194.149.53.174.19239: tcp 0
11:44:12.032647 IP 194.149.53.174.19239 > 84.1.119.110.10051: tcp 0
11:44:12.034396 IP 194.149.53.174.19239 > 84.1.119.110.10051: tcp 24
11:44:12.034654 IP 84.1.119.110.10051 > 194.149.53.174.19239: tcp 0
11:44:12.039824 IP 78.131.75.196.65067 > 84.1.119.110.10051: tcp 0
11:44:12.040104 IP 84.1.119.110.10051 > 78.131.75.196.65067: tcp 0
11:44:12.040904 IP 62.201.96.62 > 84.1.119.110: ICMP echo request, id 11267, seq 44765, length 9
11:44:12.040917 IP 84.1.119.110 > 62.201.96.62: ICMP echo reply, id 11267, seq 44765, length 9
11:44:12.048259 IP 142.250.184.238.443 > 84.1.119.110.57081: UDP, length 26
11:44:12.048377 IP 185.63.46.240.15212 > 84.1.119.110.10051: tcp 0
11:44:12.048502 IP 185.63.46.240.15212 > 84.1.119.110.10051: tcp 326
11:44:12.048637 IP 84.1.119.110.10051 > 185.63.46.240.15212: tcp 0
11:44:12.049201 IP 84.1.119.110.10051 > 185.63.46.240.15212: tcp 258
11:44:12.055696 IP 84.1.119.110.25593 > 79.120.134.178.1194: UDP, length 728
11:44:12.058962 IP 78.131.75.196.65067 > 84.1.119.110.10051: tcp 0
11:44:12.059081 IP 78.131.75.196.65067 > 84.1.119.110.10051: tcp 324
11:44:12.059277 IP 84.1.119.110.10051 > 78.131.75.196.65067: tcp 0
11:44:12.059758 IP 84.1.119.110.10051 > 78.131.75.196.65067: tcp 258
11:44:12.070581 IP 185.63.46.240.15212 > 84.1.119.110.10051: tcp 0
11:44:12.070852 IP 185.63.46.240.15212 > 84.1.119.110.10051: tcp 64
11:44:12.070961 IP 84.1.119.110.10051 > 185.63.46.240.15212: tcp 0
11:44:12.071085 IP 84.1.119.110.10051 > 185.63.46.240.15212: tcp 79
11:44:12.078626 IP 78.131.75.196.65067 > 84.1.119.110.10051: tcp 0
11:44:12.078751 IP 78.131.75.196.65067 > 84.1.119.110.10051: tcp 0
11:44:12.078876 IP 78.131.75.196.65067 > 84.1.119.110.10051: tcp 64
11:44:12.078976 IP 84.1.119.110.10051 > 78.131.75.196.65067: tcp 0
11:44:12.079100 IP 84.1.119.110.10051 > 78.131.75.196.65067: tcp 79
11:44:12.093673 IP 185.63.46.240.15212 > 84.1.119.110.10051: tcp 1107
11:44:12.093906 IP 185.63.46.240.15212 > 84.1.119.110.10051: tcp 0
11:44:12.093959 IP 84.1.119.110.10051 > 185.63.46.240.15212: tcp 0
11:44:12.095370 IP 84.1.119.110.10051 > 185.63.46.240.15212: tcp 83
11:44:12.095484 IP 84.1.119.110.10051 > 185.63.46.240.15212: tcp 24
11:44:12.099118 IP 78.131.75.196.65067 > 84.1.119.110.10051: tcp 241
11:44:12.099235 IP 78.131.75.196.65067 > 84.1.119.110.10051: tcp 0
11:44:12.099548 IP 84.1.119.110.10051 > 78.131.75.196.65067: tcp 0
11:44:12.100207 IP 84.1.119.110.10051 > 78.131.75.196.65067: tcp 83
11:44:12.100220 IP 84.1.119.110.10051 > 78.131.75.196.65067: tcp 24
11:44:12.116376 IP 185.63.46.240.15212 > 84.1.119.110.10051: tcp 0
11:44:12.116641 IP 185.63.46.240.15212 > 84.1.119.110.10051: tcp 24
11:44:12.116741 IP 84.1.119.110.10051 > 185.63.46.240.15212: tcp 0
11:44:12.116900 IP 185.63.46.240.15212 > 84.1.119.110.10051: tcp 0
11:44:12.116986 IP 84.1.119.110.10051 > 185.63.46.240.15212: tcp 0
11:44:12.117871 IP 185.63.46.240.15212 > 84.1.119.110.10051: tcp 0
11:44:12.121504 IP 78.131.75.196.65067 > 84.1.119.110.10051: tcp 0
11:44:12.121760 IP 78.131.75.196.65067 > 84.1.119.110.10051: tcp 0
11:44:12.122038 IP 78.131.75.196.65067 > 84.1.119.110.10051: tcp 24
11:44:12.122218 IP 84.1.119.110.10051 > 78.131.75.196.65067: tcp 0
11:44:12.122279 IP 78.131.75.196.65067 > 84.1.119.110.10051: tcp 0
11:44:12.122374 IP 84.1.119.110.10051 > 78.131.75.196.65067: tcp 0
11:44:12.140802 IP 84.1.119.110 > 8.8.8.8: ICMP echo request, id 13550, seq 21568, length 9
11:44:12.155639 IP 8.8.8.8 > 84.1.119.110: ICMP echo reply, id 13550, seq 21568, length 9
11:44:12.227228 IP 78.131.75.196.65013 > 84.1.119.110.10051: tcp 24
11:44:12.227543 IP 84.1.119.110.10051 > 78.131.75.196.65013: tcp 0
11:44:12.229977 IP 84.1.119.110.25593 > 79.120.134.178.1194: UDP, length 728
11:44:12.292356 IP 194.149.53.174.40011 > 84.1.119.110.10051: tcp 24
11:44:12.292681 IP 84.1.119.110.10051 > 194.149.53.174.40011: tcp 0
11:44:12.307769 IP 78.131.75.196.65060 > 84.1.119.110.10051: tcp 24
11:44:12.307914 IP 84.1.119.110.10051 > 78.131.75.196.65060: tcp 0
11:44:12.340204 IP 78.131.75.196 > 84.1.119.110: ICMP echo request, id 43865, seq 6258, length 9
11:44:12.340216 IP 84.1.119.110 > 78.131.75.196: ICMP echo reply, id 43865, seq 6258, length 9
11:44:12.353778 IP 195.228.56.123.46336 > 84.1.119.110.10051: tcp 0
11:44:12.353973 IP 84.1.119.110.10051 > 195.228.56.123.46336: tcp 0
11:44:12.357545 IP 84.1.119.110.25593 > 79.120.134.178.1194: UDP, length 728
11:44:12.357702 IP 78.131.75.196.65067 > 84.1.119.110.10051: tcp 24
11:44:12.358023 IP 84.1.119.110.10051 > 78.131.75.196.65067: tcp 0
11:44:12.358423 IP 84.1.119.110.25593 > 79.120.134.178.1194: UDP, length 728
11:44:12.374213 IP 195.228.56.123.46336 > 84.1.119.110.10051: tcp 0
11:44:12.374332 IP 195.228.56.123.46336 > 84.1.119.110.10051: tcp 321
11:44:12.374572 IP 84.1.119.110.10051 > 195.228.56.123.46336: tcp 0
11:44:12.375149 IP 84.1.119.110.10051 > 195.228.56.123.46336: tcp 258
11:44:12.390004 IP 195.228.56.123.46336 > 84.1.119.110.10051: tcp 0
11:44:12.390295 IP 195.228.56.123.46336 > 84.1.119.110.10051: tcp 0
11:44:12.390548 IP 195.228.56.123.46336 > 84.1.119.110.10051: tcp 64
11:44:12.390681 IP 84.1.119.110.10051 > 195.228.56.123.46336: tcp 0
11:44:12.390805 IP 84.1.119.110.10051 > 195.228.56.123.46336: tcp 79
11:44:12.406998 IP 195.228.56.123.46336 > 84.1.119.110.10051: tcp 162
11:44:12.407116 IP 195.228.56.123.46336 > 84.1.119.110.10051: tcp 0
11:44:12.407268 IP 84.1.119.110.10051 > 195.228.56.123.46336: tcp 0
11:44:12.407459 IP 84.1.119.110.10051 > 195.228.56.123.46336: tcp 96
11:44:12.407584 IP 84.1.119.110.10051 > 195.228.56.123.46336: tcp 24
11:44:12.421774 IP 195.228.56.123.46336 > 84.1.119.110.10051: tcp 0
11:44:12.421910 IP 195.228.56.123.46336 > 84.1.119.110.10051: tcp 24
11:44:12.422041 IP 195.228.56.123.46336 > 84.1.119.110.10051: tcp 0
11:44:12.422044 IP 84.1.119.110.10051 > 195.228.56.123.46336: tcp 0
11:44:12.433628 IP 84.1.119.110.25593 > 79.120.134.178.1194: UDP, length 728
11:44:12.486464 IP 194.149.53.174.6833 > 84.1.119.110.10051: tcp 24
11:44:12.486757 IP 84.1.119.110.10051 > 194.149.53.174.6833: tcp 0
11:44:12.559792 IP 91.83.167.9.36860 > 84.1.119.110.10051: tcp 0
11:44:12.560148 IP 84.1.119.110.10051 > 91.83.167.9.36860: tcp 0
11:44:12.563542 IP 62.201.96.62 > 84.1.119.110: ICMP echo request, id 11267, seq 44766, length 9
11:44:12.563552 IP 84.1.119.110 > 62.201.96.62: ICMP echo reply, id 11267, seq 44766, length 9
11:44:12.583254 IP 91.83.167.9.36860 > 84.1.119.110.10051: tcp 0
11:44:12.583558 IP 91.83.167.9.36860 > 84.1.119.110.10051: tcp 326
11:44:12.583739 IP 84.1.119.110.10051 > 91.83.167.9.36860: tcp 0
11:44:12.584268 IP 84.1.119.110.10051 > 91.83.167.9.36860: tcp 258
11:44:12.606127 IP 91.83.167.9.36860 > 84.1.119.110.10051: tcp 0
11:44:12.606396 IP 91.83.167.9.36860 > 84.1.119.110.10051: tcp 0
11:44:12.606408 IP 84.1.119.110.25593 > 79.120.134.178.1194: UDP, length 728
11:44:12.606663 IP 91.83.167.9.36860 > 84.1.119.110.10051: tcp 64
11:44:12.606812 IP 84.1.119.110.10051 > 91.83.167.9.36860: tcp 0
11:44:12.606947 IP 84.1.119.110.10051 > 91.83.167.9.36860: tcp 79
11:44:12.629234 IP 91.83.167.9.36860 > 84.1.119.110.10051: tcp 288
11:44:12.629483 IP 91.83.167.9.36860 > 84.1.119.110.10051: tcp 0
11:44:12.629497 IP 84.1.119.110.10051 > 91.83.167.9.36860: tcp 0
11:44:12.630497 IP 84.1.119.110.10051 > 91.83.167.9.36860: tcp 83
11:44:12.630610 IP 84.1.119.110.10051 > 91.83.167.9.36860: tcp 24
11:44:12.633788 IP 78.131.75.196.65067 > 84.1.119.110.10051: tcp 24
11:44:12.633981 IP 84.1.119.110.10051 > 78.131.75.196.65067: tcp 0
11:44:12.644693 IP 84.1.119.110.52906 > 195.228.112.223.443: tcp 38
11:44:12.650139 IP 91.83.167.9.36860 > 84.1.119.110.10051: tcp 0
11:44:12.651858 IP 91.83.167.9.36860 > 84.1.119.110.10051: tcp 24
11:44:12.652167 IP 84.1.119.110.10051 > 91.83.167.9.36860: tcp 0
11:44:12.652194 IP 84.1.119.110 > 8.8.8.8: ICMP echo request, id 13550, seq 21569, length 9
11:44:12.652447 IP 91.83.167.9.36860 > 84.1.119.110.10051: tcp 0
11:44:12.652682 IP 84.1.119.110.10051 > 91.83.167.9.36860: tcp 0
11:44:12.653914 IP 91.83.167.9.36860 > 84.1.119.110.10051: tcp 0
11:44:12.661900 IP 195.228.112.223.443 > 84.1.119.110.52906: tcp 0
11:44:12.667874 IP 8.8.8.8 > 84.1.119.110: ICMP echo reply, id 13550, seq 21569, length 9
11:44:12.688624 IP 193.227.198.3.56074 > 84.1.119.110.10051: tcp 0
11:44:12.689052 IP 84.1.119.110.10051 > 193.227.198.3.56074: tcp 0
11:44:12.692273 IP 194.149.53.174.46879 > 84.1.119.110.10051: tcp 24
11:44:12.692455 IP 84.1.119.110.10051 > 194.149.53.174.46879: tcp 0
11:44:12.698111 IP 194.149.53.174.5648 > 84.1.119.110.10051: tcp 0
11:44:12.713371 IP 193.227.198.3.56074 > 84.1.119.110.10051: tcp 0
11:44:12.713512 IP 193.227.198.3.56074 > 84.1.119.110.10051: tcp 328
11:44:12.713700 IP 84.1.119.110.10051 > 193.227.198.3.56074: tcp 0
11:44:12.714248 IP 84.1.119.110.10051 > 193.227.198.3.56074: tcp 258
11:44:12.725867 IP 195.228.112.223.443 > 84.1.119.110.42267: tcp 31
11:44:12.728850 IP 84.1.119.110.42267 > 195.228.112.223.443: tcp 0
11:44:12.738462 IP 193.227.198.3.56074 > 84.1.119.110.10051: tcp 0
11:44:12.738592 IP 193.227.198.3.56074 > 84.1.119.110.10051: tcp 64
11:44:12.738812 IP 84.1.119.110.10051 > 193.227.198.3.56074: tcp 0
11:44:12.738935 IP 84.1.119.110.10051 > 193.227.198.3.56074: tcp 79
11:44:12.747607 IP 195.228.112.223.443 > 84.1.119.110.42267: tcp 39
11:44:12.750392 IP 84.1.119.110.42267 > 195.228.112.223.443: tcp 0
11:44:12.754768 IP 84.1.119.110.1231 > 172.217.16.202.443: UDP, length 33
11:44:12.761908 IP 84.1.119.110.25593 > 79.120.134.178.1194: UDP, length 728
11:44:12.763431 IP 193.227.198.3.56074 > 84.1.119.110.10051: tcp 161
11:44:12.763555 IP 193.227.198.3.56074 > 84.1.119.110.10051: tcp 0
11:44:12.763651 IP 84.1.119.110.10051 > 193.227.198.3.56074: tcp 0
11:44:12.764489 IP 84.1.119.110.10051 > 193.227.198.3.56074: tcp 83
11:44:12.764601 IP 84.1.119.110.10051 > 193.227.198.3.56074: tcp 24
11:44:12.788642 IP 193.227.198.3.56074 > 84.1.119.110.10051: tcp 0
11:44:12.788776 IP 193.227.198.3.56074 > 84.1.119.110.10051: tcp 0
11:44:12.788909 IP 193.227.198.3.56074 > 84.1.119.110.10051: tcp 24
11:44:12.789012 IP 84.1.119.110.10051 > 193.227.198.3.56074: tcp 0
11:44:12.789039 IP 193.227.198.3.56074 > 84.1.119.110.10051: tcp 0
11:44:12.789136 IP 84.1.119.110.10051 > 193.227.198.3.56074: tcp 0
11:44:12.790317 IP 172.217.16.202.443 > 84.1.119.110.1231: UDP, length 25
11:44:12.823916 IP 84.1.119.110.25593 > 79.120.134.178.1194: UDP, length 728
11:44:12.841098 IP 195.228.112.223.443 > 84.1.119.110.42267: tcp 31
11:44:12.843957 IP 84.1.119.110.42267 > 195.228.112.223.443: tcp 0
11:44:12.861258 IP 195.228.112.223.443 > 84.1.119.110.42267: tcp 39
11:44:12.864071 IP 84.1.119.110.42267 > 195.228.112.223.443: tcp 0
11:44:12.872507 IP 78.131.75.196 > 84.1.119.110: ICMP echo request, id 43865, seq 6259, length 9
11:44:12.872519 IP 84.1.119.110 > 78.131.75.196: ICMP echo reply, id 43865, seq 6259, length 9
11:44:12.901080 IP 78.131.75.196.65043 > 84.1.119.110.10051: tcp 24
11:44:12.901274 IP 84.1.119.110.10051 > 78.131.75.196.65043: tcp 0
11:44:12.966493 IP 78.131.75.196.65067 > 84.1.119.110.10051: tcp 24
11:44:12.966841 IP 84.1.119.110.10051 > 78.131.75.196.65067: tcp 0
11:44:12.988510 IP 195.228.112.223.443 > 84.1.119.110.42267: tcp 31
11:44:12.991422 IP 84.1.119.110.42267 > 195.228.112.223.443: tcp 0
11:44:12.993026 IP 78.131.75.196.64922 > 84.1.119.110.10051: tcp 24
11:44:12.993185 IP 84.1.119.110.10051 > 78.131.75.196.64922: tcp 0
11:44:12.993327 IP 78.131.75.196.65060 > 84.1.119.110.10051: tcp 24
11:44:12.993524 IP 84.1.119.110.10051 > 78.131.75.196.65060: tcp 0
11:44:13.002254 IP 78.131.75.196.65056 > 84.1.119.110.10051: tcp 24
11:44:13.002472 IP 84.1.119.110.10051 > 78.131.75.196.65056: tcp 0
11:44:13.008126 IP 195.228.112.223.443 > 84.1.119.110.42267: tcp 40
11:44:13.011060 IP 84.1.119.110.42267 > 195.228.112.223.443: tcp 0
11:44:13.048173 IP 194.149.53.174.26766 > 84.1.119.110.10051: tcp 0
11:44:13.048525 IP 84.1.119.110.10051 > 194.149.53.174.26766: tcp 0
11:44:13.068288 IP 194.149.53.174.26766 > 84.1.119.110.10051: tcp 0
11:44:13.068576 IP 194.149.53.174.26766 > 84.1.119.110.10051: tcp 329
11:44:13.068705 IP 84.1.119.110.10051 > 194.149.53.174.26766: tcp 0
11:44:13.069328 IP 84.1.119.110.10051 > 194.149.53.174.26766: tcp 258
11:44:13.077433 IP 62.201.96.62 > 84.1.119.110: ICMP echo request, id 11267, seq 44767, length 9
11:44:13.077443 IP 84.1.119.110 > 62.201.96.62: ICMP echo reply, id 11267, seq 44767, length 9
11:44:13.077514 IP 78.131.75.196.64805 > 84.1.119.110.10051: tcp 0
11:44:13.087833 IP 194.149.53.174.26766 > 84.1.119.110.10051: tcp 64
11:44:13.088125 IP 194.149.53.174.26766 > 84.1.119.110.10051: tcp 0
11:44:13.088137 IP 84.1.119.110.10051 > 194.149.53.174.26766: tcp 0
11:44:13.088237 IP 84.1.119.110.10051 > 194.149.53.174.26766: tcp 0
11:44:13.088362 IP 84.1.119.110.10051 > 194.149.53.174.26766: tcp 79
11:44:13.107842 IP 194.149.53.174.26766 > 84.1.119.110.10051: tcp 0
11:44:13.109626 IP 194.149.53.174.26766 > 84.1.119.110.10051: tcp 216
11:44:13.109843 IP 84.1.119.110.10051 > 194.149.53.174.26766: tcp 0
11:44:13.111031 IP 84.1.119.110.10051 > 194.149.53.174.26766: tcp 83
11:44:13.111142 IP 84.1.119.110.10051 > 194.149.53.174.26766: tcp 24
11:44:13.123060 IP 185.63.46.240.4319 > 84.1.119.110.10051: tcp 0
11:44:13.123324 IP 84.1.119.110.10051 > 185.63.46.240.4319: tcp 0
11:44:13.127838 IP 194.149.53.174.26766 > 84.1.119.110.10051: tcp 24
11:44:13.128101 IP 194.149.53.174.26766 > 84.1.119.110.10051: tcp 0
11:44:13.128138 IP 84.1.119.110.10051 > 194.149.53.174.26766: tcp 0
11:44:13.128262 IP 84.1.119.110.10051 > 194.149.53.174.26766: tcp 0
11:44:13.128362 IP 194.149.53.174.26766 > 84.1.119.110.10051: tcp 0
11:44:13.128532 IP 84.1.119.110.10051 > 194.149.53.174.26766: tcp 0
11:44:13.131493 IP 194.149.53.174.26766 > 84.1.119.110.10051: tcp 0
11:44:13.150027 IP 84.1.119.110.25593 > 79.120.134.178.1194: UDP, length 728
11:44:13.153575 IP 84.1.119.110 > 8.8.8.8: ICMP echo request, id 13550, seq 21570, length 9
11:44:13.167399 IP 185.63.46.240.4319 > 84.1.119.110.10051: tcp 0
11:44:13.167671 IP 185.63.46.240.4319 > 84.1.119.110.10051: tcp 326
11:44:13.167804 IP 84.1.119.110.10051 > 185.63.46.240.4319: tcp 0
11:44:13.168375 IP 84.1.119.110.10051 > 185.63.46.240.4319: tcp 258
11:44:13.169671 IP 8.8.8.8 > 84.1.119.110: ICMP echo reply, id 13550, seq 21570, length 9
11:44:13.185239 IP 78.131.75.196.65078 > 84.1.119.110.10051: tcp 0
11:44:13.185526 IP 84.1.119.110.10051 > 78.131.75.196.65078: tcp 0
11:44:13.190795 IP 185.63.46.240.4319 > 84.1.119.110.10051: tcp 0
11:44:13.191079 IP 185.63.46.240.4319 > 84.1.119.110.10051: tcp 64
11:44:13.191255 IP 84.1.119.110.10051 > 185.63.46.240.4319: tcp 0
11:44:13.191404 IP 84.1.119.110.10051 > 185.63.46.240.4319: tcp 79
11:44:13.197252 IP 84.1.119.110.25593 > 79.120.134.178.1194: UDP, length 728
11:44:13.206968 IP 78.131.75.196.65078 > 84.1.119.110.10051: tcp 0
11:44:13.207235 IP 78.131.75.196.65078 > 84.1.119.110.10051: tcp 324
11:44:13.207368 IP 84.1.119.110.10051 > 78.131.75.196.65078: tcp 0
11:44:13.207888 IP 84.1.119.110.10051 > 78.131.75.196.65078: tcp 258
11:44:13.212864 IP 185.63.46.240.4319 > 84.1.119.110.10051: tcp 214
11:44:13.212938 IP 84.1.119.110.25593 > 79.120.134.178.1194: UDP, length 724
11:44:13.213118 IP 185.63.46.240.4319 > 84.1.119.110.10051: tcp 0
11:44:13.213250 IP 84.1.119.110.10051 > 185.63.46.240.4319: tcp 0
11:44:13.214440 IP 84.1.119.110.10051 > 185.63.46.240.4319: tcp 83
11:44:13.214553 IP 84.1.119.110.10051 > 185.63.46.240.4319: tcp 24
11:44:13.229493 IP 78.131.75.196.65078 > 84.1.119.110.10051: tcp 0
11:44:13.229630 IP 78.131.75.196.65078 > 84.1.119.110.10051: tcp 64
11:44:13.229762 IP 84.1.119.110.10051 > 78.131.75.196.65078: tcp 0
11:44:13.229902 IP 84.1.119.110.10051 > 78.131.75.196.65078: tcp 79
11:44:13.239237 IP 185.63.46.240.4319 > 84.1.119.110.10051: tcp 0
11:44:13.239371 IP 185.63.46.240.4319 > 84.1.119.110.10051: tcp 0
11:44:13.239506 IP 185.63.46.240.4319 > 84.1.119.110.10051: tcp 24
11:44:13.239636 IP 185.63.46.240.4319 > 84.1.119.110.10051: tcp 0
11:44:13.239640 IP 84.1.119.110.10051 > 185.63.46.240.4319: tcp 0
11:44:13.239763 IP 84.1.119.110.10051 > 185.63.46.240.4319: tcp 0
11:44:13.251218 IP 78.131.75.196.65078 > 84.1.119.110.10051: tcp 277
11:44:13.251339 IP 78.131.75.196.65078 > 84.1.119.110.10051: tcp 0
11:44:13.251496 IP 84.1.119.110.10051 > 78.131.75.196.65078: tcp 0
11:44:13.252677 IP 84.1.119.110.10051 > 78.131.75.196.65078: tcp 83
11:44:13.252802 IP 84.1.119.110.10051 > 78.131.75.196.65078: tcp 24
11:44:13.272712 IP 45.134.144.140.54673 > 84.1.119.110.30443: tcp 0
11:44:13.274735 IP 78.131.75.196.65078 > 84.1.119.110.10051: tcp 0
11:44:13.274871 IP 78.131.75.196.65078 > 84.1.119.110.10051: tcp 24
11:44:13.275006 IP 78.131.75.196.65078 > 84.1.119.110.10051: tcp 0
11:44:13.275138 IP 84.1.119.110.10051 > 78.131.75.196.65078: tcp 0
11:44:13.275140 IP 84.1.119.110.10051 > 78.131.75.196.65078: tcp 0
11:44:13.278527 IP 78.131.75.196.65078 > 84.1.119.110.10051: tcp 0
11:44:13.404589 IP 78.131.75.196 > 84.1.119.110: ICMP echo request, id 43865, seq 6260, length 9
11:44:13.404606 IP 84.1.119.110 > 78.131.75.196: ICMP echo reply, id 43865, seq 6260, length 9
11:44:13.404706 IP 78.131.75.196.64884 > 84.1.119.110.10051: tcp 24
11:44:13.405055 IP 84.1.119.110.10051 > 78.131.75.196.64884: tcp 0
11:44:13.417697 IP 78.131.75.196.65067 > 84.1.119.110.10051: tcp 24
11:44:13.417863 IP 84.1.119.110.10051 > 78.131.75.196.65067: tcp 0
11:44:13.418047 IP 195.228.56.123.46344 > 84.1.119.110.10051: tcp 0
11:44:13.418350 IP 84.1.119.110.10051 > 195.228.56.123.46344: tcp 0
11:44:13.430626 IP 195.228.56.123.46344 > 84.1.119.110.10051: tcp 0
11:44:13.430742 IP 195.228.56.123.46344 > 84.1.119.110.10051: tcp 321
11:44:13.430966 IP 84.1.119.110.10051 > 195.228.56.123.46344: tcp 0
11:44:13.431671 IP 84.1.119.110.10051 > 195.228.56.123.46344: tcp 258
11:44:13.443664 IP 195.228.56.123.46344 > 84.1.119.110.10051: tcp 0
11:44:13.443951 IP 195.228.56.123.46344 > 84.1.119.110.10051: tcp 64
11:44:13.444091 IP 84.1.119.110.10051 > 195.228.56.123.46344: tcp 0
11:44:13.444216 IP 84.1.119.110.10051 > 195.228.56.123.46344: tcp 79
11:44:13.454488 IP 195.228.56.123.46344 > 84.1.119.110.10051: tcp 161
11:44:13.454712 IP 195.228.56.123.46344 > 84.1.119.110.10051: tcp 0
11:44:13.454844 IP 84.1.119.110.10051 > 195.228.56.123.46344: tcp 0
11:44:13.455012 IP 84.1.119.110.10051 > 195.228.56.123.46344: tcp 96
11:44:13.455136 IP 84.1.119.110.10051 > 195.228.56.123.46344: tcp 24
11:44:13.466087 IP 195.228.56.123.46344 > 84.1.119.110.10051: tcp 0
11:44:13.466206 IP 195.228.56.123.46344 > 84.1.119.110.10051: tcp 24
11:44:13.466331 IP 195.228.56.123.46344 > 84.1.119.110.10051: tcp 0
11:44:13.466477 IP 84.1.119.110.10051 > 195.228.56.123.46344: tcp 0
11:44:13.466479 IP 84.1.119.110.10051 > 195.228.56.123.46344: tcp 0
11:44:13.470450 IP 195.228.56.123.46344 > 84.1.119.110.10051: tcp 0
11:44:13.518211 IP 78.131.75.196.65015 > 84.1.119.110.10051: tcp 24
11:44:13.518521 IP 84.1.119.110.10051 > 78.131.75.196.65015: tcp 0
11:44:13.579568 IP 62.201.96.62 > 84.1.119.110: ICMP echo request, id 11267, seq 44768, length 9
11:44:13.579581 IP 84.1.119.110 > 62.201.96.62: ICMP echo reply, id 11267, seq 44768, length 9
11:44:13.655960 IP 91.83.167.9.36870 > 84.1.119.110.10051: tcp 0
11:44:13.656359 IP 84.1.119.110.10051 > 91.83.167.9.36870: tcp 0
11:44:13.675557 IP 194.149.53.174.37876 > 84.1.119.110.10051: tcp 24
11:44:13.675593 IP 84.1.119.110 > 8.8.8.8: ICMP echo request, id 13550, seq 21571, length 9
11:44:13.675772 IP 84.1.119.110.10051 > 194.149.53.174.37876: tcp 0
11:44:13.680825 IP 91.83.167.9.36870 > 84.1.119.110.10051: tcp 0
11:44:13.681120 IP 91.83.167.9.36870 > 84.1.119.110.10051: tcp 326
11:44:13.681263 IP 84.1.119.110.10051 > 91.83.167.9.36870: tcp 0
11:44:13.681875 IP 84.1.119.110.10051 > 91.83.167.9.36870: tcp 258
11:44:13.690178 IP 8.8.8.8 > 84.1.119.110: ICMP echo reply, id 13550, seq 21571, length 9
11:44:13.693369 IP 78.131.75.196.64924 > 84.1.119.110.10051: tcp 24
11:44:13.693638 IP 84.1.119.110.10051 > 78.131.75.196.64924: tcp 0
11:44:13.707651 IP 91.83.167.9.36870 > 84.1.119.110.10051: tcp 0
11:44:13.707775 IP 91.83.167.9.36870 > 84.1.119.110.10051: tcp 0
11:44:13.707777 IP 91.83.167.9.36870 > 84.1.119.110.10051: tcp 64
11:44:13.708033 IP 84.1.119.110.10051 > 91.83.167.9.36870: tcp 0
11:44:13.708198 IP 84.1.119.110.10051 > 91.83.167.9.36870: tcp 79
11:44:13.729387 IP 91.83.167.9.36870 > 84.1.119.110.10051: tcp 299
11:44:13.729507 IP 91.83.167.9.36870 > 84.1.119.110.10051: tcp 0
11:44:13.729695 IP 84.1.119.110.10051 > 91.83.167.9.36870: tcp 0
11:44:13.731059 IP 84.1.119.110.10051 > 91.83.167.9.36870: tcp 83
11:44:13.731171 IP 84.1.119.110.10051 > 91.83.167.9.36870: tcp 24
11:44:13.755998 IP 91.83.167.9.36870 > 84.1.119.110.10051: tcp 0
11:44:13.760272 IP 91.83.167.9.36870 > 84.1.119.110.10051: tcp 24
11:44:13.760515 IP 84.1.119.110.10051 > 91.83.167.9.36870: tcp 0
11:44:13.760643 IP 91.83.167.9.36870 > 84.1.119.110.10051: tcp 0
11:44:13.780349 IP 195.228.112.223.443 > 84.1.119.110.42267: tcp 31
11:44:13.783201 IP 84.1.119.110.42267 > 195.228.112.223.443: tcp 0
11:44:13.801431 IP 195.228.112.223.443 > 84.1.119.110.42267: tcp 38
11:44:13.805089 IP 84.1.119.110.42267 > 195.228.112.223.443: tcp 0
11:44:13.808291 IP 193.227.198.3.53916 > 84.1.119.110.10051: tcp 0
11:44:13.808669 IP 84.1.119.110.10051 > 193.227.198.3.53916: tcp 0
11:44:13.836316 IP 193.227.198.3.53916 > 84.1.119.110.10051: tcp 0
11:44:13.836585 IP 193.227.198.3.53916 > 84.1.119.110.10051: tcp 328
11:44:13.836721 IP 84.1.119.110.10051 > 193.227.198.3.53916: tcp 0
11:44:13.837343 IP 84.1.119.110.10051 > 193.227.198.3.53916: tcp 258
11:44:13.863888 IP 193.227.198.3.53916 > 84.1.119.110.10051: tcp 0
11:44:13.864006 IP 193.227.198.3.53916 > 84.1.119.110.10051: tcp 64
11:44:13.864131 IP 84.1.119.110.10051 > 193.227.198.3.53916: tcp 0
11:44:13.864278 IP 84.1.119.110.10051 > 193.227.198.3.53916: tcp 79
11:44:13.891351 IP 193.227.198.3.53916 > 84.1.119.110.10051: tcp 160
11:44:13.891584 IP 84.1.119.110.10051 > 193.227.198.3.53916: tcp 0
11:44:13.891626 IP 193.227.198.3.53916 > 84.1.119.110.10051: tcp 0
11:44:13.892772 IP 84.1.119.110.10051 > 193.227.198.3.53916: tcp 83
11:44:13.892896 IP 84.1.119.110.10051 > 193.227.198.3.53916: tcp 24
11:44:13.917835 IP 84.1.119.110.25593 > 79.120.134.178.1194: UDP, length 88
11:44:13.921972 IP 193.227.198.3.53916 > 84.1.119.110.10051: tcp 0
11:44:13.922096 IP 193.227.198.3.53916 > 84.1.119.110.10051: tcp 24
11:44:13.922221 IP 193.227.198.3.53916 > 84.1.119.110.10051: tcp 0
11:44:13.922223 IP 193.227.198.3.53916 > 84.1.119.110.10051: tcp 0
11:44:13.922319 IP 84.1.119.110.10051 > 193.227.198.3.53916: tcp 0
11:44:13.922442 IP 84.1.119.110.10051 > 193.227.198.3.53916: tcp 0
11:44:13.924909 IP 84.1.119.110.25593 > 79.120.134.178.1194: UDP, length 724
11:44:13.935017 IP 78.131.75.196.64875 > 84.1.119.110.10051: tcp 24
11:44:13.935037 IP 79.120.134.178.1194 > 84.1.119.110.25593: UDP, length 163
11:44:13.935286 IP 84.1.119.110.10051 > 78.131.75.196.64875: tcp 0
11:44:13.936740 IP 78.131.75.196 > 84.1.119.110: ICMP echo request, id 43865, seq 6261, length 9
11:44:13.936743 IP 84.1.119.110 > 78.131.75.196: ICMP echo reply, id 43865, seq 6261, length 9
11:44:13.949183 IP 84.1.119.110.11684 > 31.13.84.23.443: tcp 29
11:44:13.955485 IP 84.1.119.110.25593 > 79.120.134.178.1194: UDP, length 88
11:44:13.970959 IP 31.13.84.23.443 > 84.1.119.110.11684: tcp 0
11:44:13.972796 IP 79.120.134.178.1194 > 84.1.119.110.25593: UDP, length 163
11:44:14.011394 IP 31.13.84.23.443 > 84.1.119.110.11684: tcp 25
11:44:14.014391 IP 84.1.119.110.11684 > 31.13.84.23.443: tcp 0
11:44:14.028541 IP 194.149.53.174.28301 > 84.1.119.110.10051: tcp 24
11:44:14.028767 IP 84.1.119.110.10051 > 194.149.53.174.28301: tcp 0
11:44:14.034256 IP 78.131.75.196.65047 > 84.1.119.110.10051: tcp 24
11:44:14.034515 IP 84.1.119.110.10051 > 78.131.75.196.65047: tcp 0
11:44:14.071854 IP 84.1.119.110.25593 > 79.120.134.178.1194: UDP, length 728
11:44:14.113834 IP 62.201.96.62 > 84.1.119.110: ICMP echo request, id 11267, seq 44769, length 9
11:44:14.113845 IP 84.1.119.110 > 62.201.96.62: ICMP echo reply, id 11267, seq 44769, length 9
11:44:14.139736 IP 78.131.75.196.65067 > 84.1.119.110.10051: tcp 24
11:44:14.139989 IP 84.1.119.110.10051 > 78.131.75.196.65067: tcp 0
11:44:14.155954 IP 78.131.75.196.65060 > 84.1.119.110.10051: tcp 24
11:44:14.156177 IP 84.1.119.110.10051 > 78.131.75.196.65060: tcp 0
11:44:14.166005 IP 84.1.119.110.25593 > 79.120.134.178.1194: UDP, length 167
11:44:14.194602 IP 194.149.53.174.22353 > 84.1.119.110.10051: tcp 0
11:44:14.195011 IP 84.1.119.110.10051 > 194.149.53.174.22353: tcp 0
11:44:14.205743 IP 84.1.119.110 > 8.8.8.8: ICMP echo request, id 13550, seq 21572, length 9
11:44:14.214024 IP 194.149.53.174.22353 > 84.1.119.110.10051: tcp 0
11:44:14.214305 IP 194.149.53.174.22353 > 84.1.119.110.10051: tcp 329
11:44:14.214449 IP 84.1.119.110.10051 > 194.149.53.174.22353: tcp 0
11:44:14.215105 IP 84.1.119.110.10051 > 194.149.53.174.22353: tcp 258
11:44:14.220780 IP 8.8.8.8 > 84.1.119.110: ICMP echo reply, id 13550, seq 21572, length 9
11:44:14.234130 IP 194.149.53.174.22353 > 84.1.119.110.10051: tcp 0
11:44:14.237195 IP 194.149.53.174.22353 > 84.1.119.110.10051: tcp 64
11:44:14.237463 IP 194.149.53.174.22353 > 84.1.119.110.10051: tcp 247
11:44:14.237523 IP 84.1.119.110.10051 > 194.149.53.174.22353: tcp 0
11:44:14.237645 IP 84.1.119.110.10051 > 194.149.53.174.22353: tcp 0
11:44:14.237770 IP 84.1.119.110.10051 > 194.149.53.174.22353: tcp 79
11:44:14.239042 IP 84.1.119.110.10051 > 194.149.53.174.22353: tcp 107
11:44:14.244690 IP 84.1.119.110.25593 > 79.120.134.178.1194: UDP, length 728
11:44:14.250941 IP 185.63.46.240.60329 > 84.1.119.110.10051: tcp 0
11:44:14.251222 IP 84.1.119.110.10051 > 185.63.46.240.60329: tcp 0
11:44:14.257509 IP 194.149.53.174.22353 > 84.1.119.110.10051: tcp 0
11:44:14.257626 IP 194.149.53.174.22353 > 84.1.119.110.10051: tcp 0
11:44:14.257752 IP 194.149.53.174.22353 > 84.1.119.110.10051: tcp 0
11:44:14.257754 IP 194.149.53.174.22353 > 84.1.119.110.10051: tcp 24
11:44:14.257877 IP 84.1.119.110.10051 > 194.149.53.174.22353: tcp 0
11:44:14.258000 IP 84.1.119.110.10051 > 194.149.53.174.22353: tcp 0
11:44:14.273355 IP 185.63.46.240.60329 > 84.1.119.110.10051: tcp 0
11:44:14.273631 IP 185.63.46.240.60329 > 84.1.119.110.10051: tcp 326
11:44:14.273764 IP 84.1.119.110.10051 > 185.63.46.240.60329: tcp 0
11:44:14.274422 IP 84.1.119.110.10051 > 185.63.46.240.60329: tcp 258
11:44:14.298225 IP 185.63.46.240.60329 > 84.1.119.110.10051: tcp 0
11:44:14.298491 IP 185.63.46.240.60329 > 84.1.119.110.10051: tcp 64
11:44:14.298623 IP 84.1.119.110.10051 > 185.63.46.240.60329: tcp 0
11:44:14.298748 IP 84.1.119.110.10051 > 185.63.46.240.60329: tcp 79
11:44:14.300320 IP 78.131.75.196.65080 > 84.1.119.110.10051: tcp 0
11:44:14.300613 IP 84.1.119.110.10051 > 78.131.75.196.65080: tcp 0
11:44:14.321886 IP 185.63.46.240.60329 > 84.1.119.110.10051: tcp 213
11:44:14.321966 IP 78.131.75.196.65080 > 84.1.119.110.10051: tcp 0
11:44:14.322120 IP 84.1.119.110.10051 > 185.63.46.240.60329: tcp 0
11:44:14.322268 IP 78.131.75.196.65080 > 84.1.119.110.10051: tcp 324
11:44:14.322402 IP 84.1.119.110.10051 > 78.131.75.196.65080: tcp 0
11:44:14.322889 IP 84.1.119.110.10051 > 78.131.75.196.65080: tcp 258
11:44:14.323787 IP 84.1.119.110.10051 > 185.63.46.240.60329: tcp 107
11:44:14.326378 IP 185.63.46.240.60329 > 84.1.119.110.10051: tcp 0
11:44:14.344862 IP 78.131.75.196.65080 > 84.1.119.110.10051: tcp 0
11:44:14.344980 IP 78.131.75.196.65080 > 84.1.119.110.10051: tcp 0
11:44:14.344982 IP 78.131.75.196.65080 > 84.1.119.110.10051: tcp 64
11:44:14.345127 IP 84.1.119.110.10051 > 78.131.75.196.65080: tcp 0
11:44:14.345252 IP 84.1.119.110.10051 > 78.131.75.196.65080: tcp 79
11:44:14.348333 IP 185.63.46.240.60329 > 84.1.119.110.10051: tcp 0
11:44:14.348451 IP 185.63.46.240.60329 > 84.1.119.110.10051: tcp 24
11:44:14.348453 IP 185.63.46.240.60329 > 84.1.119.110.10051: tcp 0
11:44:14.348599 IP 84.1.119.110.10051 > 185.63.46.240.60329: tcp 0
11:44:14.348600 IP 84.1.119.110.10051 > 185.63.46.240.60329: tcp 0
11:44:14.367551 IP 78.131.75.196.65080 > 84.1.119.110.10051: tcp 212
11:44:14.367821 IP 84.1.119.110.10051 > 78.131.75.196.65080: tcp 0
11:44:14.368559 IP 84.1.119.110.10051 > 78.131.75.196.65080: tcp 83
11:44:14.368674 IP 84.1.119.110.10051 > 78.131.75.196.65080: tcp 24
11:44:14.369839 IP 84.1.119.110.25593 > 79.120.134.178.1194: UDP, length 728
11:44:14.371009 IP 84.1.119.110.25593 > 79.120.134.178.1194: UDP, length 728
11:44:14.389586 IP 78.131.75.196.65080 > 84.1.119.110.10051: tcp 0
11:44:14.389705 IP 78.131.75.196.65080 > 84.1.119.110.10051: tcp 24
11:44:14.389707 IP 78.131.75.196.65080 > 84.1.119.110.10051: tcp 0
11:44:14.389851 IP 84.1.119.110.10051 > 78.131.75.196.65080: tcp 0
11:44:14.392214 IP 78.131.75.196.65080 > 84.1.119.110.10051: tcp 0
11:44:14.447193 IP 84.1.119.110.25593 > 79.120.134.178.1194: UDP, length 728
11:44:14.466785 IP 195.228.56.123.46354 > 84.1.119.110.10051: tcp 0
11:44:14.467172 IP 84.1.119.110.10051 > 195.228.56.123.46354: tcp 0
11:44:14.469040 IP 78.131.75.196 > 84.1.119.110: ICMP echo request, id 43865, seq 6262, length 9
11:44:14.469055 IP 84.1.119.110 > 78.131.75.196: ICMP echo reply, id 43865, seq 6262, length 9
11:44:14.481993 IP 195.228.56.123.46354 > 84.1.119.110.10051: tcp 0
11:44:14.482112 IP 195.228.56.123.46354 > 84.1.119.110.10051: tcp 321
11:44:14.482209 IP 84.1.119.110.10051 > 195.228.56.123.46354: tcp 0
11:44:14.482699 IP 84.1.119.110.10051 > 195.228.56.123.46354: tcp 258
11:44:14.490159 IP 194.149.53.174.22353 > 84.1.119.110.10051: tcp 24
11:44:14.490382 IP 84.1.119.110.10051 > 194.149.53.174.22353: tcp 0
11:44:14.495183 IP 195.228.56.123.46354 > 84.1.119.110.10051: tcp 0
11:44:14.495302 IP 195.228.56.123.46354 > 84.1.119.110.10051: tcp 64
11:44:14.495396 IP 84.1.119.110.10051 > 195.228.56.123.46354: tcp 0
11:44:14.495546 IP 84.1.119.110.10051 > 195.228.56.123.46354: tcp 79
11:44:14.510317 IP 195.228.56.123.46354 > 84.1.119.110.10051: tcp 163
11:44:14.510436 IP 195.228.56.123.46354 > 84.1.119.110.10051: tcp 0
11:44:14.510483 IP 84.1.119.110.10051 > 195.228.56.123.46354: tcp 0
11:44:14.510677 IP 84.1.119.110.10051 > 195.228.56.123.46354: tcp 96
11:44:14.510802 IP 84.1.119.110.10051 > 195.228.56.123.46354: tcp 24
11:44:14.525671 IP 195.228.56.123.46354 > 84.1.119.110.10051: tcp 0
11:44:14.525796 IP 195.228.56.123.46354 > 84.1.119.110.10051: tcp 24
11:44:14.525917 IP 84.1.119.110.10051 > 195.228.56.123.46354: tcp 0
11:44:14.525921 IP 195.228.56.123.46354 > 84.1.119.110.10051: tcp 0
11:44:14.526041 IP 84.1.119.110.10051 > 195.228.56.123.46354: tcp 0
11:44:14.530302 IP 195.228.56.123.46354 > 84.1.119.110.10051: tcp 0
11:44:14.578152 IP 78.131.75.196.65018 > 84.1.119.110.10051: tcp 24
11:44:14.578365 IP 84.1.119.110.10051 > 78.131.75.196.65018: tcp 0
11:44:14.618581 IP 84.1.119.110.25593 > 79.120.134.178.1194: UDP, length 728
11:44:14.645751 IP 62.201.96.62 > 84.1.119.110: ICMP echo request, id 11267, seq 44770, length 9
11:44:14.645754 IP 84.1.119.110 > 62.201.96.62: ICMP echo reply, id 11267, seq 44770, length 9
11:44:14.718546 IP 194.149.53.174.57056 > 84.1.119.110.10051: tcp 24
11:44:14.718571 IP 84.1.119.110 > 8.8.8.8: ICMP echo request, id 13550, seq 21573, length 9
11:44:14.718728 IP 84.1.119.110.10051 > 194.149.53.174.57056: tcp 0
11:44:14.735062 IP 8.8.8.8 > 84.1.119.110: ICMP echo reply, id 13550, seq 21573, length 9
11:44:14.756117 IP 78.131.75.196.64926 > 84.1.119.110.10051: tcp 24
11:44:14.756274 IP 84.1.119.110.10051 > 78.131.75.196.64926: tcp 0
11:44:14.759946 IP 91.83.167.9.36882 > 84.1.119.110.10051: tcp 0
11:44:14.760245 IP 84.1.119.110.10051 > 91.83.167.9.36882: tcp 0
11:44:14.767626 IP 194.149.53.174.22353 > 84.1.119.110.10051: tcp 24
11:44:14.767801 IP 84.1.119.110.10051 > 194.149.53.174.22353: tcp 0
11:44:14.773572 IP 84.1.119.110.41366 > 172.217.20.10.443: UDP, length 33
11:44:14.774186 IP 84.1.119.110.25593 > 79.120.134.178.1194: UDP, length 728
11:44:14.783043 IP 91.83.167.9.36882 > 84.1.119.110.10051: tcp 0
11:44:14.783339 IP 91.83.167.9.36882 > 84.1.119.110.10051: tcp 326
11:44:14.783482 IP 84.1.119.110.10051 > 91.83.167.9.36882: tcp 0
11:44:14.783906 IP 84.1.119.110.10051 > 91.83.167.9.36882: tcp 258
11:44:14.792114 IP 84.1.119.110.8877 > 138.199.36.120.443: tcp 1
11:44:14.793297 IP 172.217.20.10.443 > 84.1.119.110.41366: UDP, length 25
11:44:14.796601 IP 84.1.119.110.25593 > 79.120.134.178.1194: UDP, length 89
11:44:14.804272 IP 91.83.167.9.36882 > 84.1.119.110.10051: tcp 0
11:44:14.805761 IP 91.83.167.9.36882 > 84.1.119.110.10051: tcp 0
11:44:14.805901 IP 91.83.167.9.36882 > 84.1.119.110.10051: tcp 64
11:44:14.806077 IP 84.1.119.110.10051 > 91.83.167.9.36882: tcp 0
11:44:14.806206 IP 84.1.119.110.10051 > 91.83.167.9.36882: tcp 79
11:44:14.821972 IP 138.199.36.120.443 > 84.1.119.110.8877: tcp 0
11:44:14.823721 IP 91.83.167.9.36882 > 84.1.119.110.10051: tcp 293
11:44:14.824045 IP 84.1.119.110.10051 > 91.83.167.9.36882: tcp 0
11:44:14.824871 IP 84.1.119.110.10051 > 91.83.167.9.36882: tcp 107
11:44:14.826935 IP 91.83.167.9.36882 > 84.1.119.110.10051: tcp 0
11:44:14.836891 IP 84.1.119.110.25593 > 79.120.134.178.1194: UDP, length 728
11:44:14.847309 IP 91.83.167.9.36882 > 84.1.119.110.10051: tcp 24
11:44:14.847567 IP 84.1.119.110.10051 > 91.83.167.9.36882: tcp 0
11:44:14.849362 IP 91.83.167.9.36882 > 84.1.119.110.10051: tcp 0
11:44:14.853767 IP 79.120.134.178.1194 > 84.1.119.110.25593: UDP, length 129
11:44:14.857696 IP 84.1.119.110.7425 > 142.251.39.14.443: UDP, length 1250
11:44:14.858096 IP 84.1.119.110.7425 > 142.251.39.14.443: UDP, length 74
11:44:14.874910 IP 142.251.39.14.443 > 84.1.119.110.7425: UDP, length 1250
11:44:14.878936 IP 84.1.119.110.7425 > 142.251.39.14.443: UDP, length 1250
11:44:14.895150 IP 142.251.39.14.443 > 84.1.119.110.7425: UDP, length 1250
11:44:14.895423 IP 142.251.39.14.443 > 84.1.119.110.7425: UDP, length 1250
11:44:14.895724 IP 142.251.39.14.443 > 84.1.119.110.7425: UDP, length 1250
11:44:14.895981 IP 142.251.39.14.443 > 84.1.119.110.7425: UDP, length 667
11:44:14.896902 IP 84.1.119.110.7425 > 142.251.39.14.443: UDP, length 41
