12:16:08.577078 IP 192.168.50.101.54135 > 192.168.50.1.53: UDP, length 36
12:16:08.577150 IP 192.168.50.1.53 > 192.168.50.101.54135: UDP, length 111
12:16:32.958351 IP 192.168.50.101.49668 > 192.168.8.114.161: UDP, length 78
12:16:43.131712 IP 192.168.50.101.49668 > 192.168.8.114.161: UDP, length 78
12:16:47.127674 IP 192.168.50.101.54375 > 192.168.50.1.53: UDP, length 36
12:16:47.127766 IP 192.168.50.1.53 > 192.168.50.101.54375: UDP, length 111
12:16:47.177302 IP 192.168.50.101.49886 > 192.168.50.1.53: UDP, length 47
12:16:47.183730 IP 192.168.50.101.64231 > 192.168.50.1.53: UDP, length 37
12:16:47.202557 IP 192.168.50.1.53 > 192.168.50.101.49886: UDP, length 63
12:16:47.208922 IP 192.168.50.1.53 > 192.168.50.101.64231: UDP, length 53
12:16:51.660244 IP 192.168.50.101.62871 > 192.168.50.1.53: UDP, length 43
12:16:51.660322 IP 192.168.50.1.53 > 192.168.50.101.62871: UDP, length 75
12:16:51.660846 IP 192.168.50.101.54135 > 192.168.50.1.53: UDP, length 28
12:16:51.660892 IP 192.168.50.1.53 > 192.168.50.101.54135: UDP, length 60
12:16:51.668945 IP 192.168.50.101.63410 > 104.18.42.171.443: tcp 0
12:16:51.670449 IP 192.168.50.101.63413 > 104.18.42.171.443: tcp 0
12:16:51.671668 IP 192.168.50.101.63414 > 104.18.42.171.443: tcp 0
12:16:51.672583 IP 192.168.50.101.63415 > 104.18.42.171.443: tcp 0
12:16:51.673331 IP 192.168.50.101.63416 > 104.18.42.171.443: tcp 0
12:16:51.673554 IP 104.18.42.171.443 > 192.168.50.101.63410: tcp 0
12:16:51.674068 IP 192.168.50.101.63417 > 104.18.42.171.443: tcp 0
12:16:51.674826 IP 192.168.50.101.63410 > 104.18.42.171.443: tcp 0
12:16:51.674997 IP 104.18.42.171.443 > 192.168.50.101.63413: tcp 0
12:16:51.676236 IP 192.168.50.101.63413 > 104.18.42.171.443: tcp 0
12:16:51.676256 IP 104.18.42.171.443 > 192.168.50.101.63414: tcp 0
12:16:51.677218 IP 104.18.42.171.443 > 192.168.50.101.63415: tcp 0
12:16:51.677476 IP 192.168.50.101.63414 > 104.18.42.171.443: tcp 0
12:16:51.677937 IP 104.18.42.171.443 > 192.168.50.101.63416: tcp 0
12:16:51.678372 IP 192.168.50.101.63415 > 104.18.42.171.443: tcp 0
12:16:51.678637 IP 104.18.42.171.443 > 192.168.50.101.63417: tcp 0
12:16:51.679463 IP 192.168.50.101.63416 > 104.18.42.171.443: tcp 0
12:16:51.679691 IP 192.168.50.101.63417 > 104.18.42.171.443: tcp 0
12:16:51.685879 IP 192.168.50.101.63410 > 104.18.42.171.443: tcp 517
12:16:51.688545 IP 192.168.50.101.63413 > 104.18.42.171.443: tcp 517
12:16:51.689165 IP 192.168.50.101.63414 > 104.18.42.171.443: tcp 517
12:16:51.689787 IP 192.168.50.101.63415 > 104.18.42.171.443: tcp 517
12:16:51.690371 IP 104.18.42.171.443 > 192.168.50.101.63410: tcp 0
12:16:51.690604 IP 192.168.50.101.63416 > 104.18.42.171.443: tcp 517
12:16:51.691297 IP 192.168.50.101.63417 > 104.18.42.171.443: tcp 517
12:16:51.693071 IP 104.18.42.171.443 > 192.168.50.101.63413: tcp 0
12:16:51.693156 IP 104.18.42.171.443 > 192.168.50.101.63410: tcp 1460
12:16:51.693165 IP 104.18.42.171.443 > 192.168.50.101.63410: tcp 629
12:16:51.693704 IP 104.18.42.171.443 > 192.168.50.101.63414: tcp 0
12:16:51.694382 IP 104.18.42.171.443 > 192.168.50.101.63415: tcp 0
12:16:51.694468 IP 192.168.50.101.63410 > 104.18.42.171.443: tcp 0
12:16:51.694791 IP 104.18.42.171.443 > 192.168.50.101.63413: tcp 1460
12:16:51.694801 IP 104.18.42.171.443 > 192.168.50.101.63413: tcp 631
12:16:51.695121 IP 104.18.42.171.443 > 192.168.50.101.63416: tcp 0
12:16:51.695825 IP 104.18.42.171.443 > 192.168.50.101.63417: tcp 0
12:16:51.696077 IP 104.18.42.171.443 > 192.168.50.101.63414: tcp 1460
12:16:51.696088 IP 104.18.42.171.443 > 192.168.50.101.63414: tcp 630
12:16:51.696146 IP 192.168.50.101.63413 > 104.18.42.171.443: tcp 0
12:16:51.696186 IP 104.18.42.171.443 > 192.168.50.101.63416: tcp 1460
12:16:51.696197 IP 104.18.42.171.443 > 192.168.50.101.63416: tcp 631
12:16:51.697103 IP 104.18.42.171.443 > 192.168.50.101.63417: tcp 1460
12:16:51.697113 IP 104.18.42.171.443 > 192.168.50.101.63417: tcp 630
12:16:51.701091 IP 192.168.50.101.63414 > 104.18.42.171.443: tcp 0
12:16:51.701232 IP 192.168.50.101.63416 > 104.18.42.171.443: tcp 0
12:16:51.701244 IP 192.168.50.101.63417 > 104.18.42.171.443: tcp 0
12:16:51.701837 IP 104.18.42.171.443 > 192.168.50.101.63415: tcp 1460
12:16:51.701848 IP 104.18.42.171.443 > 192.168.50.101.63415: tcp 630
12:16:51.704143 IP 192.168.50.101.63415 > 104.18.42.171.443: tcp 0
12:16:51.732633 IP 192.168.50.101.63413 > 104.18.42.171.443: tcp 64
12:16:51.737140 IP 104.18.42.171.443 > 192.168.50.101.63413: tcp 0
12:16:51.737222 IP 104.18.42.171.443 > 192.168.50.101.63413: tcp 528
12:16:51.748774 IP 192.168.50.101.63410 > 104.18.42.171.443: tcp 64
12:16:51.753286 IP 104.18.42.171.443 > 192.168.50.101.63410: tcp 0
12:16:51.753711 IP 104.18.42.171.443 > 192.168.50.101.63410: tcp 528
12:16:51.763413 IP 192.168.50.101.63417 > 104.18.42.171.443: tcp 64
12:16:51.767981 IP 104.18.42.171.443 > 192.168.50.101.63417: tcp 0
12:16:51.768079 IP 104.18.42.171.443 > 192.168.50.101.63417: tcp 528
12:16:51.785309 IP 192.168.50.101.63413 > 104.18.42.171.443: tcp 0
12:16:51.788274 IP 192.168.50.101.63414 > 104.18.42.171.443: tcp 64
12:16:51.792789 IP 104.18.42.171.443 > 192.168.50.101.63414: tcp 0
12:16:51.792897 IP 104.18.42.171.443 > 192.168.50.101.63414: tcp 528
12:16:51.794902 IP 192.168.50.101.63416 > 104.18.42.171.443: tcp 64
12:16:51.799476 IP 104.18.42.171.443 > 192.168.50.101.63416: tcp 0
12:16:51.799654 IP 104.18.42.171.443 > 192.168.50.101.63416: tcp 528
12:16:51.801617 IP 192.168.50.101.63410 > 104.18.42.171.443: tcp 0
12:16:51.817454 IP 192.168.50.101.63417 > 104.18.42.171.443: tcp 0
12:16:51.829851 IP 192.168.50.101.63415 > 104.18.42.171.443: tcp 64
12:16:51.833566 IP 192.168.50.101.63414 > 104.18.42.171.443: tcp 0
12:16:51.834354 IP 104.18.42.171.443 > 192.168.50.101.63415: tcp 0
12:16:51.834459 IP 104.18.42.171.443 > 192.168.50.101.63415: tcp 528
12:16:51.849370 IP 192.168.50.101.63416 > 104.18.42.171.443: tcp 0
12:16:51.881422 IP 192.168.50.101.63415 > 104.18.42.171.443: tcp 0
12:16:51.892637 IP 192.168.50.101.63413 > 104.18.42.171.443: tcp 92
12:16:51.894832 IP 192.168.50.101.63410 > 104.18.42.171.443: tcp 92
12:16:51.897180 IP 104.18.42.171.443 > 192.168.50.101.63413: tcp 0
12:16:51.897266 IP 104.18.42.171.443 > 192.168.50.101.63413: tcp 31
12:16:51.899364 IP 104.18.42.171.443 > 192.168.50.101.63410: tcp 0
12:16:51.899522 IP 104.18.42.171.443 > 192.168.50.101.63410: tcp 31
12:16:51.940185 IP 192.168.50.101.63417 > 104.18.42.171.443: tcp 92
12:16:51.943309 IP 192.168.50.101.63410 > 104.18.42.171.443: tcp 0
12:16:51.943492 IP 192.168.50.101.63413 > 104.18.42.171.443: tcp 0
12:16:51.944717 IP 104.18.42.171.443 > 192.168.50.101.63417: tcp 0
12:16:51.944790 IP 104.18.42.171.443 > 192.168.50.101.63417: tcp 31
12:16:51.948210 IP 192.168.50.101.63414 > 104.18.42.171.443: tcp 92
12:16:51.948352 IP 192.168.50.101.63416 > 104.18.42.171.443: tcp 92
12:16:51.949155 IP 192.168.50.101.63413 > 104.18.42.171.443: tcp 31
12:16:51.951475 IP 192.168.50.101.63413 > 104.18.42.171.443: tcp 126
12:16:51.952717 IP 104.18.42.171.443 > 192.168.50.101.63414: tcp 0
12:16:51.952782 IP 104.18.42.171.443 > 192.168.50.101.63414: tcp 31
12:16:51.952855 IP 104.18.42.171.443 > 192.168.50.101.63416: tcp 0
12:16:51.952941 IP 104.18.42.171.443 > 192.168.50.101.63416: tcp 31
12:16:51.952946 IP 192.168.50.101.63413 > 104.18.42.171.443: tcp 159
12:16:51.953338 IP 192.168.50.101.63410 > 104.18.42.171.443: tcp 31
12:16:51.953349 IP 192.168.50.101.63410 > 104.18.42.171.443: tcp 126
12:16:51.953361 IP 192.168.50.101.63410 > 104.18.42.171.443: tcp 159
12:16:51.954157 IP 192.168.50.101.63415 > 104.18.42.171.443: tcp 92
12:16:51.954737 IP 192.168.50.101.63417 > 104.18.42.171.443: tcp 31
12:16:51.954883 IP 192.168.50.101.63417 > 104.18.42.171.443: tcp 126
12:16:51.955104 IP 192.168.50.101.63417 > 104.18.42.171.443: tcp 159
12:16:51.956029 IP 104.18.42.171.443 > 192.168.50.101.63413: tcp 0
12:16:51.956466 IP 104.18.42.171.443 > 192.168.50.101.63413: tcp 35
12:16:51.957265 IP 192.168.50.101.63414 > 104.18.42.171.443: tcp 31
12:16:51.957440 IP 192.168.50.101.63414 > 104.18.42.171.443: tcp 126
12:16:51.957701 IP 192.168.50.101.63414 > 104.18.42.171.443: tcp 159
12:16:51.957872 IP 192.168.50.101.63416 > 104.18.42.171.443: tcp 31
12:16:51.957891 IP 104.18.42.171.443 > 192.168.50.101.63410: tcp 0
12:16:51.957999 IP 104.18.42.171.443 > 192.168.50.101.63413: tcp 594
12:16:51.958052 IP 192.168.50.101.63416 > 104.18.42.171.443: tcp 126
12:16:51.958215 IP 192.168.50.101.63416 > 104.18.42.171.443: tcp 159
12:16:51.958446 IP 104.18.42.171.443 > 192.168.50.101.63410: tcp 35
12:16:51.958699 IP 104.18.42.171.443 > 192.168.50.101.63415: tcp 0
12:16:51.958762 IP 104.18.42.171.443 > 192.168.50.101.63415: tcp 31
12:16:51.958967 IP 104.18.42.171.443 > 192.168.50.101.63410: tcp 594
12:16:51.959360 IP 192.168.50.101.63413 > 104.18.42.171.443: tcp 0
12:16:51.959408 IP 104.18.42.171.443 > 192.168.50.101.63417: tcp 0
12:16:51.959777 IP 104.18.42.171.443 > 192.168.50.101.63417: tcp 35
12:16:51.960290 IP 104.18.42.171.443 > 192.168.50.101.63417: tcp 594
12:16:51.960295 IP 192.168.50.101.63410 > 104.18.42.171.443: tcp 0
12:16:51.961457 IP 192.168.50.101.63415 > 104.18.42.171.443: tcp 31
12:16:51.961617 IP 192.168.50.101.63417 > 104.18.42.171.443: tcp 0
12:16:51.961798 IP 192.168.50.101.63415 > 104.18.42.171.443: tcp 126
12:16:51.961963 IP 192.168.50.101.63415 > 104.18.42.171.443: tcp 159
12:16:51.961981 IP 104.18.42.171.443 > 192.168.50.101.63414: tcp 0
12:16:51.962459 IP 104.18.42.171.443 > 192.168.50.101.63414: tcp 35
12:16:51.962546 IP 104.18.42.171.443 > 192.168.50.101.63416: tcp 0
12:16:51.962986 IP 104.18.42.171.443 > 192.168.50.101.63416: tcp 35
12:16:51.963348 IP 104.18.42.171.443 > 192.168.50.101.63414: tcp 594
12:16:51.963743 IP 104.18.42.171.443 > 192.168.50.101.63416: tcp 593
12:16:51.965001 IP 192.168.50.101.63414 > 104.18.42.171.443: tcp 0
12:16:51.965271 IP 192.168.50.101.63416 > 104.18.42.171.443: tcp 0
12:16:51.966291 IP 104.18.42.171.443 > 192.168.50.101.63415: tcp 0
12:16:51.966660 IP 104.18.42.171.443 > 192.168.50.101.63415: tcp 35
12:16:51.967349 IP 104.18.42.171.443 > 192.168.50.101.63415: tcp 594
12:16:51.968531 IP 192.168.50.101.63415 > 104.18.42.171.443: tcp 0
12:16:53.047288 IP 192.168.50.101.63422 > 104.18.42.171.443: tcp 0
12:16:53.051844 IP 104.18.42.171.443 > 192.168.50.101.63422: tcp 0
12:16:53.053465 IP 192.168.50.101.63422 > 104.18.42.171.443: tcp 0
12:16:53.054057 IP 192.168.50.101.63422 > 104.18.42.171.443: tcp 517
12:16:53.058567 IP 104.18.42.171.443 > 192.168.50.101.63422: tcp 0
12:16:53.059754 IP 104.18.42.171.443 > 192.168.50.101.63422: tcp 1460
12:16:53.059764 IP 104.18.42.171.443 > 192.168.50.101.63422: tcp 631
12:16:53.061236 IP 192.168.50.101.63422 > 104.18.42.171.443: tcp 0
12:16:53.146533 IP 192.168.50.101.63422 > 104.18.42.171.443: tcp 64
12:16:53.149484 IP 192.168.50.101.63422 > 104.18.42.171.443: tcp 92
12:16:53.151062 IP 104.18.42.171.443 > 192.168.50.101.63422: tcp 0
12:16:53.151202 IP 104.18.42.171.443 > 192.168.50.101.63422: tcp 528
12:16:53.153964 IP 104.18.42.171.443 > 192.168.50.101.63422: tcp 0
12:16:53.154016 IP 104.18.42.171.443 > 192.168.50.101.63422: tcp 31
12:16:53.155212 IP 192.168.50.101.63422 > 104.18.42.171.443: tcp 0
12:16:53.157629 IP 192.168.50.101.63422 > 104.18.42.171.443: tcp 126
12:16:53.157781 IP 192.168.50.101.63422 > 104.18.42.171.443: tcp 159
12:16:53.162134 IP 104.18.42.171.443 > 192.168.50.101.63422: tcp 0
12:16:53.162248 IP 104.18.42.171.443 > 192.168.50.101.63422: tcp 0
12:16:53.162660 IP 104.18.42.171.443 > 192.168.50.101.63422: tcp 35
12:16:53.163549 IP 104.18.42.171.443 > 192.168.50.101.63422: tcp 594
12:16:53.165236 IP 192.168.50.101.63422 > 104.18.42.171.443: tcp 0
12:16:53.178725 IP 192.168.50.101.63422 > 104.18.42.171.443: tcp 31
12:16:53.223980 IP 104.18.42.171.443 > 192.168.50.101.63422: tcp 0
12:16:53.230194 IP 192.168.50.101.59599 > 192.168.50.1.53: UDP, length 36
12:16:53.230271 IP 192.168.50.1.53 > 192.168.50.101.59599: UDP, length 111
12:16:53.931006 IP 192.168.50.101.49668 > 192.168.8.114.161: UDP, length 78
12:16:55.770665 IP 192.168.50.101.63424 > 104.18.42.171.443: tcp 0
12:16:55.775295 IP 104.18.42.171.443 > 192.168.50.101.63424: tcp 0
12:16:55.777144 IP 192.168.50.101.63424 > 104.18.42.171.443: tcp 0
12:16:55.777758 IP 192.168.50.101.63424 > 104.18.42.171.443: tcp 517
12:16:55.782289 IP 104.18.42.171.443 > 192.168.50.101.63424: tcp 0
12:16:55.783410 IP 104.18.42.171.443 > 192.168.50.101.63424: tcp 1460
12:16:55.783420 IP 104.18.42.171.443 > 192.168.50.101.63424: tcp 629
12:16:55.784991 IP 192.168.50.101.63424 > 104.18.42.171.443: tcp 0
12:16:55.802880 IP 192.168.50.101.63424 > 104.18.42.171.443: tcp 64
12:16:55.803709 IP 192.168.50.101.63424 > 104.18.42.171.443: tcp 92
12:16:55.804060 IP 192.168.50.101.63424 > 104.18.42.171.443: tcp 126
12:16:55.804249 IP 192.168.50.101.63424 > 104.18.42.171.443: tcp 159
12:16:55.807385 IP 104.18.42.171.443 > 192.168.50.101.63424: tcp 0
12:16:55.807558 IP 104.18.42.171.443 > 192.168.50.101.63424: tcp 528
12:16:55.808231 IP 104.18.42.171.443 > 192.168.50.101.63424: tcp 0
12:16:55.808327 IP 104.18.42.171.443 > 192.168.50.101.63424: tcp 31
12:16:55.808991 IP 104.18.42.171.443 > 192.168.50.101.63424: tcp 35
12:16:55.809513 IP 192.168.50.101.63424 > 104.18.42.171.443: tcp 0
12:16:55.809726 IP 104.18.42.171.443 > 192.168.50.101.63424: tcp 594
12:16:55.810842 IP 192.168.50.101.63424 > 104.18.42.171.443: tcp 0
12:16:55.813712 IP 192.168.50.101.63424 > 104.18.42.171.443: tcp 31
12:16:55.842523 IP 192.168.50.101.63803 > 192.168.50.1.53: UDP, length 37
12:16:55.842630 IP 192.168.50.1.53 > 192.168.50.101.63803: UDP, length 77
12:16:55.859877 IP 104.18.42.171.443 > 192.168.50.101.63424: tcp 0
12:16:55.864284 IP 192.168.50.101.63424 > 104.18.42.171.443: tcp 55
12:16:55.864458 IP 192.168.50.101.63424 > 104.18.42.171.443: tcp 159
12:16:55.868804 IP 104.18.42.171.443 > 192.168.50.101.63424: tcp 0
12:16:55.868986 IP 104.18.42.171.443 > 192.168.50.101.63424: tcp 0
12:16:55.869256 IP 104.18.42.171.443 > 192.168.50.101.63424: tcp 35
12:16:55.869819 IP 104.18.42.171.443 > 192.168.50.101.63424: tcp 531
12:16:55.871007 IP 192.168.50.101.63424 > 104.18.42.171.443: tcp 0
12:16:55.923066 IP 192.168.50.101.63427 > 142.251.39.68.443: tcp 0
12:16:55.923283 IP 192.168.50.101.63428 > 142.251.39.68.443: tcp 0
12:16:55.927621 IP 142.251.39.68.443 > 192.168.50.101.63427: tcp 0
12:16:55.927722 IP 142.251.39.68.443 > 192.168.50.101.63428: tcp 0
12:16:55.929682 IP 192.168.50.101.63427 > 142.251.39.68.443: tcp 0
12:16:55.929706 IP 192.168.50.101.63428 > 142.251.39.68.443: tcp 0
12:16:55.929738 IP 192.168.50.101.63428 > 142.251.39.68.443: tcp 517
12:16:55.934163 IP 142.251.39.68.443 > 192.168.50.101.63428: tcp 0
12:16:55.936032 IP 192.168.50.101.63427 > 142.251.39.68.443: tcp 517
12:16:55.940533 IP 142.251.39.68.443 > 192.168.50.101.63427: tcp 0
12:16:55.950314 IP 192.168.50.101.63424 > 104.18.42.171.443: tcp 55
12:16:55.950597 IP 192.168.50.101.63424 > 104.18.42.171.443: tcp 159
12:16:55.954756 IP 142.251.39.68.443 > 192.168.50.101.63428: tcp 1430
12:16:55.954768 IP 142.251.39.68.443 > 192.168.50.101.63428: tcp 1430
12:16:55.954781 IP 142.251.39.68.443 > 192.168.50.101.63428: tcp 1427
12:16:55.954833 IP 104.18.42.171.443 > 192.168.50.101.63424: tcp 0
12:16:55.955088 IP 104.18.42.171.443 > 192.168.50.101.63424: tcp 0
12:16:55.955249 IP 104.18.42.171.443 > 192.168.50.101.63424: tcp 35
12:16:55.955938 IP 104.18.42.171.443 > 192.168.50.101.63424: tcp 532
12:16:55.956518 IP 192.168.50.101.63428 > 142.251.39.68.443: tcp 0
12:16:55.957058 IP 192.168.50.101.63424 > 104.18.42.171.443: tcp 0
12:16:55.961126 IP 142.251.39.68.443 > 192.168.50.101.63427: tcp 1430
12:16:55.961140 IP 142.251.39.68.443 > 192.168.50.101.63427: tcp 1430
12:16:55.961153 IP 142.251.39.68.443 > 192.168.50.101.63427: tcp 1426
12:16:55.962385 IP 192.168.50.101.63429 > 172.217.19.106.443: tcp 0
12:16:55.963371 IP 192.168.50.101.63427 > 142.251.39.68.443: tcp 0
12:16:55.966798 IP 172.217.19.106.443 > 192.168.50.101.63429: tcp 0
12:16:55.968073 IP 192.168.50.101.63429 > 172.217.19.106.443: tcp 0
12:16:55.974104 IP 192.168.50.101.63429 > 172.217.19.106.443: tcp 517
12:16:55.978494 IP 172.217.19.106.443 > 192.168.50.101.63429: tcp 0
12:16:55.999242 IP 172.217.19.106.443 > 192.168.50.101.63429: tcp 1430
12:16:55.999255 IP 172.217.19.106.443 > 192.168.50.101.63429: tcp 1430
12:16:55.999268 IP 172.217.19.106.443 > 192.168.50.101.63429: tcp 1430
12:16:55.999278 IP 172.217.19.106.443 > 192.168.50.101.63429: tcp 392
12:16:56.001179 IP 192.168.50.101.63429 > 172.217.19.106.443: tcp 0
12:16:56.012347 IP 192.168.50.101.63428 > 142.251.39.68.443: tcp 64
12:16:56.012781 IP 192.168.50.101.63427 > 142.251.39.68.443: tcp 64
12:16:56.013178 IP 192.168.50.101.63427 > 142.251.39.68.443: tcp 0
12:16:56.013499 IP 192.168.50.101.63428 > 142.251.39.68.443: tcp 92
12:16:56.014015 IP 192.168.50.101.63428 > 142.251.39.68.443: tcp 1430
12:16:56.014025 IP 192.168.50.101.63428 > 142.251.39.68.443: tcp 75
12:16:56.018014 IP 142.251.39.68.443 > 192.168.50.101.63428: tcp 0
12:16:56.018076 IP 142.251.39.68.443 > 192.168.50.101.63428: tcp 614
12:16:56.018138 IP 142.251.39.68.443 > 192.168.50.101.63427: tcp 614
12:16:56.018149 IP 142.251.39.68.443 > 192.168.50.101.63427: tcp 0
12:16:56.018224 IP 142.251.39.68.443 > 192.168.50.101.63428: tcp 31
12:16:56.018473 IP 142.251.39.68.443 > 192.168.50.101.63428: tcp 0
12:16:56.019458 IP 192.168.50.101.63427 > 142.251.39.68.443: tcp 0
12:16:56.019813 IP 192.168.50.101.63428 > 142.251.39.68.443: tcp 0
12:16:56.038818 IP 192.168.50.101.63429 > 172.217.19.106.443: tcp 64
12:16:56.039217 IP 192.168.50.101.63429 > 172.217.19.106.443: tcp 92
12:16:56.039601 IP 192.168.50.101.63429 > 172.217.19.106.443: tcp 281
12:16:56.039819 IP 192.168.50.101.63429 > 172.217.19.106.443: tcp 310
12:16:56.042713 IP 192.168.50.101.63428 > 142.251.39.68.443: tcp 31
12:16:56.043634 IP 172.217.19.106.443 > 192.168.50.101.63429: tcp 614
12:16:56.043708 IP 172.217.19.106.443 > 192.168.50.101.63429: tcp 31
12:16:56.044203 IP 172.217.19.106.443 > 192.168.50.101.63429: tcp 0
12:16:56.045040 IP 192.168.50.101.63429 > 172.217.19.106.443: tcp 0
12:16:56.045515 IP 192.168.50.101.63429 > 172.217.19.106.443: tcp 31
12:16:56.052194 IP 142.251.39.68.443 > 192.168.50.101.63428: tcp 0
12:16:56.055083 IP 172.217.19.106.443 > 192.168.50.101.63429: tcp 0
12:16:56.071786 IP 192.168.50.101.63430 > 142.251.39.78.443: tcp 0
12:16:56.076267 IP 142.251.39.78.443 > 192.168.50.101.63430: tcp 0
12:16:56.077691 IP 192.168.50.101.63430 > 142.251.39.78.443: tcp 0
12:16:56.078400 IP 192.168.50.101.63430 > 142.251.39.78.443: tcp 517
12:16:56.082877 IP 142.251.39.78.443 > 192.168.50.101.63430: tcp 0
12:16:56.083423 IP 142.251.39.68.443 > 192.168.50.101.63428: tcp 1277
12:16:56.083433 IP 142.251.39.68.443 > 192.168.50.101.63428: tcp 1408
12:16:56.084890 IP 192.168.50.101.63428 > 142.251.39.68.443: tcp 0
12:16:56.087206 IP 142.251.39.68.443 > 192.168.50.101.63428: tcp 32
12:16:56.087369 IP 142.251.39.68.443 > 192.168.50.101.63428: tcp 31
12:16:56.087437 IP 142.251.39.68.443 > 192.168.50.101.63428: tcp 39
12:16:56.088478 IP 192.168.50.101.63428 > 142.251.39.68.443: tcp 0
12:16:56.089119 IP 192.168.50.101.63428 > 142.251.39.68.443: tcp 39
12:16:56.091862 IP 172.217.19.106.443 > 192.168.50.101.63429: tcp 412
12:16:56.091875 IP 172.217.19.106.443 > 192.168.50.101.63429: tcp 496
12:16:56.092113 IP 172.217.19.106.443 > 192.168.50.101.63429: tcp 206
12:16:56.092192 IP 172.217.19.106.443 > 192.168.50.101.63429: tcp 39
12:16:56.093208 IP 192.168.50.101.63429 > 172.217.19.106.443: tcp 0
12:16:56.093390 IP 192.168.50.101.63429 > 172.217.19.106.443: tcp 0
12:16:56.096179 IP 192.168.50.101.63429 > 172.217.19.106.443: tcp 39
12:16:56.098210 IP 142.251.39.68.443 > 192.168.50.101.63428: tcp 0
12:16:56.100172 IP 192.168.50.101.63424 > 104.18.42.171.443: tcp 55
12:16:56.100494 IP 192.168.50.101.63424 > 104.18.42.171.443: tcp 159
12:16:56.100581 IP 172.217.19.106.443 > 192.168.50.101.63429: tcp 0
12:16:56.103439 IP 142.251.39.78.443 > 192.168.50.101.63430: tcp 1430
12:16:56.103453 IP 142.251.39.78.443 > 192.168.50.101.63430: tcp 1430
12:16:56.103464 IP 142.251.39.78.443 > 192.168.50.101.63430: tcp 1430
12:16:56.103476 IP 142.251.39.78.443 > 192.168.50.101.63430: tcp 1430
12:16:56.103487 IP 142.251.39.78.443 > 192.168.50.101.63430: tcp 951
12:16:56.104710 IP 104.18.42.171.443 > 192.168.50.101.63424: tcp 0
12:16:56.105097 IP 104.18.42.171.443 > 192.168.50.101.63424: tcp 35
12:16:56.105209 IP 192.168.50.101.63430 > 142.251.39.78.443: tcp 0
12:16:56.105676 IP 104.18.42.171.443 > 192.168.50.101.63424: tcp 555
12:16:56.107174 IP 192.168.50.101.63424 > 104.18.42.171.443: tcp 0
12:16:56.145684 IP 192.168.50.101.63430 > 142.251.39.78.443: tcp 64
12:16:56.145870 IP 192.168.50.101.63430 > 142.251.39.78.443: tcp 92
12:16:56.146362 IP 192.168.50.101.63430 > 142.251.39.78.443: tcp 528
12:16:56.147187 IP 192.168.50.101.63431 > 142.251.39.14.443: tcp 0
12:16:56.150504 IP 142.251.39.78.443 > 192.168.50.101.63430: tcp 614
12:16:56.150530 IP 142.251.39.78.443 > 192.168.50.101.63430: tcp 31
12:16:56.151705 IP 142.251.39.14.443 > 192.168.50.101.63431: tcp 0
12:16:56.151898 IP 192.168.50.101.63430 > 142.251.39.78.443: tcp 0
12:16:56.152941 IP 192.168.50.101.63431 > 142.251.39.14.443: tcp 0
12:16:56.155110 IP 192.168.50.101.63431 > 142.251.39.14.443: tcp 517
12:16:56.155238 IP 192.168.50.101.63430 > 142.251.39.78.443: tcp 31
12:16:56.155446 IP 142.251.39.78.443 > 192.168.50.101.63430: tcp 0
12:16:56.159539 IP 142.251.39.14.443 > 192.168.50.101.63431: tcp 0
12:16:56.159643 IP 142.251.39.78.443 > 192.168.50.101.63430: tcp 0
12:16:56.178300 IP 142.251.39.78.443 > 192.168.50.101.63430: tcp 575
12:16:56.178361 IP 142.251.39.78.443 > 192.168.50.101.63430: tcp 736
12:16:56.178370 IP 142.251.39.78.443 > 192.168.50.101.63430: tcp 252
12:16:56.178426 IP 142.251.39.78.443 > 192.168.50.101.63430: tcp 39
12:16:56.179859 IP 192.168.50.101.63430 > 142.251.39.78.443: tcp 0
12:16:56.180535 IP 142.251.39.14.443 > 192.168.50.101.63431: tcp 1430
12:16:56.180548 IP 142.251.39.14.443 > 192.168.50.101.63431: tcp 1430
12:16:56.180562 IP 142.251.39.14.443 > 192.168.50.101.63431: tcp 1430
12:16:56.180571 IP 142.251.39.14.443 > 192.168.50.101.63431: tcp 1430
12:16:56.180585 IP 142.251.39.14.443 > 192.168.50.101.63431: tcp 950
12:16:56.182395 IP 192.168.50.101.63431 > 142.251.39.14.443: tcp 0
12:16:56.183563 IP 192.168.50.101.63431 > 142.251.39.14.443: tcp 0
12:16:56.191454 IP 192.168.50.101.63430 > 142.251.39.78.443: tcp 39
12:16:56.200439 IP 142.251.39.78.443 > 192.168.50.101.63430: tcp 0
12:16:56.221313 IP 192.168.50.101.63431 > 142.251.39.14.443: tcp 64
12:16:56.221415 IP 192.168.50.101.63431 > 142.251.39.14.443: tcp 92
12:16:56.222214 IP 192.168.50.101.63431 > 142.251.39.14.443: tcp 731
12:16:56.222401 IP 192.168.50.101.63431 > 142.251.39.14.443: tcp 368
12:16:56.226007 IP 142.251.39.14.443 > 192.168.50.101.63431: tcp 614
12:16:56.226088 IP 142.251.39.14.443 > 192.168.50.101.63431: tcp 31
12:16:56.226814 IP 142.251.39.14.443 > 192.168.50.101.63431: tcp 0
12:16:56.227415 IP 192.168.50.101.63431 > 142.251.39.14.443: tcp 0
12:16:56.227698 IP 192.168.50.101.63431 > 142.251.39.14.443: tcp 31
12:16:56.236904 IP 142.251.39.14.443 > 192.168.50.101.63431: tcp 0
12:16:56.351450 IP 192.168.50.101.53179 > 142.251.39.68.443: UDP, length 1250
12:16:56.352861 IP 192.168.50.101.63428 > 142.251.39.68.443: tcp 166
12:16:56.357361 IP 142.251.39.68.443 > 192.168.50.101.53179: UDP, length 1250
12:16:56.357364 IP 142.251.39.68.443 > 192.168.50.101.63428: tcp 0
12:16:56.377786 IP 142.251.39.68.443 > 192.168.50.101.53179: UDP, length 1250
12:16:56.377798 IP 142.251.39.68.443 > 192.168.50.101.53179: UDP, length 1250
12:16:56.386003 IP 142.251.39.14.443 > 192.168.50.101.63431: tcp 441
12:16:56.386016 IP 142.251.39.14.443 > 192.168.50.101.63431: tcp 473
12:16:56.386522 IP 142.251.39.14.443 > 192.168.50.101.63431: tcp 185
12:16:56.386534 IP 142.251.39.14.443 > 192.168.50.101.63431: tcp 85
12:16:56.386588 IP 142.251.39.14.443 > 192.168.50.101.63431: tcp 39
12:16:56.387620 IP 192.168.50.101.63431 > 142.251.39.14.443: tcp 0
12:16:56.387955 IP 192.168.50.101.63431 > 142.251.39.14.443: tcp 0
12:16:56.395481 IP 192.168.50.101.53179 > 142.251.39.68.443: UDP, length 41
12:16:56.397749 IP 192.168.50.101.63431 > 142.251.39.14.443: tcp 39
12:16:56.400050 IP 142.251.39.68.443 > 192.168.50.101.53179: UDP, length 1250
12:16:56.400061 IP 142.251.39.68.443 > 192.168.50.101.53179: UDP, length 673
12:16:56.402147 IP 142.251.39.14.443 > 192.168.50.101.63431: tcp 0
12:16:56.408024 IP 192.168.50.101.53179 > 142.251.39.68.443: UDP, length 41
12:16:56.425166 IP 192.168.50.101.53179 > 142.251.39.68.443: UDP, length 83
12:16:56.425399 IP 192.168.50.101.53179 > 142.251.39.68.443: UDP, length 72
12:16:56.429366 IP 192.168.50.101.53179 > 142.251.39.68.443: UDP, length 33
12:16:56.429892 IP 142.251.39.68.443 > 192.168.50.101.53179: UDP, length 629
12:16:56.429902 IP 142.251.39.68.443 > 192.168.50.101.53179: UDP, length 93
12:16:56.431676 IP 192.168.50.101.53179 > 142.251.39.68.443: UDP, length 33
12:16:56.446574 IP 142.251.39.68.443 > 192.168.50.101.63428: tcp 465
12:16:56.446640 IP 142.251.39.68.443 > 192.168.50.101.63428: tcp 1430
12:16:56.446775 IP 142.251.39.68.443 > 192.168.50.101.63428: tcp 1430
12:16:56.446786 IP 142.251.39.68.443 > 192.168.50.101.63428: tcp 1430
12:16:56.446799 IP 142.251.39.68.443 > 192.168.50.101.63428: tcp 1430
12:16:56.447209 IP 142.251.39.68.443 > 192.168.50.101.63428: tcp 550
12:16:56.447275 IP 142.251.39.68.443 > 192.168.50.101.63428: tcp 163
12:16:56.448580 IP 192.168.50.101.63428 > 142.251.39.68.443: tcp 0
12:16:56.448883 IP 192.168.50.101.63428 > 142.251.39.68.443: tcp 0
12:16:56.454919 IP 142.251.39.68.443 > 192.168.50.101.53179: UDP, length 25
12:16:56.459506 IP 142.251.39.68.443 > 192.168.50.101.63428: tcp 1430
12:16:56.459604 IP 142.251.39.68.443 > 192.168.50.101.63428: tcp 1430
12:16:56.459615 IP 142.251.39.68.443 > 192.168.50.101.63428: tcp 1430
12:16:56.459865 IP 142.251.39.68.443 > 192.168.50.101.63428: tcp 1430
12:16:56.459877 IP 142.251.39.68.443 > 192.168.50.101.63428: tcp 1430
12:16:56.459889 IP 142.251.39.68.443 > 192.168.50.101.63428: tcp 1430
12:16:56.459900 IP 142.251.39.68.443 > 192.168.50.101.63428: tcp 1430
12:16:56.460504 IP 142.251.39.68.443 > 192.168.50.101.63428: tcp 1430
12:16:56.460516 IP 142.251.39.68.443 > 192.168.50.101.63428: tcp 1430
12:16:56.460528 IP 142.251.39.68.443 > 192.168.50.101.63428: tcp 1430
12:16:56.460540 IP 142.251.39.68.443 > 192.168.50.101.63428: tcp 1430
12:16:56.460550 IP 142.251.39.68.443 > 192.168.50.101.63428: tcp 927
12:16:56.462150 IP 192.168.50.101.63428 > 142.251.39.68.443: tcp 0
12:16:56.462161 IP 192.168.50.101.63428 > 142.251.39.68.443: tcp 0
12:16:56.462182 IP 192.168.50.101.63428 > 142.251.39.68.443: tcp 0
12:16:56.462344 IP 192.168.50.101.63428 > 142.251.39.68.443: tcp 0
12:16:56.473150 IP 142.251.39.68.443 > 192.168.50.101.63428: tcp 1430
12:16:56.473223 IP 142.251.39.68.443 > 192.168.50.101.63428: tcp 1430
12:16:56.473236 IP 142.251.39.68.443 > 192.168.50.101.63428: tcp 1430
12:16:56.473534 IP 142.251.39.68.443 > 192.168.50.101.63428: tcp 1430
12:16:56.473547 IP 142.251.39.68.443 > 192.168.50.101.63428: tcp 1430
12:16:56.473558 IP 142.251.39.68.443 > 192.168.50.101.63428: tcp 1430
12:16:56.473570 IP 142.251.39.68.443 > 192.168.50.101.63428: tcp 1430
12:16:56.474172 IP 142.251.39.68.443 > 192.168.50.101.63428: tcp 1430
12:16:56.474184 IP 142.251.39.68.443 > 192.168.50.101.63428: tcp 1430
12:16:56.474195 IP 142.251.39.68.443 > 192.168.50.101.63428: tcp 1430
12:16:56.474208 IP 142.251.39.68.443 > 192.168.50.101.63428: tcp 1430
12:16:56.474217 IP 142.251.39.68.443 > 192.168.50.101.63428: tcp 927
12:16:56.475255 IP 142.251.39.68.443 > 192.168.50.101.63428: tcp 1430
12:16:56.475320 IP 142.251.39.68.443 > 192.168.50.101.63428: tcp 1430
12:16:56.475331 IP 142.251.39.68.443 > 192.168.50.101.63428: tcp 424
12:16:56.475599 IP 142.251.39.68.443 > 192.168.50.101.63428: tcp 31
12:16:56.475609 IP 142.251.39.68.443 > 192.168.50.101.63428: tcp 39
12:16:56.475866 IP 192.168.50.101.63428 > 142.251.39.68.443: tcp 0
12:16:56.475899 IP 192.168.50.101.63428 > 142.251.39.68.443: tcp 0
12:16:56.475908 IP 192.168.50.101.63428 > 142.251.39.68.443: tcp 0
12:16:56.475916 IP 192.168.50.101.63428 > 142.251.39.68.443: tcp 0
12:16:56.478713 IP 192.168.50.101.63428 > 142.251.39.68.443: tcp 0
12:16:56.479005 IP 192.168.50.101.63428 > 142.251.39.68.443: tcp 39
12:16:56.482373 IP 192.168.50.101.53179 > 142.251.39.68.443: UDP, length 765
12:16:56.483468 IP 142.251.39.68.443 > 192.168.50.101.63428: tcp 0
12:16:56.487982 IP 142.251.39.68.443 > 192.168.50.101.53179: UDP, length 27
12:16:56.516143 IP 192.168.50.101.53179 > 142.251.39.68.443: UDP, length 33
12:16:56.553677 IP 142.251.39.68.443 > 192.168.50.101.53179: UDP, length 819
12:16:56.553770 IP 142.251.39.68.443 > 192.168.50.101.53179: UDP, length 153
12:16:56.556679 IP 192.168.50.101.53179 > 142.251.39.68.443: UDP, length 35
12:16:56.583427 IP 192.168.50.101.53179 > 142.251.39.68.443: UDP, length 33
12:16:56.586262 IP 142.251.39.68.443 > 192.168.50.101.53179: UDP, length 25
12:16:58.066217 IP 192.168.50.101.63424 > 104.18.42.171.443: tcp 55
12:16:58.066244 IP 192.168.50.101.63424 > 104.18.42.171.443: tcp 159
12:16:58.070761 IP 104.18.42.171.443 > 192.168.50.101.63424: tcp 0
12:16:58.071200 IP 104.18.42.171.443 > 192.168.50.101.63424: tcp 35
12:16:58.071757 IP 104.18.42.171.443 > 192.168.50.101.63424: tcp 555
12:16:58.073054 IP 192.168.50.101.63424 > 104.18.42.171.443: tcp 0
12:16:58.105351 IP 192.168.50.101.56057 > 172.217.19.97.443: UDP, length 1250
12:16:58.111028 IP 172.217.19.97.443 > 192.168.50.101.56057: UDP, length 1250
12:16:58.114863 IP 192.168.50.101.56057 > 172.217.19.97.443: UDP, length 1250
12:16:58.134339 IP 172.217.19.97.443 > 192.168.50.101.56057: UDP, length 1250
12:16:58.134352 IP 172.217.19.97.443 > 192.168.50.101.56057: UDP, length 1250
12:16:58.134362 IP 172.217.19.97.443 > 192.168.50.101.56057: UDP, length 1250
12:16:58.134373 IP 172.217.19.97.443 > 192.168.50.101.56057: UDP, length 623
12:16:58.138153 IP 192.168.50.101.56057 > 172.217.19.97.443: UDP, length 41
12:16:58.138961 IP 192.168.50.101.56057 > 172.217.19.97.443: UDP, length 41
12:16:58.160674 IP 192.168.50.101.56057 > 172.217.19.97.443: UDP, length 83
12:16:58.161134 IP 192.168.50.101.56057 > 172.217.19.97.443: UDP, length 67
12:16:58.162003 IP 192.168.50.101.56057 > 172.217.19.97.443: UDP, length 408
12:16:58.165415 IP 172.217.19.97.443 > 192.168.50.101.56057: UDP, length 629
12:16:58.165425 IP 172.217.19.97.443 > 192.168.50.101.56057: UDP, length 93
12:16:58.166800 IP 172.217.19.97.443 > 192.168.50.101.56057: UDP, length 27
12:16:58.167996 IP 192.168.50.101.56057 > 172.217.19.97.443: UDP, length 33
12:16:58.193619 IP 192.168.50.101.56057 > 172.217.19.97.443: UDP, length 33
12:16:58.221189 IP 172.217.19.97.443 > 192.168.50.101.56057: UDP, length 1246
12:16:58.221203 IP 172.217.19.97.443 > 192.168.50.101.56057: UDP, length 1250
12:16:58.221212 IP 172.217.19.97.443 > 192.168.50.101.56057: UDP, length 1250
12:16:58.221224 IP 172.217.19.97.443 > 192.168.50.101.56057: UDP, length 1250
12:16:58.221232 IP 172.217.19.97.443 > 192.168.50.101.56057: UDP, length 1250
12:16:58.221245 IP 172.217.19.97.443 > 192.168.50.101.56057: UDP, length 1250
12:16:58.221254 IP 172.217.19.97.443 > 192.168.50.101.56057: UDP, length 1250
12:16:58.221265 IP 172.217.19.97.443 > 192.168.50.101.56057: UDP, length 1250
12:16:58.221276 IP 172.217.19.97.443 > 192.168.50.101.56057: UDP, length 1250
12:16:58.221287 IP 172.217.19.97.443 > 192.168.50.101.56057: UDP, length 1250
12:16:58.221295 IP 172.217.19.97.443 > 192.168.50.101.56057: UDP, length 1250
12:16:58.221307 IP 172.217.19.97.443 > 192.168.50.101.56057: UDP, length 1250
12:16:58.221320 IP 172.217.19.97.443 > 192.168.50.101.56057: UDP, length 1250
12:16:58.221328 IP 172.217.19.97.443 > 192.168.50.101.56057: UDP, length 106
12:16:58.224927 IP 192.168.50.101.56057 > 172.217.19.97.443: UDP, length 35
12:16:58.225353 IP 192.168.50.101.56057 > 172.217.19.97.443: UDP, length 33
12:16:58.225636 IP 192.168.50.101.56057 > 172.217.19.97.443: UDP, length 33
12:16:58.225912 IP 192.168.50.101.56057 > 172.217.19.97.443: UDP, length 33
12:16:58.226265 IP 192.168.50.101.56057 > 172.217.19.97.443: UDP, length 33
12:16:58.226530 IP 192.168.50.101.56057 > 172.217.19.97.443: UDP, length 33
12:16:58.226754 IP 192.168.50.101.56057 > 172.217.19.97.443: UDP, length 33
12:16:58.239074 IP 172.217.19.97.443 > 192.168.50.101.56057: UDP, length 1245
12:16:58.239087 IP 172.217.19.97.443 > 192.168.50.101.56057: UDP, length 1250
12:16:58.239097 IP 172.217.19.97.443 > 192.168.50.101.56057: UDP, length 1250
12:16:58.239110 IP 172.217.19.97.443 > 192.168.50.101.56057: UDP, length 1250
12:16:58.239118 IP 172.217.19.97.443 > 192.168.50.101.56057: UDP, length 1250
12:16:58.239131 IP 172.217.19.97.443 > 192.168.50.101.56057: UDP, length 1250
12:16:58.240468 IP 172.217.19.97.443 > 192.168.50.101.56057: UDP, length 1250
12:16:58.240479 IP 172.217.19.97.443 > 192.168.50.101.56057: UDP, length 1250
12:16:58.240492 IP 172.217.19.97.443 > 192.168.50.101.56057: UDP, length 1250
12:16:58.240501 IP 172.217.19.97.443 > 192.168.50.101.56057: UDP, length 1250
12:16:58.240511 IP 172.217.19.97.443 > 192.168.50.101.56057: UDP, length 1250
12:16:58.240524 IP 172.217.19.97.443 > 192.168.50.101.56057: UDP, length 1250
12:16:58.241849 IP 172.217.19.97.443 > 192.168.50.101.56057: UDP, length 1250
12:16:58.241859 IP 172.217.19.97.443 > 192.168.50.101.56057: UDP, length 484
12:16:58.241953 IP 192.168.50.101.56057 > 172.217.19.97.443: UDP, length 33
12:16:58.242142 IP 192.168.50.101.56057 > 172.217.19.97.443: UDP, length 33
12:16:58.242174 IP 192.168.50.101.56057 > 172.217.19.97.443: UDP, length 33
12:16:58.242977 IP 192.168.50.101.56057 > 172.217.19.97.443: UDP, length 33
12:16:58.243383 IP 192.168.50.101.56057 > 172.217.19.97.443: UDP, length 33
12:16:58.243533 IP 192.168.50.101.56057 > 172.217.19.97.443: UDP, length 33
12:16:58.243771 IP 192.168.50.101.56057 > 172.217.19.97.443: UDP, length 33
12:16:58.246117 IP 172.217.19.97.443 > 192.168.50.101.56057: UDP, length 1243
12:16:58.246128 IP 172.217.19.97.443 > 192.168.50.101.56057: UDP, length 1250
12:16:58.246141 IP 172.217.19.97.443 > 192.168.50.101.56057: UDP, length 1250
12:16:58.246150 IP 172.217.19.97.443 > 192.168.50.101.56057: UDP, length 1250
12:16:58.246160 IP 172.217.19.97.443 > 192.168.50.101.56057: UDP, length 1250
12:16:58.246172 IP 172.217.19.97.443 > 192.168.50.101.56057: UDP, length 1250
12:16:58.246604 IP 172.217.19.97.443 > 192.168.50.101.56057: UDP, length 1250
12:16:58.246615 IP 172.217.19.97.443 > 192.168.50.101.56057: UDP, length 1250
12:16:58.247453 IP 172.217.19.97.443 > 192.168.50.101.56057: UDP, length 1250
12:16:58.247464 IP 172.217.19.97.443 > 192.168.50.101.56057: UDP, length 1250
12:16:58.247477 IP 172.217.19.97.443 > 192.168.50.101.56057: UDP, length 1250
12:16:58.247485 IP 172.217.19.97.443 > 192.168.50.101.56057: UDP, length 1250
12:16:58.248493 IP 172.217.19.97.443 > 192.168.50.101.56057: UDP, length 1250
12:16:58.248503 IP 172.217.19.97.443 > 192.168.50.101.56057: UDP, length 483
12:16:58.249196 IP 192.168.50.101.56057 > 172.217.19.97.443: UDP, length 33
12:16:58.249904 IP 192.168.50.101.56057 > 172.217.19.97.443: UDP, length 33
12:16:58.250465 IP 192.168.50.101.56057 > 172.217.19.97.443: UDP, length 33
12:16:58.250665 IP 192.168.50.101.56057 > 172.217.19.97.443: UDP, length 33
12:16:58.250869 IP 192.168.50.101.56057 > 172.217.19.97.443: UDP, length 33
12:16:58.251113 IP 192.168.50.101.56057 > 172.217.19.97.443: UDP, length 33
12:16:58.251361 IP 192.168.50.101.56057 > 172.217.19.97.443: UDP, length 36
12:16:58.262918 IP 172.217.19.97.443 > 192.168.50.101.56057: UDP, length 1243
12:16:58.262930 IP 172.217.19.97.443 > 192.168.50.101.56057: UDP, length 1250
12:16:58.262940 IP 172.217.19.97.443 > 192.168.50.101.56057: UDP, length 1250
12:16:58.262952 IP 172.217.19.97.443 > 192.168.50.101.56057: UDP, length 1250
12:16:58.262960 IP 172.217.19.97.443 > 192.168.50.101.56057: UDP, length 1250
12:16:58.262974 IP 172.217.19.97.443 > 192.168.50.101.56057: UDP, length 1250
12:16:58.262982 IP 172.217.19.97.443 > 192.168.50.101.56057: UDP, length 1250
12:16:58.262992 IP 172.217.19.97.443 > 192.168.50.101.56057: UDP, length 1250
12:16:58.264390 IP 172.217.19.97.443 > 192.168.50.101.56057: UDP, length 1250
12:16:58.264401 IP 172.217.19.97.443 > 192.168.50.101.56057: UDP, length 1250
12:16:58.264414 IP 172.217.19.97.443 > 192.168.50.101.56057: UDP, length 1250
12:16:58.264423 IP 172.217.19.97.443 > 192.168.50.101.56057: UDP, length 1250
12:16:58.264434 IP 172.217.19.97.443 > 192.168.50.101.56057: UDP, length 1250
12:16:58.264444 IP 172.217.19.97.443 > 192.168.50.101.56057: UDP, length 488
12:16:58.266054 IP 192.168.50.101.56057 > 172.217.19.97.443: UDP, length 33
12:16:58.266065 IP 192.168.50.101.56057 > 172.217.19.97.443: UDP, length 33
12:16:58.266076 IP 192.168.50.101.56057 > 172.217.19.97.443: UDP, length 33
12:16:58.266823 IP 192.168.50.101.56057 > 172.217.19.97.443: UDP, length 33
12:16:58.267064 IP 192.168.50.101.56057 > 172.217.19.97.443: UDP, length 33
12:16:58.267245 IP 192.168.50.101.56057 > 172.217.19.97.443: UDP, length 33
12:16:58.267362 IP 192.168.50.101.56057 > 172.217.19.97.443: UDP, length 33
12:16:58.267499 IP 172.217.19.97.443 > 192.168.50.101.56057: UDP, length 1243
12:16:58.267510 IP 172.217.19.97.443 > 192.168.50.101.56057: UDP, length 1250
12:16:58.267524 IP 172.217.19.97.443 > 192.168.50.101.56057: UDP, length 1250
12:16:58.267532 IP 172.217.19.97.443 > 192.168.50.101.56057: UDP, length 1250
12:16:58.267543 IP 172.217.19.97.443 > 192.168.50.101.56057: UDP, length 1250
12:16:58.267556 IP 172.217.19.97.443 > 192.168.50.101.56057: UDP, length 1250
12:16:58.267564 IP 172.217.19.97.443 > 192.168.50.101.56057: UDP, length 1250
12:16:58.267575 IP 172.217.19.97.443 > 192.168.50.101.56057: UDP, length 1250
12:16:58.269061 IP 172.217.19.97.443 > 192.168.50.101.56057: UDP, length 1250
12:16:58.269072 IP 172.217.19.97.443 > 192.168.50.101.56057: UDP, length 1250
12:16:58.269085 IP 172.217.19.97.443 > 192.168.50.101.56057: UDP, length 1250
12:16:58.269093 IP 172.217.19.97.443 > 192.168.50.101.56057: UDP, length 1250
12:16:58.269104 IP 172.217.19.97.443 > 192.168.50.101.56057: UDP, length 1250
12:16:58.269115 IP 172.217.19.97.443 > 192.168.50.101.56057: UDP, length 496
12:16:58.271164 IP 192.168.50.101.56057 > 172.217.19.97.443: UDP, length 33
12:16:58.272738 IP 192.168.50.101.56057 > 172.217.19.97.443: UDP, length 33
12:16:58.272898 IP 192.168.50.101.56057 > 172.217.19.97.443: UDP, length 33
12:16:58.273066 IP 192.168.50.101.56057 > 172.217.19.97.443: UDP, length 33
12:16:58.273285 IP 192.168.50.101.56057 > 172.217.19.97.443: UDP, length 33
12:16:58.273538 IP 192.168.50.101.56057 > 172.217.19.97.443: UDP, length 33
12:16:58.273727 IP 192.168.50.101.56057 > 172.217.19.97.443: UDP, length 33
12:16:58.286759 IP 172.217.19.97.443 > 192.168.50.101.56057: UDP, length 1243
12:16:58.286773 IP 172.217.19.97.443 > 192.168.50.101.56057: UDP, length 1250
12:16:58.286783 IP 172.217.19.97.443 > 192.168.50.101.56057: UDP, length 1250
12:16:58.286795 IP 172.217.19.97.443 > 192.168.50.101.56057: UDP, length 1250
12:16:58.286804 IP 172.217.19.97.443 > 192.168.50.101.56057: UDP, length 1250
12:16:58.286817 IP 172.217.19.97.443 > 192.168.50.101.56057: UDP, length 1250
12:16:58.286825 IP 172.217.19.97.443 > 192.168.50.101.56057: UDP, length 1250
12:16:58.286835 IP 172.217.19.97.443 > 192.168.50.101.56057: UDP, length 1250
12:16:58.288120 IP 172.217.19.97.443 > 192.168.50.101.56057: UDP, length 1250
12:16:58.288132 IP 172.217.19.97.443 > 192.168.50.101.56057: UDP, length 1250
12:16:58.288142 IP 172.217.19.97.443 > 192.168.50.101.56057: UDP, length 1250
12:16:58.288154 IP 172.217.19.97.443 > 192.168.50.101.56057: UDP, length 1250
12:16:58.288163 IP 172.217.19.97.443 > 192.168.50.101.56057: UDP, length 1250
