Errors:
Line Error (9): 20:06:58.087999 ARP, Request who-has 192.168.10.31 tell 192.168.10.173, length 46
Line Error (13): 20:06:58.528758 ARP, Request who-has 192.168.10.168 tell 192.168.10.91, length 46
Line Error (18): 20:06:58.888479 ARP, Request who-has 192.168.10.31 tell 192.168.10.173, length 46
Line Error (23): 20:06:59.356528 ARP, Request who-has 192.168.10.168 tell 192.168.10.91, length 46
Line Error (29): 20:06:59.888236 ARP, Request who-has 192.168.10.31 tell 192.168.10.173, length 46
Line Error (34): 20:07:00.211453 ARP, Request who-has 192.168.10.1 tell 192.168.10.18, length 46
Line Error (35): 20:07:00.211457 ARP, Reply 192.168.10.1 is-at 00:08:a2:0e:fd:02, length 28
Line Error (41): 20:07:00.303915 ARP, Request who-has 192.168.10.5 tell 192.168.10.206, length 46
Line Error (58): 20:07:00.356543 ARP, Request who-has 192.168.10.168 tell 192.168.10.91, length 46
Line Error (70): 20:07:00.854476 AT 65280.129.6 > 0.6:  at-#6 25
Line Error (77): 20:07:01.224194 ARP, Request who-has 192.168.10.5 tell 192.168.10.206, length 46
Line Error (79): 20:07:02.222597 ARP, Request who-has 192.168.10.5 tell 192.168.10.206, length 46
Line Error (83): 20:07:02.653047 AT 65280.128.6 > 0.6:  at-#6 25
Line Error (89): 20:07:03.134974 ARP, Request who-has 192.168.10.31 tell 192.168.10.173, length 46
Line Error (94): 20:07:03.824348 ARP, Request who-has 192.168.10.20 (ff:ff:ff:ff:ff:ff) tell 192.168.10.20, length 46
Line Error (95): 20:07:03.890196 ARP, Request who-has 192.168.10.31 tell 192.168.10.173, length 46
Line Error (99): 20:07:04.877086 ARP, Request who-has 192.168.10.31 tell 192.168.10.173, length 46
Line Error (100): 20:07:05.014820 ARP, Request who-has 192.168.10.1 tell 192.168.10.94, length 46
Line Error (101): 20:07:05.014824 ARP, Reply 192.168.10.1 is-at 00:08:a2:0e:fd:02, length 28
Line Error (119): 20:07:06.528868 ARP, Request who-has 192.168.10.168 tell 192.168.10.91, length 46
Line Error (151): 20:07:07.035035 ARP, Request who-has 192.168.10.1 tell 192.168.10.93, length 46
Line Error (152): 20:07:07.035044 ARP, Reply 192.168.10.1 is-at 00:08:a2:0e:fd:02, length 28
Line Error (162): 20:07:07.356947 ARP, Request who-has 192.168.10.168 tell 192.168.10.91, length 46
Line Error (166): 20:07:07.554510 ARP, Request who-has 192.168.10.31 tell 192.168.10.173, length 46
Line Error (177): 20:07:08.356914 ARP, Request who-has 192.168.10.168 tell 192.168.10.91, length 46
Line Error (180): 20:07:08.386057 ARP, Request who-has 192.168.10.31 tell 192.168.10.173, length 46
Line Error (187): 20:07:09.150802 ARP, Request who-has 192.168.10.5 tell 192.168.10.139, length 46
Line Error (188): 20:07:09.378046 ARP, Request who-has 192.168.10.31 tell 192.168.10.173, length 46
Line Error (189): 20:07:09.588184 ARP, Request who-has 192.168.10.1 tell 192.168.10.80, length 46
Line Error (190): 20:07:09.588188 ARP, Reply 192.168.10.1 is-at 00:08:a2:0e:fd:02, length 28
Line Error (193): 20:07:09.801620 ARP, Request who-has 192.168.10.5 tell 192.168.10.139, length 46
Line Error (201): 20:07:10.800298 ARP, Request who-has 192.168.10.5 tell 192.168.10.139, length 46
Line Error (202): 20:07:10.875559 AT 65280.129.6 > 0.6:  at-#6 25
Line Error (211): 20:07:12.459215 ARP, Request who-has 192.168.10.1 tell 192.168.10.246, length 46
Line Error (212): 20:07:12.459219 ARP, Reply 192.168.10.1 is-at 00:08:a2:0e:fd:02, length 28
Line Error (213): 20:07:12.476036 ARP, Request who-has 192.168.10.1 tell 192.168.10.16, length 46
Line Error (214): 20:07:12.476039 ARP, Reply 192.168.10.1 is-at 00:08:a2:0e:fd:02, length 28
Line Error (215): 20:07:12.674132 AT 65280.128.6 > 0.6:  at-#6 25
Line Error (217): 20:07:13.027740 ARP, Request who-has 192.168.10.31 tell 192.168.10.173, length 46
Line Error (222): 20:07:13.877130 ARP, Request who-has 192.168.10.31 tell 192.168.10.173, length 46
Line Error (239): 20:07:14.881487 ARP, Request who-has 192.168.10.31 tell 192.168.10.173, length 46
Line Error (244): 20:07:15.013349 ARP, Request who-has 192.168.10.1 tell 192.168.10.240, length 46
Line Error (245): 20:07:15.013352 ARP, Reply 192.168.10.1 is-at 00:08:a2:0e:fd:02, length 28
Line Error (311): 20:07:18.228905 ARP, Request who-has 192.168.10.31 tell 192.168.10.173, length 46
Line Error (315): 20:07:18.888123 ARP, Request who-has 192.168.10.31 tell 192.168.10.173, length 46
Line Error (318): 20:07:19.159023 ARP, Request who-has 192.168.10.5 tell 192.168.10.139, length 46
Line Error (326): 20:07:19.804488 ARP, Request who-has 192.168.10.5 tell 192.168.10.139, length 46
Line Error (327): 20:07:19.876816 ARP, Request who-has 192.168.10.31 tell 192.168.10.173, length 46
Line Error (333): 20:07:19.970064 ARP, Request who-has 192.168.10.157 tell 192.168.10.3, length 46
Line Error (346): 20:07:20.187128 ARP, Request who-has 192.168.10.1 (00:08:a2:0e:fd:02) tell 192.168.10.249, length 46
Line Error (347): 20:07:20.187132 ARP, Reply 192.168.10.1 is-at 00:08:a2:0e:fd:02, length 28
Line Error (350): 20:07:20.236883 ARP, Request who-has 192.168.10.6 tell 192.168.10.3, length 46
Line Error (361): 20:07:20.511623 ARP, Request who-has 192.168.10.1 tell 192.168.10.17, length 46
Line Error (362): 20:07:20.511627 ARP, Reply 192.168.10.1 is-at 00:08:a2:0e:fd:02, length 28
Line Error (376): 20:07:20.810093 ARP, Request who-has 192.168.10.5 tell 192.168.10.139, length 46
Line Error (378): 20:07:20.896609 AT 65280.129.6 > 0.6:  at-#6 25
Line Error (396): 20:07:22.695253 AT 65280.128.6 > 0.6:  at-#6 25
Line Error (399): 20:07:23.251520 ARP, Request who-has 192.168.10.31 tell 192.168.10.173, length 46
Line Error (403): 20:07:23.879504 ARP, Request who-has 192.168.10.31 tell 192.168.10.173, length 46
Line Error (405): 20:07:24.883848 ARP, Request who-has 192.168.10.31 tell 192.168.10.173, length 46
Line Error (480): 20:07:26.935662 ARP, Request who-has 192.168.10.173 (ff:ff:ff:ff:ff:ff) tell 192.168.10.37, length 46
Line Error (491): 20:07:27.600539 ARP, Request who-has 192.168.10.1 (00:08:a2:0e:fd:02) tell 192.168.10.70, length 46
Line Error (492): 20:07:27.600546 ARP, Reply 192.168.10.1 is-at 00:08:a2:0e:fd:02, length 28
Line Error (510): 20:07:28.277211 ARP, Request who-has 192.168.10.31 tell 192.168.10.173, length 46
Line Error (522): 20:07:28.889127 ARP, Request who-has 192.168.10.31 tell 192.168.10.173, length 46
Line Error (525): 20:07:29.087289 ARP, Request who-has 192.168.10.5 tell 192.168.10.70, length 46
Line Error (530): 20:07:29.228830 ARP, Request who-has 192.168.10.5 tell 192.168.10.139, length 46
Line Error (533): 20:07:29.600555 ARP, Request who-has 192.168.10.5 tell 192.168.10.70, length 46
Line Error (534): 20:07:29.812219 ARP, Request who-has 192.168.10.5 tell 192.168.10.139, length 46
Line Error (535): 20:07:29.878135 ARP, Request who-has 192.168.10.31 tell 192.168.10.173, length 46
Line Error (546): 20:07:30.600543 ARP, Request who-has 192.168.10.5 tell 192.168.10.70, length 46
Line Error (547): 20:07:30.802246 ARP, Request who-has 192.168.10.5 tell 192.168.10.139, length 46
Line Error (550): 20:07:30.917567 AT 65280.129.6 > 0.6:  at-#6 25
Line Error (588): 20:07:31.857952 ARP, Request who-has 192.168.10.162 tell 192.168.10.91, length 46
Line Error (594): 20:07:32.716406 AT 65280.128.6 > 0.6:  at-#6 25
Line Error (599): 20:07:33.304767 ARP, Request who-has 192.168.10.31 tell 192.168.10.173, length 46
Line Error (602): 20:07:33.891955 ARP, Request who-has 192.168.10.31 tell 192.168.10.173, length 46
Line Error (608): 20:07:34.748908 ARP, Request who-has 192.168.10.162 tell 192.168.10.91, length 46
Line Error (609): 20:07:34.880621 ARP, Request who-has 192.168.10.31 tell 192.168.10.173, length 46
Line Error (617): 20:07:35.358133 ARP, Request who-has 192.168.10.162 tell 192.168.10.91, length 46
Line Error (644): 20:07:36.358171 ARP, Request who-has 192.168.10.162 tell 192.168.10.91, length 46
Line Error (654): 20:07:37.047897 ARP, Request who-has 192.168.10.31 tell 192.168.10.173, length 46
Line Error (663): 20:07:37.882834 ARP, Request who-has 192.168.10.31 tell 192.168.10.173, length 46
Line Error (665): 20:07:38.749058 ARP, Request who-has 192.168.10.162 tell 192.168.10.91, length 46
Line Error (667): 20:07:38.887673 ARP, Request who-has 192.168.10.31 tell 192.168.10.173, length 46
Line Error (669): 20:07:39.288611 ARP, Request who-has 192.168.10.5 tell 192.168.10.70, length 46
Line Error (670): 20:07:39.358274 ARP, Request who-has 192.168.10.162 tell 192.168.10.91, length 46
Line Error (675): 20:07:40.100641 ARP, Request who-has 192.168.10.5 tell 192.168.10.70, length 46
Line Error (676): 20:07:40.177808 ARP, Request who-has 192.168.10.5 tell 192.168.10.206, length 46
Line Error (677): 20:07:40.212182 ARP, Request who-has 192.168.10.1 tell 192.168.10.18, length 46
Line Error (678): 20:07:40.212186 ARP, Reply 192.168.10.1 is-at 00:08:a2:0e:fd:02, length 28
Line Error (681): 20:07:40.358374 ARP, Request who-has 192.168.10.162 tell 192.168.10.91, length 46
Line Error (688): 20:07:40.723508 ARP, Request who-has 192.168.10.5 tell 192.168.10.206, length 46
Line Error (690): 20:07:40.938625 AT 65280.129.6 > 0.6:  at-#6 25
Line Error (695): 20:07:41.100609 ARP, Request who-has 192.168.10.5 tell 192.168.10.70, length 46
Line Error (723): 20:07:41.721914 ARP, Request who-has 192.168.10.5 tell 192.168.10.206, length 46
Line Error (733): 20:07:42.347607 ARP, Request who-has 192.168.10.31 tell 192.168.10.173, length 46
Line Error (735): 20:07:42.737563 AT 65280.128.6 > 0.6:  at-#6 25
Line Error (737): 20:07:42.883454 ARP, Request who-has 192.168.10.31 tell 192.168.10.173, length 46
Line Error (740): 20:07:43.358472 ARP, Request who-has 192.168.10.183 tell 192.168.10.91, length 46
Line Error (741): 20:07:43.888518 ARP, Request who-has 192.168.10.31 tell 192.168.10.173, length 46
Line Error (747): 20:07:45.130757 ARP, Reply 192.168.10.93 is-at 24:52:6a:9e:fa:67, length 46
Line Error (839): 20:07:45.915760 ARP, Request who-has 192.168.10.1 (ff:ff:ff:ff:ff:ff) tell 192.168.10.37, length 46
Line Error (840): 20:07:45.915764 ARP, Reply 192.168.10.1 is-at 00:08:a2:0e:fd:02, length 28
Line Error (842): 20:07:45.999411 ARP, Request who-has 192.168.10.183 tell 192.168.10.91, length 46
Line Error (874): 20:07:46.765034 ARP, Request who-has 192.168.10.162 tell 192.168.10.91, length 46
Line Error (878): 20:07:46.858640 ARP, Request who-has 192.168.10.183 tell 192.168.10.91, length 46
Line Error (883): 20:07:47.358695 ARP, Request who-has 192.168.10.162 tell 192.168.10.91, length 46
Line Error (884): 20:07:47.391855 ARP, Request who-has 192.168.10.31 tell 192.168.10.173, length 46
Line Error (898): 20:07:47.858699 ARP, Request who-has 192.168.10.183 tell 192.168.10.91, length 46
Line Error (954): 20:07:48.358732 ARP, Request who-has 192.168.10.162 tell 192.168.10.91, length 46
Line Error (955): 20:07:48.391082 ARP, Request who-has 192.168.10.31 tell 192.168.10.173, length 46
Line Error (986): 20:07:49.288448 ARP, Request who-has 192.168.10.5 tell 192.168.10.70, length 46
Line Error (991): 20:07:49.385165 ARP, Request who-has 192.168.10.31 tell 192.168.10.173, length 46
Line Error (1031): 20:07:49.999657 ARP, Request who-has 192.168.10.183 tell 192.168.10.91, length 46
Line Error (1047): 20:07:50.100693 ARP, Request who-has 192.168.10.5 tell 192.168.10.70, length 46
Line Error (1083): 20:07:50.858834 ARP, Request who-has 192.168.10.183 tell 192.168.10.91, length 46
Line Error (1087): 20:07:50.959664 AT 65280.129.6 > 0.6:  at-#6 25
Line Error (1088): 20:07:51.004093 ARP, Request who-has 192.168.10.5 tell 192.168.10.206, length 46
Line Error (1094): 20:07:51.100643 ARP, Request who-has 192.168.10.5 tell 192.168.10.70, length 46
Line Error (1095): 20:07:51.155744 ARP, Request who-has 192.168.10.139 tell 192.168.10.3, length 46
Line Error (1105): 20:07:51.721531 ARP, Request who-has 192.168.10.5 tell 192.168.10.206, length 46
Line Error (1107): 20:07:51.858862 ARP, Request who-has 192.168.10.183 tell 192.168.10.91, length 46
Line Error (1132): 20:07:52.429361 ARP, Request who-has 192.168.10.31 tell 192.168.10.173, length 46
Line Error (1133): 20:07:52.719944 ARP, Request who-has 192.168.10.5 tell 192.168.10.206, length 46
Line Error (1134): 20:07:52.758646 AT 65280.128.6 > 0.6:  at-#6 25
Line Error (1136): 20:07:53.389707 ARP, Request who-has 192.168.10.31 tell 192.168.10.173, length 46
Line Error (1137): 20:07:53.466353 ARP, Reply 192.168.10.94 is-at 24:52:6a:9e:fc:64, length 46
Line Error (1138): 20:07:53.891485 ARP, Request who-has 192.168.10.1 (00:08:a2:0e:fd:02) tell 192.168.10.3, length 46
Line Error (1139): 20:07:53.891489 ARP, Reply 192.168.10.1 is-at 00:08:a2:0e:fd:02, length 28
Line Error (1145): 20:07:54.379978 ARP, Request who-has 192.168.10.31 tell 192.168.10.173, length 46
Line Error (1211): 20:07:56.887761 ARP, Request who-has 192.168.10.182 tell 192.168.10.173, length 46
Line Error (1213): 20:07:56.975812 ARP, Request who-has 192.168.10.91 (ff:ff:ff:ff:ff:ff) tell 192.168.10.37, length 46
Line Error (1215): 20:07:57.468910 ARP, Request who-has 192.168.10.31 tell 192.168.10.173, length 46
Line Error (1219): 20:07:57.991363 ARP, Request who-has 192.168.10.1 tell 192.168.10.24, length 46
Line Error (1220): 20:07:57.991367 ARP, Reply 192.168.10.1 is-at 00:08:a2:0e:fd:02, length 28
Line Error (1221): 20:07:57.999980 ARP, Request who-has 192.168.10.183 tell 192.168.10.91, length 46
Line Error (1222): 20:07:58.019207 ARP, Request who-has 192.168.10.182 tell 192.168.10.173, length 46
Line Error (1225): 20:07:58.380438 ARP, Request who-has 192.168.10.31 tell 192.168.10.173, length 46
Line Error (1227): 20:07:58.859187 ARP, Request who-has 192.168.10.183 tell 192.168.10.91, length 46
Line Error (1229): 20:07:58.882299 ARP, Request who-has 192.168.10.182 tell 192.168.10.173, length 46
Line Error (1238): 20:07:59.384765 ARP, Request who-has 192.168.10.31 tell 192.168.10.173, length 46
Line Error (1244): 20:07:59.859227 ARP, Request who-has 192.168.10.183 tell 192.168.10.91, length 46
Line Error (1245): 20:07:59.891172 ARP, Request who-has 192.168.10.182 tell 192.168.10.173, length 46
Line Error (1248): 20:08:00.175801 ARP, Request who-has 192.168.10.139 (ff:ff:ff:ff:ff:ff) tell 192.168.10.37, length 46
Line Error (1255): 20:08:00.980707 AT 65280.129.6 > 0.6:  at-#6 25
Line Error (1261): 20:08:01.144108 ARP, Request who-has 192.168.10.5 tell 192.168.10.206, length 46
Line Error (1269): 20:08:01.721159 ARP, Request who-has 192.168.10.5 tell 192.168.10.206, length 46
Line Error (1304): 20:08:02.497930 ARP, Request who-has 192.168.10.31 tell 192.168.10.173, length 46
Line Error (1305): 20:08:02.719565 ARP, Request who-has 192.168.10.5 tell 192.168.10.206, length 46
Line Error (1306): 20:08:02.779753 AT 65280.128.6 > 0.6:  at-#6 25
Line Error (1307): 20:08:02.952936 ARP, Request who-has 192.168.10.182 tell 192.168.10.173, length 46
Line Error (1310): 20:08:03.007833 ARP, Request who-has 192.168.10.1 tell 192.168.10.17, length 46
Line Error (1311): 20:08:03.007836 ARP, Reply 192.168.10.1 is-at 00:08:a2:0e:fd:02, length 28
Line Error (1313): 20:08:03.392553 ARP, Request who-has 192.168.10.31 tell 192.168.10.173, length 46
Line Error (1321): 20:08:03.879328 ARP, Request who-has 192.168.10.182 tell 192.168.10.173, length 46
Line Error (1322): 20:08:04.042504 ARP, Request who-has 192.168.10.1 tell 192.168.10.231, length 46
Line Error (1323): 20:08:04.042507 ARP, Reply 192.168.10.1 is-at 00:08:a2:0e:fd:02, length 28
Line Error (1324): 20:08:04.383247 ARP, Request who-has 192.168.10.31 tell 192.168.10.173, length 46
Line Error (1325): 20:08:04.888625 ARP, Request who-has 192.168.10.182 tell 192.168.10.173, length 46
Line Error (1326): 20:08:04.942825 ARP, Request who-has 192.168.10.1 tell 192.168.10.94, length 46
Line Error (1327): 20:08:04.942828 ARP, Reply 192.168.10.1 is-at 00:08:a2:0e:fd:02, length 28
Line Error (1384): 20:08:06.169281 ARP, Request who-has 192.168.10.20 (ff:ff:ff:ff:ff:ff) tell 192.168.10.20, length 46
Line Error (1392): 20:08:07.037266 ARP, Request who-has 192.168.10.1 tell 192.168.10.93, length 46
Line Error (1393): 20:08:07.037271 ARP, Reply 192.168.10.1 is-at 00:08:a2:0e:fd:02, length 28
Line Error (1395): 20:08:07.368067 ARP, Request who-has 192.168.10.31 tell 192.168.10.173, length 46
Line Error (1398): 20:08:07.884799 ARP, Request who-has 192.168.10.31 tell 192.168.10.173, length 46
Line Error (1459): 20:08:08.888275 ARP, Request who-has 192.168.10.31 tell 192.168.10.173, length 46
Line Error (1465): 20:08:09.160378 ARP, Request who-has 192.168.10.5 tell 192.168.10.139, length 46
Line Error (1476): 20:08:09.801397 ARP, Request who-has 192.168.10.5 tell 192.168.10.139, length 46
Line Error (1477): 20:08:09.876836 ARP, Request who-has 192.168.10.91 (ff:ff:ff:ff:ff:ff) tell 192.168.10.79, length 46
Line Error (1482): 20:08:10.435735 ARP, Request who-has 192.168.10.1 (ff:ff:ff:ff:ff:ff) tell 192.168.10.81, length 46
Line Error (1483): 20:08:10.435740 ARP, Reply 192.168.10.1 is-at 00:08:a2:0e:fd:02, length 28
Line Error (1487): 20:08:10.810968 ARP, Request who-has 192.168.10.5 tell 192.168.10.139, length 46
Line Error (1490): 20:08:10.965384 ARP, Request who-has 192.168.10.182 tell 192.168.10.173, length 46
Line Error (1491): 20:08:11.001704 AT 65280.129.6 > 0.6:  at-#6 25
Line Error (1497): 20:08:11.578509 ARP, Request who-has 192.168.10.180 tell 192.168.10.3, length 46
Line Error (1511): 20:08:11.891866 ARP, Request who-has 192.168.10.182 tell 192.168.10.173, length 46
Line Error (1514): 20:08:12.359850 ARP, Request who-has 192.168.10.148 tell 192.168.10.91, length 46
Line Error (1517): 20:08:12.554739 ARP, Request who-has 192.168.10.31 tell 192.168.10.173, length 46
Line Error (1518): 20:08:12.800882 AT 65280.128.6 > 0.6:  at-#6 25
Line Error (1520): 20:08:12.883759 ARP, Request who-has 192.168.10.182 tell 192.168.10.173, length 46
Line Error (1523): 20:08:13.388518 ARP, Request who-has 192.168.10.31 tell 192.168.10.173, length 46
Line Error (1525): 20:08:14.377294 ARP, Request who-has 192.168.10.31 tell 192.168.10.173, length 46
Line Error (1531): 20:08:14.953819 ARP, Request who-has 192.168.10.148 tell 192.168.10.91, length 46
Line Error (1540): 20:08:15.708380 ARP, Request who-has 192.168.10.1 tell 192.168.10.16, length 46
Line Error (1541): 20:08:15.708385 ARP, Reply 192.168.10.1 is-at 00:08:a2:0e:fd:02, length 28
Line Error (1542): 20:08:15.860006 ARP, Request who-has 192.168.10.148 tell 192.168.10.91, length 46
Line Error (1571): 20:08:16.860035 ARP, Request who-has 192.168.10.148 tell 192.168.10.91, length 46
Line Error (1604): 20:08:17.596187 ARP, Request who-has 192.168.10.31 tell 192.168.10.173, length 46
Line Error (1605): 20:08:18.055611 ARP, Request who-has 192.168.10.182 tell 192.168.10.173, length 46
Line Error (1610): 20:08:18.383082 ARP, Request who-has 192.168.10.31 tell 192.168.10.173, length 46
Line Error (1629): 20:08:18.885497 ARP, Request who-has 192.168.10.182 tell 192.168.10.173, length 46
Line Error (1630): 20:08:18.953978 ARP, Request who-has 192.168.10.148 tell 192.168.10.91, length 46
Line Error (1633): 20:08:19.387801 ARP, Request who-has 192.168.10.31 tell 192.168.10.173, length 46
Line Error (1640): 20:08:19.617013 ARP, Request who-has 192.168.10.5 tell 192.168.10.139, length 46
Line Error (1641): 20:08:19.860139 ARP, Request who-has 192.168.10.148 tell 192.168.10.91, length 46
Line Error (1642): 20:08:19.890101 ARP, Request who-has 192.168.10.182 tell 192.168.10.173, length 46
Line Error (1643): 20:08:20.212911 ARP, Request who-has 192.168.10.1 tell 192.168.10.18, length 46
Line Error (1644): 20:08:20.212915 ARP, Reply 192.168.10.1 is-at 00:08:a2:0e:fd:02, length 28
Line Error (1645): 20:08:20.311792 ARP, Request who-has 192.168.10.5 tell 192.168.10.139, length 46
Line Error (1646): 20:08:20.507047 ARP, Request who-has 192.168.10.1 (00:08:a2:0e:fd:02) tell 192.168.10.141, length 46
Line Error (1647): 20:08:20.507049 ARP, Reply 192.168.10.1 is-at 00:08:a2:0e:fd:02, length 28
Line Error (1648): 20:08:20.860228 ARP, Request who-has 192.168.10.148 tell 192.168.10.91, length 46
Line Error (1651): 20:08:21.022756 AT 65280.129.6 > 0.6:  at-#6 25
Line Error (1652): 20:08:21.067622 ARP, Request who-has 192.168.10.182 tell 192.168.10.173, length 46
Line Error (1657): 20:08:21.256836 ARP, Request who-has 192.168.10.173 (ff:ff:ff:ff:ff:ff) tell 192.168.10.79, length 46
Line Error (1658): 20:08:21.301075 ARP, Request who-has 192.168.10.5 tell 192.168.10.139, length 46
Line Error (1660): 20:08:21.475462 ARP, Request who-has 192.168.10.3 tell 192.168.10.249, length 46
Line Error (1661): 20:08:21.476496 ARP, Request who-has 192.168.10.249 tell 192.168.10.3, length 46
Line Error (1667): 20:08:21.883751 ARP, Request who-has 192.168.10.182 tell 192.168.10.173, length 46
Line Error (1673): 20:08:22.622687 ARP, Request who-has 192.168.10.31 tell 192.168.10.173, length 46
Line Error (1674): 20:08:22.821998 AT 65280.128.6 > 0.6:  at-#6 25
Line Error (1675): 20:08:22.888922 ARP, Request who-has 192.168.10.182 tell 192.168.10.173, length 46
Line Error (1677): 20:08:23.100808 ARP, Request who-has 192.168.10.1 (00:08:a2:0e:fd:02) tell 192.168.10.70, length 46
Line Error (1678): 20:08:23.100812 ARP, Reply 192.168.10.1 is-at 00:08:a2:0e:fd:02, length 28
Line Error (1680): 20:08:23.174650 ARP, Request who-has 192.168.10.162 tell 192.168.10.91, length 46
Line Error (1682): 20:08:23.187583 ARP, Request who-has 192.168.10.1 (00:08:a2:0e:fd:02) tell 192.168.10.249, length 46
Line Error (1683): 20:08:23.187590 ARP, Reply 192.168.10.1 is-at 00:08:a2:0e:fd:02, length 28
Line Error (1685): 20:08:23.391269 ARP, Request who-has 192.168.10.31 tell 192.168.10.173, length 46
Line Error (1710): 20:08:23.860388 ARP, Request who-has 192.168.10.162 tell 192.168.10.91, length 46
Line Error (1736): 20:08:24.082375 ARP, Request who-has 192.168.10.182 tell 192.168.10.173, length 46
Line Error (1738): 20:08:24.379947 ARP, Request who-has 192.168.10.31 tell 192.168.10.173, length 46
Line Error (1740): 20:08:24.597790 ARP, Request who-has 192.168.10.1 tell 192.168.10.157, length 46
Line Error (1741): 20:08:24.597795 ARP, Reply 192.168.10.1 is-at 00:08:a2:0e:fd:02, length 28
Line Error (1742): 20:08:24.860384 ARP, Request who-has 192.168.10.162 tell 192.168.10.91, length 46
Line Error (1743): 20:08:24.882357 ARP, Request who-has 192.168.10.182 tell 192.168.10.173, length 46
Line Error (1746): 20:08:25.890733 ARP, Request who-has 192.168.10.182 tell 192.168.10.173, length 46
Line Error (1748): 20:08:26.188667 ARP, Request who-has 192.168.10.162 tell 192.168.10.91, length 46
Line Error (1791): 20:08:26.860510 ARP, Request who-has 192.168.10.162 tell 192.168.10.91, length 46
Line Error (1792): 20:08:26.954391 ARP, Request who-has 192.168.10.148 tell 192.168.10.91, length 46
Line Error (1794): 20:08:27.042440 IP 192.168.10.139 > 224.0.0.22: igmp
Line Error (1796): 20:08:27.052823 IP 192.168.10.139 > 224.0.0.22: igmp
Line Error (1798): 20:08:27.052912 IP 192.168.10.139 > 224.0.0.22: igmp
Line Error (1800): 20:08:27.052954 IP 192.168.10.139 > 224.0.0.22: igmp
Line Error (1809): 20:08:27.315849 IP 192.168.10.139 > 224.0.0.22: igmp
Line Error (1816): 20:08:27.645728 ARP, Request who-has 192.168.10.31 tell 192.168.10.173, length 46
Line Error (1817): 20:08:27.860579 ARP, Request who-has 192.168.10.162 tell 192.168.10.91, length 46
Line Error (1818): 20:08:27.860642 ARP, Request who-has 192.168.10.148 tell 192.168.10.91, length 46
Line Error (1838): 20:08:28.219702 ARP, Request who-has 192.168.10.1 tell 192.168.10.246, length 46
Line Error (1839): 20:08:28.219706 ARP, Reply 192.168.10.1 is-at 00:08:a2:0e:fd:02, length 28
Line Error (1855): 20:08:28.381540 ARP, Request who-has 192.168.10.31 tell 192.168.10.173, length 46
Line Error (1865): 20:08:28.860606 ARP, Request who-has 192.168.10.148 tell 192.168.10.91, length 46
Line Error (1872): 20:08:29.085777 ARP, Request who-has 192.168.10.5 tell 192.168.10.70, length 46
Line Error (1878): 20:08:29.378509 ARP, Request who-has 192.168.10.31 tell 192.168.10.173, length 46
Line Error (1886): 20:08:29.600878 ARP, Request who-has 192.168.10.5 tell 192.168.10.70, length 46
Line Error (1889): 20:08:29.707439 ARP, Request who-has 192.168.10.5 tell 192.168.10.139, length 46
Line Error (1895): 20:08:30.204659 ARP, Request who-has 192.168.10.162 tell 192.168.10.91, length 46
Line Error (1897): 20:08:30.310640 ARP, Request who-has 192.168.10.5 tell 192.168.10.139, length 46
Line Error (1902): 20:08:30.601016 ARP, Request who-has 192.168.10.5 tell 192.168.10.70, length 46
Line Error (1905): 20:08:30.860652 ARP, Request who-has 192.168.10.162 tell 192.168.10.91, length 46
Line Error (1910): 20:08:31.043769 AT 65280.129.6 > 0.6:  at-#6 25
Line Error (1920): 20:08:31.304308 ARP, Request who-has 192.168.10.5 tell 192.168.10.139, length 46
Line Error (1922): 20:08:31.436759 ARP, Request who-has 192.168.10.19 (ff:ff:ff:ff:ff:ff) tell 192.168.10.79, length 46
Line Error (1925): 20:08:31.860672 ARP, Request who-has 192.168.10.162 tell 192.168.10.91, length 46
Line Error (1930): 20:08:32.276763 ARP, Request who-has 192.168.10.3 (ff:ff:ff:ff:ff:ff) tell 192.168.10.79, length 46
Line Error (1966): 20:08:32.693926 ARP, Request who-has 192.168.10.31 tell 192.168.10.173, length 46
Line Error (1969): 20:08:32.843186 AT 65280.128.6 > 0.6:  at-#6 25
Line Error (1971): 20:08:33.387275 ARP, Request who-has 192.168.10.31 tell 192.168.10.173, length 46
Line Error (1975): 20:08:34.379205 ARP, Request who-has 192.168.10.31 tell 192.168.10.173, length 46
Line Error (2006): 20:08:36.881332 ARP, Request who-has 192.168.10.1 (00:08:a2:0e:fd:02) tell 192.168.10.173, length 46
Line Error (2007): 20:08:36.881339 ARP, Reply 192.168.10.1 is-at 00:08:a2:0e:fd:02, length 28
Line Error (2011): 20:08:37.573184 ARP, Request who-has 192.168.10.31 tell 192.168.10.173, length 46
Line Error (2013): 20:08:38.204954 ARP, Request who-has 192.168.10.162 tell 192.168.10.91, length 46
Line Error (2014): 20:08:38.378465 ARP, Request who-has 192.168.10.31 tell 192.168.10.173, length 46
Line Error (2015): 20:08:38.860992 ARP, Request who-has 192.168.10.162 tell 192.168.10.91, length 46
Line Error (2018): 20:08:39.288824 ARP, Request who-has 192.168.10.5 tell 192.168.10.70, length 46
Line Error (2020): 20:08:39.382769 ARP, Request who-has 192.168.10.31 tell 192.168.10.173, length 46
Line Error (2023): 20:08:39.861022 ARP, Request who-has 192.168.10.1 (00:08:a2:0e:fd:02) tell 192.168.10.91, length 46
Line Error (2024): 20:08:39.861026 ARP, Reply 192.168.10.1 is-at 00:08:a2:0e:fd:02, length 28
Line Error (2025): 20:08:39.861079 ARP, Request who-has 192.168.10.162 tell 192.168.10.91, length 46
Line Error (2026): 20:08:40.100947 ARP, Request who-has 192.168.10.5 tell 192.168.10.70, length 46
Line Error (2027): 20:08:40.206723 ARP, Request who-has 192.168.10.5 tell 192.168.10.206, length 46
Line Error (2028): 20:08:40.721298 ARP, Request who-has 192.168.10.5 tell 192.168.10.206, length 46
Line Error (2029): 20:08:41.064796 AT 65280.129.6 > 0.6:  at-#6 25
Line Error (2030): 20:08:41.100907 ARP, Request who-has 192.168.10.5 tell 192.168.10.70, length 46
Line Error (2035): 20:08:41.316727 ARP, Request who-has 192.168.10.139 (ff:ff:ff:ff:ff:ff) tell 192.168.10.79, length 46
Line Error (2036): 20:08:41.719683 ARP, Request who-has 192.168.10.5 tell 192.168.10.206, length 46
Line Error (2042): 20:08:42.753347 ARP, Request who-has 192.168.10.31 tell 192.168.10.173, length 46
Line Error (2044): 20:08:42.864276 AT 65280.128.6 > 0.6:  at-#6 25
Line Error (2045): 20:08:43.388329 ARP, Request who-has 192.168.10.31 tell 192.168.10.173, length 46
Line Error (2049): 20:08:44.393127 ARP, Request who-has 192.168.10.31 tell 192.168.10.173, length 46
Line Error (2054): 20:08:44.695142 ARP, Request who-has 192.168.10.157 tell 192.168.10.3, length 46
Line Error (2095): 20:08:47.442500 ARP, Request who-has 192.168.10.1 tell 192.168.10.253, length 46
Line Error (2096): 20:08:47.442507 ARP, Reply 192.168.10.1 is-at 00:08:a2:0e:fd:02, length 28
Line Error (2099): 20:08:47.802259 ARP, Request who-has 192.168.10.31 tell 192.168.10.173, length 46
Line Error (2138): 20:08:48.248901 ARP, Reply 192.168.10.93 is-at 24:52:6a:9e:fa:67, length 46
Line Error (2163): 20:08:48.382922 ARP, Request who-has 192.168.10.31 tell 192.168.10.173, length 46
Line Error (2218): 20:08:49.288667 ARP, Request who-has 192.168.10.5 tell 192.168.10.70, length 46
Line Error (2243): 20:08:49.392011 ARP, Request who-has 192.168.10.1 (00:08:a2:0e:fd:02) tell 192.168.10.3, length 46
Line Error (2244): 20:08:49.392015 ARP, Reply 192.168.10.1 is-at 00:08:a2:0e:fd:02, length 28
Line Error (2245): 20:08:49.392021 ARP, Request who-has 192.168.10.31 tell 192.168.10.173, length 46
Line Error (2378): 20:08:50.100995 ARP, Request who-has 192.168.10.5 tell 192.168.10.70, length 46
Line Error (2423): 20:08:50.830231 ARP, Request who-has 192.168.10.5 tell 192.168.10.206, length 46
Line Error (2440): 20:08:51.085925 AT 65280.129.6 > 0.6:  at-#6 25
Line Error (2441): 20:08:51.100900 ARP, Request who-has 192.168.10.5 tell 192.168.10.70, length 46
Line Error (2448): 20:08:51.493537 ARP, Request who-has 192.168.10.1 (ff:ff:ff:ff:ff:ff) tell 192.168.10.83, length 46
Line Error (2449): 20:08:51.493542 ARP, Reply 192.168.10.1 is-at 00:08:a2:0e:fd:02, length 28
Line Error (2450): 20:08:51.719312 ARP, Request who-has 192.168.10.5 tell 192.168.10.206, length 46
Line Error (2475): 20:08:52.153797 ARP, Request who-has 192.168.10.1 (ff:ff:ff:ff:ff:ff) tell 192.168.10.82, length 46
Line Error (2476): 20:08:52.153802 ARP, Reply 192.168.10.1 is-at 00:08:a2:0e:fd:02, length 28
Line Error (2493): 20:08:52.717719 ARP, Request who-has 192.168.10.5 tell 192.168.10.206, length 46
Line Error (2498): 20:08:52.838142 ARP, Request who-has 192.168.10.31 tell 192.168.10.173, length 46
Line Error (2499): 20:08:52.885404 AT 65280.128.6 > 0.6:  at-#6 25
Line Error (2502): 20:08:53.018204 ARP, Request who-has 192.168.10.1 tell 192.168.10.206, length 46
Line Error (2503): 20:08:53.018208 ARP, Reply 192.168.10.1 is-at 00:08:a2:0e:fd:02, length 28
Line Error (2507): 20:08:53.027869 ARP, Request who-has 192.168.10.3 tell 192.168.10.206, length 46
Line Error (2508): 20:08:53.028712 ARP, Request who-has 192.168.10.206 tell 192.168.10.3, length 46
Line Error (2533): 20:08:53.387383 ARP, Request who-has 192.168.10.31 tell 192.168.10.173, length 46
Line Error (2550): 20:08:54.391642 ARP, Request who-has 192.168.10.31 tell 192.168.10.173, length 46
Line Error (2659): 20:08:57.867472 ARP, Request who-has 192.168.10.31 tell 192.168.10.173, length 46
Line Error (2666): 20:08:58.384965 ARP, Request who-has 192.168.10.31 tell 192.168.10.173, length 46
Line Error (2668): 20:08:59.254864 ARP, Request who-has 192.168.10.33 tell 192.168.10.180, length 46
Line Error (2670): 20:08:59.389811 ARP, Request who-has 192.168.10.31 tell 192.168.10.173, length 46
Line Error (2694): 20:09:00.213643 ARP, Request who-has 192.168.10.1 tell 192.168.10.18, length 46
Line Error (2695): 20:09:00.213649 ARP, Reply 192.168.10.1 is-at 00:08:a2:0e:fd:02, length 28
Line Error (2703): 20:09:00.970251 ARP, Request who-has 192.168.10.5 tell 192.168.10.206, length 46
Line Error (2704): 20:09:01.096097 ARP, Request who-has 192.168.10.180 (ff:ff:ff:ff:ff:ff) tell 192.168.10.37, length 46
Line Error (2705): 20:09:01.106878 AT 65280.129.6 > 0.6:  at-#6 25
Line Error (2727): 20:09:01.718936 ARP, Request who-has 192.168.10.5 tell 192.168.10.206, length 46
Line Error (2747): 20:09:02.717346 ARP, Request who-has 192.168.10.5 tell 192.168.10.206, length 46
Line Error (2753): 20:09:02.896989 ARP, Request who-has 192.168.10.31 tell 192.168.10.173, length 46
Line Error (2754): 20:09:02.906517 AT 65280.128.6 > 0.6:  at-#6 25
Line Error (2764): 20:09:03.362045 ARP, Request who-has 192.168.10.182 tell 192.168.10.91, length 46
Line Error (2798): 20:09:03.887593 ARP, Request who-has 192.168.10.31 tell 192.168.10.173, length 46
Line Error (2803): 20:09:04.888440 ARP, Request who-has 192.168.10.31 tell 192.168.10.173, length 46
Line Error (2804): 20:09:05.026188 ARP, Request who-has 192.168.10.1 tell 192.168.10.94, length 46
Line Error (2805): 20:09:05.026192 ARP, Reply 192.168.10.1 is-at 00:08:a2:0e:fd:02, length 28
Line Error (2813): 20:09:05.984146 ARP, Request who-has 192.168.10.1 tell 192.168.10.17, length 46
Line Error (2814): 20:09:05.984150 ARP, Reply 192.168.10.1 is-at 00:08:a2:0e:fd:02, length 28
Line Error (2816): 20:09:06.331044 ARP, Request who-has 192.168.10.182 tell 192.168.10.91, length 46
Line Error (2821): 20:09:06.862277 ARP, Request who-has 192.168.10.182 tell 192.168.10.91, length 46
Line Error (2822): 20:09:07.025406 ARP, Request who-has 192.168.10.1 tell 192.168.10.93, length 46
Line Error (2823): 20:09:07.025410 ARP, Reply 192.168.10.1 is-at 00:08:a2:0e:fd:02, length 28
Line Error (2826): 20:09:07.581304 ARP, Request who-has 192.168.10.31 tell 192.168.10.173, length 46
Line Error (2827): 20:09:07.815570 ARP, Request who-has 192.168.10.20 (ff:ff:ff:ff:ff:ff) tell 192.168.10.20, length 46
Line Error (2828): 20:09:07.862291 ARP, Request who-has 192.168.10.182 tell 192.168.10.91, length 46
Line Error (2859): 20:09:08.389820 ARP, Request who-has 192.168.10.31 tell 192.168.10.173, length 46
Line Error (2864): 20:09:08.576620 ARP, Request who-has 192.168.10.180 (ff:ff:ff:ff:ff:ff) tell 192.168.10.79, length 46
Line Error (2905): 20:09:09.175369 ARP, Request who-has 192.168.10.5 tell 192.168.10.139, length 46
Line Error (2919): 20:09:09.391779 ARP, Request who-has 192.168.10.31 tell 192.168.10.173, length 46
Line Error (2928): 20:09:09.805746 ARP, Request who-has 192.168.10.5 tell 192.168.10.139, length 46
Line Error (2935): 20:09:10.331266 ARP, Request who-has 192.168.10.182 tell 192.168.10.91, length 46
Line Error (2942): 20:09:10.813110 ARP, Request who-has 192.168.10.5 tell 192.168.10.139, length 46
Line Error (2943): 20:09:10.862434 ARP, Request who-has 192.168.10.182 tell 192.168.10.91, length 46
Line Error (2946): 20:09:11.127870 AT 65280.129.6 > 0.6:  at-#6 25
Line Error (2954): 20:09:11.862514 ARP, Request who-has 192.168.10.182 tell 192.168.10.91, length 46
Line Error (2963): 20:09:12.927621 AT 65280.128.6 > 0.6:  at-#6 25
Line Error (2971): 20:09:13.972935 ARP, Request who-has 192.168.10.31 tell 192.168.10.173, length 46
Line Error (2979): 20:09:14.882450 ARP, Request who-has 192.168.10.31 tell 192.168.10.173, length 46
Line Error (2991): 20:09:15.297474 ARP, Request who-has 192.168.10.3 (ff:ff:ff:ff:ff:ff) tell 192.168.10.101, length 46
Line Error (2992): 20:09:15.317974 ARP, Request who-has 192.168.10.3 (ff:ff:ff:ff:ff:ff) tell 192.168.10.101, length 46
Line Error (2995): 20:09:15.338976 ARP, Request who-has 192.168.10.3 (ff:ff:ff:ff:ff:ff) tell 192.168.10.101, length 46
Line Error (3000): 20:09:15.880389 ARP, Request who-has 192.168.10.31 tell 192.168.10.173, length 46
Line Error (3010): 20:09:17.314594 ARP, Request who-has 192.168.10.101 tell 192.168.10.3, length 46
Line Error (3014): 20:09:18.010831 ARP, Request who-has 192.168.10.31 tell 192.168.10.173, length 46
Line Error (3019): 20:09:18.101053 ARP, Request who-has 192.168.10.1 (00:08:a2:0e:fd:02) tell 192.168.10.70, length 46
Line Error (3020): 20:09:18.101057 ARP, Reply 192.168.10.1 is-at 00:08:a2:0e:fd:02, length 28
Line Error (3023): 20:09:18.331648 ARP, Request who-has 192.168.10.182 tell 192.168.10.91, length 46
Line Error (3025): 20:09:18.684743 ARP, Request who-has 192.168.10.1 tell 192.168.10.16, length 46
Line Error (3026): 20:09:18.684747 ARP, Reply 192.168.10.1 is-at 00:08:a2:0e:fd:02, length 28
Line Error (3055): 20:09:18.862838 ARP, Request who-has 192.168.10.182 tell 192.168.10.91, length 46
Line Error (3056): 20:09:18.893271 ARP, Request who-has 192.168.10.31 tell 192.168.10.173, length 46
Line Error (3067): 20:09:19.862852 ARP, Request who-has 192.168.10.182 tell 192.168.10.91, length 46
Line Error (3068): 20:09:19.886848 ARP, Request who-has 192.168.10.31 tell 192.168.10.173, length 46
Line Error (3079): 20:09:20.140087 ARP, Request who-has 192.168.10.5 tell 192.168.10.139, length 46
Line Error (3099): 20:09:20.806409 ARP, Request who-has 192.168.10.5 tell 192.168.10.139, length 46
Line Error (3102): 20:09:21.148913 AT 65280.129.6 > 0.6:  at-#6 25
Line Error (3174): 20:09:21.808110 ARP, Request who-has 192.168.10.5 tell 192.168.10.139, length 46
Line Error (3205): 20:09:22.948819 AT 65280.128.6 > 0.6:  at-#6 25
Line Error (3227): 20:09:24.064362 ARP, Request who-has 192.168.10.31 tell 192.168.10.173, length 46
Line Error (3239): 20:09:24.893550 ARP, Request who-has 192.168.10.31 tell 192.168.10.173, length 46
Line Error (3246): 20:09:25.555097 ARP, Request who-has 192.168.10.180 tell 192.168.10.3, length 46
Line Error (3252): 20:09:25.882673 ARP, Request who-has 192.168.10.31 tell 192.168.10.173, length 46
Line Error (3255): 20:09:26.187813 ARP, Request who-has 192.168.10.1 (00:08:a2:0e:fd:02) tell 192.168.10.249, length 46
Line Error (3256): 20:09:26.187817 ARP, Reply 192.168.10.1 is-at 00:08:a2:0e:fd:02, length 28
Line Error (3285): 20:09:26.891466 ARP, Request who-has 192.168.10.182 tell 192.168.10.173, length 46
Line Error (3387): 20:09:27.881753 ARP, Request who-has 192.168.10.182 tell 192.168.10.173, length 46
Line Error (3412): 20:09:28.086605 ARP, Request who-has 192.168.10.31 tell 192.168.10.173, length 46
Line Error (3416): 20:09:28.889329 ARP, Request who-has 192.168.10.31 tell 192.168.10.173, length 46
Line Error (3417): 20:09:28.952059 ARP, Request who-has 192.168.10.182 tell 192.168.10.173, length 46
Line Error (3418): 20:09:29.086432 ARP, Request who-has 192.168.10.5 tell 192.168.10.70, length 46
Line Error (3419): 20:09:29.211730 ARP, Request who-has 192.168.10.5 tell 192.168.10.139, length 46
Line Error (3461): 20:09:29.601198 ARP, Request who-has 192.168.10.5 tell 192.168.10.70, length 46
Line Error (3464): 20:09:29.811815 ARP, Request who-has 192.168.10.5 tell 192.168.10.139, length 46
Line Error (3465): 20:09:29.882139 ARP, Request who-has 192.168.10.31 tell 192.168.10.173, length 46
Line Error (3466): 20:09:29.882144 ARP, Request who-has 192.168.10.182 tell 192.168.10.173, length 46
Line Error (3475): 20:09:30.601240 ARP, Request who-has 192.168.10.5 tell 192.168.10.70, length 46
Line Error (3478): 20:09:30.804295 ARP, Request who-has 192.168.10.5 tell 192.168.10.139, length 46
Line Error (3479): 20:09:30.888138 ARP, Request who-has 192.168.10.182 tell 192.168.10.173, length 46
Line Error (3485): 20:09:31.169939 AT 65280.129.6 > 0.6:  at-#6 25
Line Error (3499): 20:09:31.227974 ARP, Request who-has 192.168.10.1 tell 192.168.10.246, length 46
Line Error (3500): 20:09:31.227979 ARP, Reply 192.168.10.1 is-at 00:08:a2:0e:fd:02, length 28
Line Error (3519): 20:09:32.239916 ARP, Request who-has 192.168.10.6 tell 192.168.10.3, length 46
Line Error (3520): 20:09:32.363374 ARP, Request who-has 192.168.10.179 tell 192.168.10.91, length 46
Line Error (3556): 20:09:32.964246 ARP, Request who-has 192.168.10.182 tell 192.168.10.173, length 46
Line Error (3557): 20:09:32.969898 AT 65280.128.6 > 0.6:  at-#6 25
Line Error (3569): 20:09:33.891363 ARP, Request who-has 192.168.10.182 tell 192.168.10.173, length 46
Line Error (3570): 20:09:34.127177 ARP, Request who-has 192.168.10.31 tell 192.168.10.173, length 46
Line Error (3609): 20:09:34.740915 ARP, Request who-has 192.168.10.1 tell 192.168.10.80, length 46
Line Error (3610): 20:09:34.740920 ARP, Reply 192.168.10.1 is-at 00:08:a2:0e:fd:02, length 28
Line Error (3611): 20:09:34.879198 ARP, Request who-has 192.168.10.182 tell 192.168.10.173, length 46
Line Error (3612): 20:09:34.879204 ARP, Request who-has 192.168.10.31 tell 192.168.10.173, length 46
Line Error (3640): 20:09:35.301092 ARP, Request who-has 192.168.10.179 tell 192.168.10.91, length 46
Line Error (3670): 20:09:35.863521 ARP, Request who-has 192.168.10.179 tell 192.168.10.91, length 46
Line Error (3671): 20:09:35.888575 ARP, Request who-has 192.168.10.31 tell 192.168.10.173, length 46
Line Error (3699): 20:09:36.863595 ARP, Request who-has 192.168.10.179 tell 192.168.10.91, length 46
Line Error (3700): 20:09:36.927821 ARP, Request who-has 192.168.10.94 tell 192.168.10.94, length 46
