22:17:53.223045 IP 84.1.119.110.42747 > 79.120.134.178.1194: UDP, length 64
22:17:53.224582 IP 84.1.119.110.42747 > 79.120.134.178.1194: UDP, length 64
22:17:53.226699 IP 84.1.119.110.42747 > 79.120.134.178.1194: UDP, length 64
22:17:53.226707 IP 84.1.119.110.42747 > 79.120.134.178.1194: UDP, length 64
22:17:53.243817 IP 87.246.7.76.24422 > 79.120.134.178.587: tcp 0
22:17:53.247105 IP 217.65.100.169.49444 > 79.120.134.178.1194: UDP, length 206
22:17:53.248217 IP 79.120.134.178.1194 > 217.65.100.169.49444: UDP, length 107
22:17:53.262302 IP 217.65.100.169.49444 > 79.120.134.178.1194: UDP, length 150
22:17:53.263301 IP 79.120.134.178.1194 > 217.65.100.169.49444: UDP, length 117
22:17:53.279838 IP 217.65.100.169.49444 > 79.120.134.178.1194: UDP, length 206
22:17:53.280891 IP 79.120.134.178.1194 > 217.65.100.169.49444: UDP, length 107
22:17:53.294845 IP 217.65.100.169.49444 > 79.120.134.178.1194: UDP, length 150
22:17:53.295778 IP 79.120.134.178.1194 > 217.65.100.169.49444: UDP, length 117
22:17:53.309946 IP 217.65.100.169.49444 > 79.120.134.178.1194: UDP, length 1353
22:17:53.310004 IP 217.65.100.169.49444 > 79.120.134.178.1194: UDP, length 808
22:17:53.310574 IP 79.120.134.178.1194 > 217.65.100.169.49444: UDP, length 64
22:17:53.313780 IP 79.120.134.178.1194 > 217.65.100.169.49444: UDP, length 1353
22:17:53.313815 IP 79.120.134.178.1194 > 217.65.100.169.49444: UDP, length 1353
22:17:53.313842 IP 79.120.134.178.1194 > 217.65.100.169.49444: UDP, length 1353
22:17:53.313875 IP 79.120.134.178.1194 > 217.65.100.169.49444: UDP, length 1353
22:17:53.313904 IP 79.120.134.178.1194 > 217.65.100.169.49444: UDP, length 1353
22:17:53.313934 IP 79.120.134.178.1194 > 217.65.100.169.49444: UDP, length 91
22:17:53.324771 IP 217.65.100.169.49444 > 79.120.134.178.1194: UDP, length 64
22:17:53.328147 IP 217.65.100.169.49444 > 79.120.134.178.1194: UDP, length 64
22:17:53.328259 IP 217.65.100.169.49444 > 79.120.134.178.1194: UDP, length 64
22:17:53.328357 IP 217.65.100.169.49444 > 79.120.134.178.1194: UDP, length 64
22:17:53.336221 IP 217.65.100.169.49444 > 79.120.134.178.1194: UDP, length 1353
22:17:53.336316 IP 217.65.100.169.49444 > 79.120.134.178.1194: UDP, length 1353
22:17:53.336407 IP 217.65.100.169.49444 > 79.120.134.178.1194: UDP, length 1353
22:17:53.336552 IP 217.65.100.169.49444 > 79.120.134.178.1194: UDP, length 1353
22:17:53.336639 IP 217.65.100.169.49444 > 79.120.134.178.1194: UDP, length 1353
22:17:53.336672 IP 217.65.100.169.49444 > 79.120.134.178.1194: UDP, length 717
22:17:53.336936 IP 79.120.134.178.1194 > 217.65.100.169.49444: UDP, length 64
22:17:53.337049 IP 79.120.134.178.1194 > 217.65.100.169.49444: UDP, length 64
22:17:53.395379 IP 79.120.134.178.1194 > 217.65.100.169.49444: UDP, length 417
22:17:53.395482 IP 79.120.134.178.12926 > 84.1.119.110.10051: tcp 0
22:17:53.416231 IP 84.1.119.110.10051 > 79.120.134.178.12926: tcp 0
22:17:53.416251 IP 79.120.134.178.12926 > 84.1.119.110.10051: tcp 0
22:17:53.416569 IP 79.120.134.178.12926 > 84.1.119.110.10051: tcp 328
22:17:53.437471 IP 84.1.119.110.10051 > 79.120.134.178.12926: tcp 0
22:17:53.437587 IP 84.1.119.110.10051 > 79.120.134.178.12926: tcp 258
22:17:53.437599 IP 79.120.134.178.12926 > 84.1.119.110.10051: tcp 0
22:17:53.437969 IP 79.120.134.178.12926 > 84.1.119.110.10051: tcp 64
22:17:53.458339 IP 84.1.119.110.10051 > 79.120.134.178.12926: tcp 79
22:17:53.458353 IP 79.120.134.178.12926 > 84.1.119.110.10051: tcp 310
22:17:53.458359 IP 84.1.119.110.10051 > 79.120.134.178.12926: tcp 0
22:17:53.458368 IP 79.120.134.178.12926 > 84.1.119.110.10051: tcp 0
22:17:53.465472 IP 217.65.100.169.49444 > 79.120.134.178.1194: UDP, length 64
22:17:53.478392 IP 84.1.119.110.10051 > 79.120.134.178.12926: tcp 0
22:17:53.478417 IP 79.120.134.178 > 8.8.4.4: ICMP echo request, id 13028, seq 31732, length 9
22:17:53.480376 IP 84.1.119.110.10051 > 79.120.134.178.12926: tcp 83
22:17:53.480387 IP 79.120.134.178.12926 > 84.1.119.110.10051: tcp 0
22:17:53.480392 IP 84.1.119.110.10051 > 79.120.134.178.12926: tcp 24
22:17:53.480401 IP 79.120.134.178.12926 > 84.1.119.110.10051: tcp 0
22:17:53.480834 IP 79.120.134.178.12926 > 84.1.119.110.10051: tcp 24
22:17:53.480874 IP 79.120.134.178.12926 > 84.1.119.110.10051: tcp 0
22:17:53.482828 IP 8.8.4.4 > 79.120.134.178: ICMP echo reply, id 13028, seq 31732, length 9
22:17:53.500368 IP 84.1.119.110.10051 > 79.120.134.178.12926: tcp 0
22:17:53.504444 IP 84.1.119.110.10051 > 79.120.134.178.12926: tcp 0
22:17:53.656442 IP 79.120.134.178.12603 > 148.6.0.1.123: UDP, length 48
22:17:53.661403 IP 148.6.0.1.123 > 79.120.134.178.12603: UDP, length 48
22:17:53.710262 IP 79.120.134.178.12926 > 84.1.119.110.10051: tcp 24
22:17:53.730348 IP 84.1.119.110.10051 > 79.120.134.178.12926: tcp 0
22:17:53.893263 IP 79.120.134.178.12434 > 84.1.119.110.10051: tcp 0
22:17:53.968262 IP 79.120.134.178.12870 > 84.1.119.110.10051: tcp 24
22:17:53.970268 IP 79.120.134.178.12926 > 84.1.119.110.10051: tcp 24
22:17:53.981306 IP 79.120.134.178 > 8.8.4.4: ICMP echo request, id 13028, seq 31733, length 9
22:17:53.985740 IP 8.8.4.4 > 79.120.134.178: ICMP echo reply, id 13028, seq 31733, length 9
22:17:53.987088 IP 84.1.119.110.10051 > 79.120.134.178.12870: tcp 0
22:17:53.992350 IP 84.1.119.110.10051 > 79.120.134.178.12926: tcp 0
22:17:54.108264 IP 79.120.134.178.12831 > 84.1.119.110.10051: tcp 24
22:17:54.124865 IP 84.1.119.110.10051 > 79.120.134.178.12831: tcp 0
22:17:54.290264 IP 79.120.134.178.12926 > 84.1.119.110.10051: tcp 24
22:17:54.310237 IP 84.1.119.110.10051 > 79.120.134.178.12926: tcp 0
22:17:54.330268 IP 79.120.134.178.12738 > 84.1.119.110.10051: tcp 24
22:17:54.348528 IP 84.1.119.110.10051 > 79.120.134.178.12738: tcp 0
22:17:54.430838 IP 79.120.134.178.62763 > 38.90.226.51.8883: tcp 31
22:17:54.487283 IP 79.120.134.178 > 8.8.4.4: ICMP echo request, id 13028, seq 31734, length 9
22:17:54.490680 IP 79.120.134.178.12933 > 84.1.119.110.10051: tcp 0
22:17:54.491701 IP 8.8.4.4 > 79.120.134.178: ICMP echo reply, id 13028, seq 31734, length 9
22:17:54.509608 IP 84.1.119.110.10051 > 79.120.134.178.12933: tcp 0
22:17:54.509631 IP 79.120.134.178.12933 > 84.1.119.110.10051: tcp 0
22:17:54.509987 IP 79.120.134.178.12933 > 84.1.119.110.10051: tcp 328
22:17:54.529783 IP 84.1.119.110.10051 > 79.120.134.178.12933: tcp 0
22:17:54.529796 IP 84.1.119.110.10051 > 79.120.134.178.12933: tcp 258
22:17:54.529808 IP 79.120.134.178.12933 > 84.1.119.110.10051: tcp 0
22:17:54.530179 IP 79.120.134.178.12933 > 84.1.119.110.10051: tcp 64
22:17:54.530254 IP 79.120.134.178.12933 > 84.1.119.110.10051: tcp 1448
22:17:54.548434 IP 84.1.119.110.10051 > 79.120.134.178.12933: tcp 0
22:17:54.548471 IP 84.1.119.110.10051 > 79.120.134.178.12933: tcp 0
22:17:54.548481 IP 79.120.134.178.12933 > 84.1.119.110.10051: tcp 1206
22:17:54.552159 IP 84.1.119.110.10051 > 79.120.134.178.12933: tcp 79
22:17:54.552171 IP 79.120.134.178.12933 > 84.1.119.110.10051: tcp 0
22:17:54.568804 IP 84.1.119.110.10051 > 79.120.134.178.12933: tcp 0
22:17:54.569689 IP 84.1.119.110.10051 > 79.120.134.178.12933: tcp 107
22:17:54.569701 IP 79.120.134.178.12933 > 84.1.119.110.10051: tcp 0
22:17:54.570200 IP 79.120.134.178.12933 > 84.1.119.110.10051: tcp 24
22:17:54.570246 IP 79.120.134.178.12933 > 84.1.119.110.10051: tcp 0
22:17:54.587748 IP 84.1.119.110.10051 > 79.120.134.178.12933: tcp 0
22:17:54.601768 IP 38.90.226.51.8883 > 79.120.134.178.62763: tcp 31
22:17:54.648618 IP 79.120.134.178.62763 > 38.90.226.51.8883: tcp 0
22:17:54.730266 IP 79.120.134.178.12926 > 84.1.119.110.10051: tcp 24
22:17:54.752137 IP 84.1.119.110.10051 > 79.120.134.178.12926: tcp 0
22:17:54.800266 IP 79.120.134.178.12933 > 84.1.119.110.10051: tcp 24
22:17:54.801269 IP 79.120.134.178.12534 > 84.1.119.110.10051: tcp 24
22:17:54.810163 IP 212.70.149.18.2532 > 79.120.134.178.25: tcp 0
22:17:54.816773 IP 84.1.119.110.10051 > 79.120.134.178.12534: tcp 0
22:17:54.817867 IP 84.1.119.110.10051 > 79.120.134.178.12933: tcp 0
22:17:54.855342 IP 212.70.149.66.28112 > 79.120.134.178.25: tcp 0
22:17:54.991265 IP 79.120.134.178.12441 > 84.1.119.110.10051: tcp 0
22:17:55.019523 IP 79.120.134.178 > 8.8.4.4: ICMP echo request, id 13028, seq 31735, length 9
22:17:55.023938 IP 8.8.4.4 > 79.120.134.178: ICMP echo reply, id 13028, seq 31735, length 9
22:17:55.060264 IP 79.120.134.178.12933 > 84.1.119.110.10051: tcp 24
22:17:55.061269 IP 79.120.134.178.12875 > 84.1.119.110.10051: tcp 24
22:17:55.075792 IP 84.1.119.110.10051 > 79.120.134.178.12933: tcp 0
22:17:55.084324 IP 84.1.119.110.10051 > 79.120.134.178.12875: tcp 0
22:17:55.113730 IP 79.120.134.178.28590 > 87.97.60.77.110: tcp 0
22:17:55.125856 IP 87.97.60.77.110 > 79.120.134.178.28590: tcp 0
22:17:55.126140 IP 79.120.134.178.28590 > 87.97.60.77.110: tcp 0
22:17:55.170636 IP 87.97.60.77.110 > 79.120.134.178.28590: tcp 21
22:17:55.170922 IP 79.120.134.178.28590 > 87.97.60.77.110: tcp 0
22:17:55.171064 IP 79.120.134.178.28590 > 87.97.60.77.110: tcp 15
22:17:55.180711 IP 87.97.60.77.110 > 79.120.134.178.28590: tcp 0
22:17:55.186860 IP 87.97.60.77.110 > 79.120.134.178.28590: tcp 5
22:17:55.187215 IP 79.120.134.178.28590 > 87.97.60.77.110: tcp 11
22:17:55.192261 IP 79.120.134.178.12837 > 84.1.119.110.10051: tcp 24
22:17:55.196728 IP 87.97.60.77.110 > 79.120.134.178.28590: tcp 0
22:17:55.209960 IP 84.1.119.110.10051 > 79.120.134.178.12837: tcp 0
22:17:55.246467 IP 87.97.60.77.110 > 79.120.134.178.28590: tcp 16
22:17:55.246826 IP 79.120.134.178.28590 > 87.97.60.77.110: tcp 6
22:17:55.247531 IP 87.246.7.76.24422 > 79.120.134.178.587: tcp 0
22:17:55.256339 IP 87.97.60.77.110 > 79.120.134.178.28590: tcp 0
22:17:55.256349 IP 87.97.60.77.110 > 79.120.134.178.28590: tcp 9
22:17:55.256686 IP 79.120.134.178.28590 > 87.97.60.77.110: tcp 6
22:17:55.266354 IP 87.97.60.77.110 > 79.120.134.178.28590: tcp 0
22:17:55.267595 IP 87.97.60.77.110 > 79.120.134.178.28590: tcp 18
22:17:55.267840 IP 79.120.134.178.28590 > 87.97.60.77.110: tcp 0
22:17:55.278721 IP 87.97.60.77.110 > 79.120.134.178.28590: tcp 0
22:17:55.327842 IP 18.195.122.69.443 > 79.120.134.178.6187: tcp 0
22:17:55.327950 IP 79.120.134.178.6187 > 18.195.122.69.443: tcp 0
22:17:55.380274 IP 79.120.134.178.12933 > 84.1.119.110.10051: tcp 24
22:17:55.399696 IP 84.1.119.110.10051 > 79.120.134.178.12933: tcp 0
22:17:55.410264 IP 79.120.134.178.12926 > 84.1.119.110.10051: tcp 24
22:17:55.432341 IP 84.1.119.110.10051 > 79.120.134.178.12926: tcp 0
22:17:55.467715 IP 79.120.134.178.12940 > 84.1.119.110.10051: tcp 0
22:17:55.488303 IP 84.1.119.110.10051 > 79.120.134.178.12940: tcp 0
22:17:55.488323 IP 79.120.134.178.12940 > 84.1.119.110.10051: tcp 0
22:17:55.488643 IP 79.120.134.178.12940 > 84.1.119.110.10051: tcp 328
22:17:55.510970 IP 84.1.119.110.10051 > 79.120.134.178.12940: tcp 258
22:17:55.510983 IP 79.120.134.178.12940 > 84.1.119.110.10051: tcp 0
22:17:55.510989 IP 84.1.119.110.10051 > 79.120.134.178.12940: tcp 0
22:17:55.511357 IP 79.120.134.178.12940 > 84.1.119.110.10051: tcp 64
22:17:55.532723 IP 84.1.119.110.10051 > 79.120.134.178.12940: tcp 0
22:17:55.532734 IP 79.120.134.178.12940 > 84.1.119.110.10051: tcp 106
22:17:55.532745 IP 79.120.134.178 > 8.8.4.4: ICMP echo request, id 13028, seq 31736, length 9
22:17:55.532792 IP 84.1.119.110.10051 > 79.120.134.178.12940: tcp 79
22:17:55.532803 IP 79.120.134.178.12940 > 84.1.119.110.10051: tcp 0
22:17:55.537153 IP 8.8.4.4 > 79.120.134.178: ICMP echo reply, id 13028, seq 31736, length 9
22:17:55.554363 IP 84.1.119.110.10051 > 79.120.134.178.12940: tcp 0
22:17:55.554448 IP 84.1.119.110.10051 > 79.120.134.178.12940: tcp 89
22:17:55.554460 IP 79.120.134.178.12940 > 84.1.119.110.10051: tcp 0
22:17:55.554499 IP 79.120.134.178.12940 > 84.1.119.110.10051: tcp 24
22:17:55.554537 IP 79.120.134.178.12940 > 84.1.119.110.10051: tcp 0
22:17:55.572249 IP 79.120.134.178.12941 > 84.1.119.110.10051: tcp 0
22:17:55.574313 IP 84.1.119.110.10051 > 79.120.134.178.12940: tcp 0
22:17:55.574345 IP 84.1.119.110.10051 > 79.120.134.178.12940: tcp 0
22:17:55.594557 IP 84.1.119.110.10051 > 79.120.134.178.12941: tcp 0
22:17:55.594576 IP 79.120.134.178.12941 > 84.1.119.110.10051: tcp 0
22:17:55.594811 IP 79.120.134.178.12941 > 84.1.119.110.10051: tcp 328
22:17:55.615759 IP 84.1.119.110.10051 > 79.120.134.178.12941: tcp 258
22:17:55.615776 IP 79.120.134.178.12941 > 84.1.119.110.10051: tcp 0
22:17:55.615782 IP 84.1.119.110.10051 > 79.120.134.178.12941: tcp 0
22:17:55.615791 IP 79.120.134.178.12941 > 84.1.119.110.10051: tcp 0
22:17:55.616138 IP 79.120.134.178.12941 > 84.1.119.110.10051: tcp 64
22:17:55.637653 IP 84.1.119.110.10051 > 79.120.134.178.12941: tcp 0
22:17:55.637666 IP 79.120.134.178.12941 > 84.1.119.110.10051: tcp 309
22:17:55.637717 IP 84.1.119.110.10051 > 79.120.134.178.12941: tcp 79
22:17:55.637728 IP 79.120.134.178.12941 > 84.1.119.110.10051: tcp 0
22:17:55.658044 IP 84.1.119.110.10051 > 79.120.134.178.12941: tcp 0
22:17:55.658134 IP 84.1.119.110.10051 > 79.120.134.178.12941: tcp 83
22:17:55.658145 IP 79.120.134.178.12941 > 84.1.119.110.10051: tcp 0
22:17:55.658700 IP 79.120.134.178.12941 > 84.1.119.110.10051: tcp 24
22:17:55.658741 IP 79.120.134.178.12941 > 84.1.119.110.10051: tcp 0
22:17:55.661844 IP 84.1.119.110.10051 > 79.120.134.178.12941: tcp 24
22:17:55.661859 IP 79.120.134.178.12941 > 84.1.119.110.10051: tcp 0
22:17:55.677981 IP 84.1.119.110.10051 > 79.120.134.178.12941: tcp 0
22:17:55.678066 IP 84.1.119.110.10051 > 79.120.134.178.12941: tcp 0
22:17:55.784263 IP 79.120.134.178.12940 > 84.1.119.110.10051: tcp 24
22:17:55.806401 IP 84.1.119.110.10051 > 79.120.134.178.12940: tcp 0
22:17:55.810596 IP 212.70.149.18.2532 > 79.120.134.178.25: tcp 0
22:17:55.820261 IP 79.120.134.178.12933 > 84.1.119.110.10051: tcp 24
22:17:55.838349 IP 84.1.119.110.10051 > 79.120.134.178.12933: tcp 0
22:17:55.877266 IP 79.120.134.178.12542 > 84.1.119.110.10051: tcp 24
22:17:55.893960 IP 84.1.119.110.10051 > 79.120.134.178.12542: tcp 0
22:17:55.981243 IP 79.120.134.178.40710 > 13.107.206.240.53: UDP, length 52
22:17:55.997565 IP 13.107.206.240.53 > 79.120.134.178.40710: UDP, length 113
22:17:55.997668 IP 79.120.134.178.38313 > 13.107.206.240.53: UDP, length 59
22:17:56.006760 IP 79.120.134.178.43350 > 13.107.222.240.53: UDP, length 59
22:17:56.013809 IP 13.107.206.240.53 > 79.120.134.178.38313: UDP, length 120
22:17:56.013997 IP 79.120.134.178.14375 > 150.171.16.240.53: UDP, length 66
22:17:56.026133 IP 13.107.222.240.53 > 79.120.134.178.43350: UDP, length 120
22:17:56.026247 IP 79.120.134.178.45986 > 150.171.10.240.53: UDP, length 66
22:17:56.033307 IP 150.171.16.240.53 > 79.120.134.178.14375: UDP, length 127
22:17:56.033391 IP 79.120.134.178.17948 > 13.107.206.240.53: UDP, length 73
22:17:56.041278 IP 79.120.134.178 > 8.8.4.4: ICMP echo request, id 13028, seq 31737, length 9
22:17:56.042431 IP 150.171.10.240.53 > 79.120.134.178.45986: UDP, length 127
22:17:56.042510 IP 79.120.134.178.19684 > 150.171.10.240.53: UDP, length 73
22:17:56.044264 IP 79.120.134.178.12940 > 84.1.119.110.10051: tcp 24
22:17:56.045689 IP 8.8.4.4 > 79.120.134.178: ICMP echo reply, id 13028, seq 31737, length 9
22:17:56.049984 IP 13.107.206.240.53 > 79.120.134.178.17948: UDP, length 129
22:17:56.050128 IP 79.120.134.178.48403 > 13.107.206.39.53: UDP, length 47
22:17:56.058802 IP 150.171.10.240.53 > 79.120.134.178.19684: UDP, length 129
22:17:56.059044 IP 79.120.134.178.60088 > 13.107.222.39.53: UDP, length 47
22:17:56.066257 IP 13.107.206.39.53 > 79.120.134.178.48403: UDP, length 130
22:17:56.066376 IP 79.120.134.178.58927 > 13.107.222.39.53: UDP, length 54
22:17:56.066587 IP 84.1.119.110.10051 > 79.120.134.178.12940: tcp 0
22:17:56.078317 IP 13.107.222.39.53 > 79.120.134.178.60088: UDP, length 130
22:17:56.078457 IP 79.120.134.178.52901 > 150.171.16.39.53: UDP, length 54
22:17:56.085711 IP 13.107.222.39.53 > 79.120.134.178.58927: UDP, length 192
22:17:56.085857 IP 79.120.134.178.30797 > 40.90.4.201.53: UDP, length 71
22:17:56.094062 IP 40.90.4.201.53 > 79.120.134.178.30797: UDP, length 87
22:17:56.094164 IP 79.120.134.178.46824 > 64.4.48.201.53: UDP, length 71
22:17:56.097727 IP 150.171.16.39.53 > 79.120.134.178.52901: UDP, length 192
22:17:56.097842 IP 79.120.134.178.36576 > 13.107.160.201.53: UDP, length 71
22:17:56.102450 IP 64.4.48.201.53 > 79.120.134.178.46824: UDP, length 87
22:17:56.102592 IP 79.120.134.178.15488 > 40.90.4.201.53: UDP, length 71
22:17:56.106161 IP 13.107.160.201.53 > 79.120.134.178.36576: UDP, length 87
22:17:56.109009 IP 79.120.134.178.61577 > 52.168.117.169.443: tcp 0
22:17:56.110921 IP 40.90.4.201.53 > 79.120.134.178.15488: UDP, length 87
22:17:56.111044 IP 79.120.134.178.36173 > 40.90.4.201.53: UDP, length 71
22:17:56.119387 IP 40.90.4.201.53 > 79.120.134.178.36173: UDP, length 87
22:17:56.119458 IP 79.120.134.178.46028 > 40.90.4.201.53: UDP, length 71
22:17:56.127703 IP 40.90.4.201.53 > 79.120.134.178.46028: UDP, length 87
22:17:56.156264 IP 79.120.134.178.12879 > 84.1.119.110.10051: tcp 24
22:17:56.172875 IP 84.1.119.110.10051 > 79.120.134.178.12879: tcp 0
22:17:56.212207 IP 52.168.117.169.443 > 79.120.134.178.61577: tcp 0
22:17:56.213707 IP 79.120.134.178.61577 > 52.168.117.169.443: tcp 0
22:17:56.214944 IP 79.120.134.178.61577 > 52.168.117.169.443: tcp 214
22:17:56.319268 IP 52.168.117.169.443 > 79.120.134.178.61577: tcp 1460
22:17:56.319285 IP 52.168.117.169.443 > 79.120.134.178.61577: tcp 1460
22:17:56.319296 IP 52.168.117.169.443 > 79.120.134.178.61577: tcp 1460
22:17:56.319306 IP 52.168.117.169.443 > 79.120.134.178.61577: tcp 22
22:17:56.321969 IP 79.120.134.178.61577 > 52.168.117.169.443: tcp 0
22:17:56.325699 IP 79.120.134.178.61577 > 52.168.117.169.443: tcp 158
22:17:56.364264 IP 79.120.134.178.12940 > 84.1.119.110.10051: tcp 24
22:17:56.386296 IP 84.1.119.110.10051 > 79.120.134.178.12940: tcp 0
22:17:56.430190 IP 52.168.117.169.443 > 79.120.134.178.61577: tcp 51
22:17:56.434362 IP 79.120.134.178.61577 > 52.168.117.169.443: tcp 970
22:17:56.434799 IP 79.120.134.178.61577 > 52.168.117.169.443: tcp 1440
22:17:56.434890 IP 79.120.134.178.61577 > 52.168.117.169.443: tcp 1148
22:17:56.499272 IP 79.120.134.178.12754 > 84.1.119.110.10051: tcp 24
22:17:56.500287 IP 79.120.134.178.12933 > 84.1.119.110.10051: tcp 24
22:17:56.516877 IP 84.1.119.110.10051 > 79.120.134.178.12754: tcp 0
22:17:56.517943 IP 84.1.119.110.10051 > 79.120.134.178.12933: tcp 0
22:17:56.537822 IP 52.168.117.169.443 > 79.120.134.178.61577: tcp 0
22:17:56.543274 IP 79.120.134.178 > 8.8.4.4: ICMP echo request, id 13028, seq 31738, length 9
22:17:56.543598 IP 52.168.117.169.443 > 79.120.134.178.61577: tcp 454
22:17:56.547699 IP 8.8.4.4 > 79.120.134.178: ICMP echo reply, id 13028, seq 31738, length 9
22:17:56.551670 IP 79.120.134.178.61577 > 52.168.117.169.443: tcp 0
22:17:56.570268 IP 79.120.134.178.12926 > 84.1.119.110.10051: tcp 24
22:17:56.592211 IP 84.1.119.110.10051 > 79.120.134.178.12926: tcp 0
22:17:56.654850 IP 52.168.117.169.443 > 79.120.134.178.61577: tcp 0
22:17:56.656261 IP 79.120.134.178.61577 > 52.168.117.169.443: tcp 0
22:17:56.660427 IP 79.120.134.178.12948 > 84.1.119.110.10051: tcp 0
22:17:56.679905 IP 84.1.119.110.10051 > 79.120.134.178.12948: tcp 0
22:17:56.679923 IP 79.120.134.178.12948 > 84.1.119.110.10051: tcp 0
22:17:56.680241 IP 79.120.134.178.12948 > 84.1.119.110.10051: tcp 328
22:17:56.699847 IP 84.1.119.110.10051 > 79.120.134.178.12948: tcp 0
22:17:56.700066 IP 84.1.119.110.10051 > 79.120.134.178.12948: tcp 258
22:17:56.700078 IP 79.120.134.178.12948 > 84.1.119.110.10051: tcp 0
22:17:56.700451 IP 79.120.134.178.12948 > 84.1.119.110.10051: tcp 64
22:17:56.719816 IP 84.1.119.110.10051 > 79.120.134.178.12948: tcp 79
22:17:56.719832 IP 79.120.134.178.12948 > 84.1.119.110.10051: tcp 463
22:17:56.719838 IP 84.1.119.110.10051 > 79.120.134.178.12948: tcp 0
22:17:56.719847 IP 79.120.134.178.12948 > 84.1.119.110.10051: tcp 0
22:17:56.738478 IP 84.1.119.110.10051 > 79.120.134.178.12948: tcp 0
22:17:56.740304 IP 84.1.119.110.10051 > 79.120.134.178.12948: tcp 83
22:17:56.740315 IP 79.120.134.178.12948 > 84.1.119.110.10051: tcp 0
22:17:56.740813 IP 79.120.134.178.12948 > 84.1.119.110.10051: tcp 24
22:17:56.740851 IP 79.120.134.178.12948 > 84.1.119.110.10051: tcp 0
22:17:56.742919 IP 84.1.119.110.10051 > 79.120.134.178.12948: tcp 24
22:17:56.742934 IP 79.120.134.178.12948 > 84.1.119.110.10051: tcp 0
22:17:56.759672 IP 84.1.119.110.10051 > 79.120.134.178.12948: tcp 0
22:17:56.759747 IP 84.1.119.110.10051 > 79.120.134.178.12948: tcp 0
22:17:56.779264 IP 79.120.134.178.12665 > 84.1.119.110.10051: tcp 24
22:17:56.796231 IP 84.1.119.110.10051 > 79.120.134.178.12665: tcp 0
22:17:56.804264 IP 79.120.134.178.12940 > 84.1.119.110.10051: tcp 24
22:17:56.828010 IP 84.1.119.110.10051 > 79.120.134.178.12940: tcp 0
22:17:56.933138 IP 79.120.134.178.8210 > 54.194.101.134.31004: tcp 282
22:17:56.968268 IP 79.120.134.178.12557 > 84.1.119.110.10051: tcp 24
22:17:56.976675 IP 54.194.101.134.31004 > 79.120.134.178.8210: tcp 142
22:17:56.977707 IP 79.120.134.178.8210 > 54.194.101.134.31004: tcp 0
22:17:56.984437 IP 84.1.119.110.10051 > 79.120.134.178.12557: tcp 0
22:17:57.044282 IP 79.120.134.178 > 8.8.4.4: ICMP echo request, id 13028, seq 31739, length 9
22:17:57.048695 IP 8.8.4.4 > 79.120.134.178: ICMP echo reply, id 13028, seq 31739, length 9
22:17:57.099217 IP 79.120.134.178.7401 > 8.8.8.8.53: UDP, length 36
22:17:57.103808 IP 8.8.8.8.53 > 79.120.134.178.7401: UDP, length 52
22:17:57.142262 IP 79.120.134.178.12456 > 84.1.119.110.10051: tcp 0
22:17:57.349602 IP 79.120.134.178.12949 > 192.168.25.205.21: tcp 0
22:17:57.382963 IP 79.120.134.178.27397 > 93.189.114.217.443: tcp 709
22:17:57.388268 IP 93.189.114.217.443 > 79.120.134.178.27397: tcp 229
22:17:57.441591 IP 79.120.134.178.27397 > 93.189.114.217.443: tcp 0
22:17:57.484272 IP 79.120.134.178.12940 > 84.1.119.110.10051: tcp 24
22:17:57.493364 IP 79.120.134.178.33649 > 93.189.114.217.443: tcp 693
22:17:57.494261 IP 79.120.134.178.35803 > 93.189.114.217.443: tcp 693
22:17:57.495183 IP 79.120.134.178.57681 > 93.189.114.217.443: tcp 693
22:17:57.498463 IP 93.189.114.217.443 > 79.120.134.178.33649: tcp 229
22:17:57.499509 IP 93.189.114.217.443 > 79.120.134.178.35803: tcp 229
22:17:57.500050 IP 93.189.114.217.443 > 79.120.134.178.57681: tcp 229
22:17:57.504581 IP 84.1.119.110.10051 > 79.120.134.178.12940: tcp 0
22:17:57.541837 IP 79.120.134.178.33649 > 93.189.114.217.443: tcp 0
22:17:57.541847 IP 79.120.134.178.35803 > 93.189.114.217.443: tcp 0
22:17:57.541877 IP 79.120.134.178.57681 > 93.189.114.217.443: tcp 0
22:17:57.546273 IP 79.120.134.178 > 8.8.4.4: ICMP echo request, id 13028, seq 31740, length 9
22:17:57.550698 IP 8.8.4.4 > 79.120.134.178: ICMP echo reply, id 13028, seq 31740, length 9
22:17:57.589272 IP 79.120.134.178.12761 > 84.1.119.110.10051: tcp 24
22:17:57.609908 IP 84.1.119.110.10051 > 79.120.134.178.12761: tcp 0
22:17:57.660268 IP 79.120.134.178.12933 > 84.1.119.110.10051: tcp 24
22:17:57.677637 IP 84.1.119.110.10051 > 79.120.134.178.12933: tcp 0
22:17:57.756457 IP 79.120.134.178.12959 > 84.1.119.110.10051: tcp 0
22:17:57.774749 IP 84.1.119.110.10051 > 79.120.134.178.12959: tcp 0
22:17:57.774770 IP 79.120.134.178.12959 > 84.1.119.110.10051: tcp 0
22:17:57.775073 IP 79.120.134.178.12959 > 84.1.119.110.10051: tcp 328
22:17:57.795138 IP 84.1.119.110.10051 > 79.120.134.178.12959: tcp 258
22:17:57.795154 IP 79.120.134.178.12959 > 84.1.119.110.10051: tcp 0
22:17:57.795160 IP 84.1.119.110.10051 > 79.120.134.178.12959: tcp 0
22:17:57.795529 IP 79.120.134.178.12959 > 84.1.119.110.10051: tcp 64
22:17:57.814556 IP 84.1.119.110.10051 > 79.120.134.178.12959: tcp 0
22:17:57.814569 IP 79.120.134.178.12959 > 84.1.119.110.10051: tcp 355
22:17:57.814607 IP 212.70.149.18.2532 > 79.120.134.178.25: tcp 0
22:17:57.814656 IP 84.1.119.110.10051 > 79.120.134.178.12959: tcp 79
22:17:57.814669 IP 79.120.134.178.12959 > 84.1.119.110.10051: tcp 0
22:17:57.821622 IP 79.120.134.178.13291 > 93.189.114.217.443: tcp 693
22:17:57.826972 IP 93.189.114.217.443 > 79.120.134.178.13291: tcp 229
22:17:57.834823 IP 84.1.119.110.10051 > 79.120.134.178.12959: tcp 83
22:17:57.834836 IP 79.120.134.178.12959 > 84.1.119.110.10051: tcp 0
22:17:57.834842 IP 84.1.119.110.10051 > 79.120.134.178.12959: tcp 0
22:17:57.835295 IP 79.120.134.178.12959 > 84.1.119.110.10051: tcp 24
22:17:57.835341 IP 79.120.134.178.12959 > 84.1.119.110.10051: tcp 0
22:17:57.838770 IP 84.1.119.110.10051 > 79.120.134.178.12959: tcp 24
22:17:57.838788 IP 79.120.134.178.12959 > 84.1.119.110.10051: tcp 0
22:17:57.854261 IP 79.120.134.178.12670 > 84.1.119.110.10051: tcp 24
22:17:57.854834 IP 84.1.119.110.10051 > 79.120.134.178.12959: tcp 0
22:17:57.854883 IP 84.1.119.110.10051 > 79.120.134.178.12959: tcp 0
22:17:57.870697 IP 84.1.119.110.10051 > 79.120.134.178.12670: tcp 0
22:17:57.874070 IP 79.120.134.178.13291 > 93.189.114.217.443: tcp 0
22:17:57.983331 IP 217.65.100.169.49444 > 79.120.134.178.1194: UDP, length 111
22:17:57.984065 IP 217.65.100.169.49444 > 79.120.134.178.1194: UDP, length 111
22:17:57.985599 IP 217.65.100.169.49444 > 79.120.134.178.1194: UDP, length 99
22:17:58.001427 IP 79.120.134.178.46879 > 148.6.0.1.123: UDP, length 48
22:17:58.006385 IP 148.6.0.1.123 > 79.120.134.178.46879: UDP, length 48
22:17:58.048216 IP 79.120.134.178 > 8.8.4.4: ICMP echo request, id 13028, seq 31741, length 9
22:17:58.052619 IP 8.8.4.4 > 79.120.134.178: ICMP echo reply, id 13028, seq 31741, length 9
22:17:58.070266 IP 79.120.134.178.12564 > 84.1.119.110.10051: tcp 24
22:17:58.088956 IP 84.1.119.110.10051 > 79.120.134.178.12564: tcp 0
22:17:58.137639 IP 79.120.134.178.64641 > 93.189.114.217.443: tcp 693
22:17:58.138369 IP 79.120.134.178.27397 > 93.189.114.217.443: tcp 693
22:17:58.142894 IP 93.189.114.217.443 > 79.120.134.178.64641: tcp 229
22:17:58.143430 IP 93.189.114.217.443 > 79.120.134.178.27397: tcp 229
22:17:58.190587 IP 79.120.134.178.64641 > 93.189.114.217.443: tcp 0
22:17:58.190592 IP 79.120.134.178.27397 > 93.189.114.217.443: tcp 0
22:17:58.212771 IP 79.120.134.178.9721 > 116.202.208.24.443: tcp 1
22:17:58.235780 IP 116.202.208.24.443 > 79.120.134.178.9721: tcp 0
22:17:58.349264 IP 79.120.134.178.12949 > 192.168.25.205.21: tcp 0
22:17:58.509294 IP 79.120.134.178.52970 > 91.82.92.228.110: tcp 0
22:17:58.527270 IP 79.120.134.178.12565 > 84.1.119.110.10051: tcp 24
22:17:58.546666 IP 84.1.119.110.10051 > 79.120.134.178.12565: tcp 0
22:17:58.554281 IP 79.120.134.178 > 8.8.4.4: ICMP echo request, id 13028, seq 31742, length 9
22:17:58.558678 IP 8.8.4.4 > 79.120.134.178: ICMP echo reply, id 13028, seq 31742, length 9
22:17:58.644266 IP 79.120.134.178.12940 > 84.1.119.110.10051: tcp 24
22:17:58.655065 IP 79.120.134.178.33649 > 93.189.114.217.443: tcp 693
22:17:58.660401 IP 93.189.114.217.443 > 79.120.134.178.33649: tcp 229
22:17:58.664310 IP 84.1.119.110.10051 > 79.120.134.178.12940: tcp 0
22:17:58.670715 IP 79.120.134.178.35803 > 93.189.114.217.443: tcp 693
22:17:58.675761 IP 93.189.114.217.443 > 79.120.134.178.35803: tcp 229
22:17:58.690267 IP 79.120.134.178.12926 > 84.1.119.110.10051: tcp 24
22:17:58.708262 IP 79.120.134.178.12766 > 84.1.119.110.10051: tcp 24
22:17:58.710910 IP 84.1.119.110.10051 > 79.120.134.178.12926: tcp 0
22:17:58.714363 IP 79.120.134.178.33649 > 93.189.114.217.443: tcp 0
22:17:58.726980 IP 84.1.119.110.10051 > 79.120.134.178.12766: tcp 0
22:17:58.729959 IP 79.120.134.178.35803 > 93.189.114.217.443: tcp 0
22:17:58.837344 IP 79.120.134.178.12964 > 84.1.119.110.10051: tcp 0
22:17:58.858083 IP 84.1.119.110.10051 > 79.120.134.178.12964: tcp 0
22:17:58.858104 IP 79.120.134.178.12964 > 84.1.119.110.10051: tcp 0
22:17:58.858385 IP 79.120.134.178.12964 > 84.1.119.110.10051: tcp 328
22:17:58.877861 IP 84.1.119.110.10051 > 79.120.134.178.12964: tcp 0
22:17:58.879964 IP 84.1.119.110.10051 > 79.120.134.178.12964: tcp 258
22:17:58.879976 IP 79.120.134.178.12964 > 84.1.119.110.10051: tcp 0
22:17:58.880344 IP 79.120.134.178.12964 > 84.1.119.110.10051: tcp 64
22:17:58.903362 IP 84.1.119.110.10051 > 79.120.134.178.12964: tcp 0
22:17:58.903375 IP 79.120.134.178.12964 > 84.1.119.110.10051: tcp 333
22:17:58.903435 IP 84.1.119.110.10051 > 79.120.134.178.12964: tcp 79
22:17:58.903446 IP 79.120.134.178.12964 > 84.1.119.110.10051: tcp 0
22:17:58.923871 IP 84.1.119.110.10051 > 79.120.134.178.12964: tcp 83
22:17:58.923885 IP 79.120.134.178.12964 > 84.1.119.110.10051: tcp 0
22:17:58.923889 IP 84.1.119.110.10051 > 79.120.134.178.12964: tcp 0
22:17:58.924394 IP 79.120.134.178.12964 > 84.1.119.110.10051: tcp 24
22:17:58.924438 IP 79.120.134.178.12964 > 84.1.119.110.10051: tcp 0
22:17:58.927620 IP 84.1.119.110.10051 > 79.120.134.178.12964: tcp 24
22:17:58.927635 IP 79.120.134.178.12964 > 84.1.119.110.10051: tcp 0
22:17:58.934266 IP 79.120.134.178.12677 > 84.1.119.110.10051: tcp 24
22:17:58.943774 IP 84.1.119.110.10051 > 79.120.134.178.12964: tcp 0
22:17:58.945671 IP 84.1.119.110.10051 > 79.120.134.178.12964: tcp 0
22:17:58.953464 IP 84.1.119.110.10051 > 79.120.134.178.12677: tcp 0
22:17:58.981528 IP 217.65.100.169.49444 > 79.120.134.178.1194: UDP, length 99
22:17:59.081063 IP 79.120.134.178 > 8.8.4.4: ICMP echo request, id 13028, seq 31743, length 9
22:17:59.081286 IP 79.120.134.178.24281 > 13.107.206.39.53: UDP, length 58
22:17:59.081491 IP 79.120.134.178.20051 > 13.107.222.39.53: UDP, length 58
22:17:59.085503 IP 8.8.4.4 > 79.120.134.178: ICMP echo reply, id 13028, seq 31743, length 9
22:17:59.097661 IP 13.107.206.39.53 > 79.120.134.178.24281: UDP, length 196
22:17:59.097836 IP 79.120.134.178.14910 > 13.107.160.201.53: UDP, length 76
22:17:59.100691 IP 13.107.222.39.53 > 79.120.134.178.20051: UDP, length 196
22:17:59.100868 IP 79.120.134.178.65071 > 13.107.160.201.53: UDP, length 76
22:17:59.106026 IP 13.107.160.201.53 > 79.120.134.178.14910: UDP, length 92
22:17:59.106153 IP 79.120.134.178.36897 > 64.4.48.201.53: UDP, length 76
22:17:59.109215 IP 13.107.160.201.53 > 79.120.134.178.65071: UDP, length 92
22:17:59.109325 IP 79.120.134.178.22164 > 64.4.48.201.53: UDP, length 76
22:17:59.117623 IP 64.4.48.201.53 > 79.120.134.178.22164: UDP, length 147
22:17:59.117723 IP 79.120.134.178.19399 > 40.90.4.201.53: UDP, length 76
22:17:59.125963 IP 40.90.4.201.53 > 79.120.134.178.19399: UDP, length 147
22:17:59.126035 IP 79.120.134.178.44939 > 13.107.160.201.53: UDP, length 76
22:17:59.134283 IP 13.107.160.201.53 > 79.120.134.178.44939: UDP, length 147
22:17:59.153429 IP 64.4.48.201.53 > 79.120.134.178.36897: UDP, length 92
22:17:59.153616 IP 79.120.134.178.37282 > 40.90.4.201.53: UDP, length 76
22:17:59.161855 IP 40.90.4.201.53 > 79.120.134.178.37282: UDP, length 92
22:17:59.171041 IP 79.120.134.178.59583 > 40.113.176.163.8883: tcp 0
22:17:59.200047 IP 40.113.176.163.8883 > 79.120.134.178.59583: tcp 0
22:17:59.221903 IP 79.120.134.178.59583 > 40.113.176.163.8883: tcp 0
22:17:59.222115 IP 79.120.134.178.59583 > 40.113.176.163.8883: tcp 347
22:17:59.252887 IP 40.113.176.163.8883 > 79.120.134.178.59583: tcp 1460
22:17:59.252904 IP 40.113.176.163.8883 > 79.120.134.178.59583: tcp 1460
22:17:59.252917 IP 40.113.176.163.8883 > 79.120.134.178.59583: tcp 1039
22:17:59.261149 IP 87.246.7.76.27674 > 79.120.134.178.587: tcp 0
22:17:59.272477 IP 79.120.134.178.59583 > 40.113.176.163.8883: tcp 0
22:17:59.272484 IP 79.120.134.178.59583 > 40.113.176.163.8883: tcp 0
22:17:59.507435 IP 79.120.134.178.52970 > 91.82.92.228.110: tcp 0
22:17:59.511372 IP 79.120.134.178.59583 > 40.113.176.163.8883: tcp 178
22:17:59.541539 IP 40.113.176.163.8883 > 79.120.134.178.59583: tcp 91
22:17:59.585662 IP 79.120.134.178.59583 > 40.113.176.163.8883: tcp 0
22:17:59.585685 IP 79.120.134.178.59583 > 40.113.176.163.8883: tcp 341
22:17:59.612538 IP 79.120.134.178 > 8.8.4.4: ICMP echo request, id 13028, seq 31744, length 9
22:17:59.616946 IP 8.8.4.4 > 79.120.134.178: ICMP echo reply, id 13028, seq 31744, length 9
22:17:59.626411 IP 40.113.176.163.8883 > 79.120.134.178.59583: tcp 69
22:17:59.626488 IP 40.113.176.163.8883 > 79.120.134.178.59583: tcp 0
22:17:59.673403 IP 79.120.134.178.59583 > 40.113.176.163.8883: tcp 0
22:17:59.700146 IP 79.120.134.178.58319 > 142.93.235.17.4000: UDP, length 148
22:17:59.780262 IP 79.120.134.178.12933 > 84.1.119.110.10051: tcp 24
22:17:59.784262 IP 79.120.134.178.12777 > 84.1.119.110.10051: tcp 24
22:17:59.799760 IP 84.1.119.110.10051 > 79.120.134.178.12933: tcp 0
22:17:59.802523 IP 84.1.119.110.10051 > 79.120.134.178.12777: tcp 0
22:17:59.926507 IP 79.120.134.178.12970 > 84.1.119.110.10051: tcp 0
22:17:59.944779 IP 84.1.119.110.10051 > 79.120.134.178.12970: tcp 0
22:17:59.944806 IP 79.120.134.178.12970 > 84.1.119.110.10051: tcp 0
22:17:59.945113 IP 79.120.134.178.12970 > 84.1.119.110.10051: tcp 328
22:17:59.963086 IP 84.1.119.110.10051 > 79.120.134.178.12970: tcp 258
22:17:59.963102 IP 79.120.134.178.12970 > 84.1.119.110.10051: tcp 0
22:17:59.963108 IP 84.1.119.110.10051 > 79.120.134.178.12970: tcp 0
22:17:59.963118 IP 79.120.134.178.12970 > 84.1.119.110.10051: tcp 0
22:17:59.963476 IP 79.120.134.178.12970 > 84.1.119.110.10051: tcp 64
22:17:59.982660 IP 84.1.119.110.10051 > 79.120.134.178.12970: tcp 0
22:17:59.982674 IP 79.120.134.178.12970 > 84.1.119.110.10051: tcp 704
22:17:59.982738 IP 84.1.119.110.10051 > 79.120.134.178.12970: tcp 79
22:17:59.982749 IP 79.120.134.178.12970 > 84.1.119.110.10051: tcp 0
22:18:00.002593 IP 84.1.119.110.10051 > 79.120.134.178.12970: tcp 0
22:18:00.006517 IP 84.1.119.110.10051 > 79.120.134.178.12970: tcp 83
22:18:00.006529 IP 79.120.134.178.12970 > 84.1.119.110.10051: tcp 0
22:18:00.006534 IP 84.1.119.110.10051 > 79.120.134.178.12970: tcp 24
22:18:00.006543 IP 79.120.134.178.12970 > 84.1.119.110.10051: tcp 0
22:18:00.007042 IP 79.120.134.178.12970 > 84.1.119.110.10051: tcp 24
22:18:00.007085 IP 79.120.134.178.12970 > 84.1.119.110.10051: tcp 0
22:18:00.016266 IP 79.120.134.178.12682 > 84.1.119.110.10051: tcp 24
22:18:00.026171 IP 84.1.119.110.10051 > 79.120.134.178.12970: tcp 0
22:18:00.026205 IP 84.1.119.110.10051 > 79.120.134.178.12970: tcp 0
22:18:00.029463 IP 79.120.134.178.44467 > 52.168.117.169.443: tcp 0
22:18:00.035015 IP 84.1.119.110.10051 > 79.120.134.178.12682: tcp 0
22:18:00.115280 IP 79.120.134.178 > 8.8.4.4: ICMP echo request, id 13028, seq 31745, length 9
22:18:00.119689 IP 8.8.4.4 > 79.120.134.178: ICMP echo reply, id 13028, seq 31745, length 9
22:18:00.132822 IP 52.168.117.169.443 > 79.120.134.178.44467: tcp 0
22:18:00.134344 IP 79.120.134.178.44467 > 52.168.117.169.443: tcp 0
22:18:00.135635 IP 79.120.134.178.44467 > 52.168.117.169.443: tcp 214
22:18:00.236263 IP 79.120.134.178.12970 > 84.1.119.110.10051: tcp 24
22:18:00.240125 IP 52.168.117.169.443 > 79.120.134.178.44467: tcp 1460
22:18:00.240146 IP 52.168.117.169.443 > 79.120.134.178.44467: tcp 1460
22:18:00.240157 IP 52.168.117.169.443 > 79.120.134.178.44467: tcp 1460
22:18:00.240168 IP 52.168.117.169.443 > 79.120.134.178.44467: tcp 22
22:18:00.247490 IP 79.120.134.178.44467 > 52.168.117.169.443: tcp 0
22:18:00.249983 IP 79.120.134.178.44467 > 52.168.117.169.443: tcp 158
22:18:00.255558 IP 84.1.119.110.10051 > 79.120.134.178.12970: tcp 0
22:18:00.263901 IP 87.246.7.76.27674 > 79.120.134.178.587: tcp 0
22:18:00.354831 IP 52.168.117.169.443 > 79.120.134.178.44467: tcp 51
22:18:00.357508 IP 79.120.134.178.44467 > 52.168.117.169.443: tcp 970
22:18:00.358853 IP 79.120.134.178.44467 > 52.168.117.169.443: tcp 1440
22:18:00.358973 IP 79.120.134.178.44467 > 52.168.117.169.443: tcp 1440
22:18:00.359094 IP 79.120.134.178.44467 > 52.168.117.169.443: tcp 1440
22:18:00.359218 IP 79.120.134.178.44467 > 52.168.117.169.443: tcp 1440
22:18:00.359337 IP 79.120.134.178.44467 > 52.168.117.169.443: tcp 1440
22:18:00.359416 IP 79.120.134.178.44467 > 52.168.117.169.443: tcp 1021
22:18:00.359482 IP 79.120.134.178.44467 > 52.168.117.169.443: tcp 796
22:18:00.462012 IP 52.168.117.169.443 > 79.120.134.178.44467: tcp 0
22:18:00.462091 IP 52.168.117.169.443 > 79.120.134.178.44467: tcp 0
22:18:00.462377 IP 52.168.117.169.443 > 79.120.134.178.44467: tcp 0
22:18:00.462388 IP 52.168.117.169.443 > 79.120.134.178.44467: tcp 0
22:18:00.473034 IP 52.168.117.169.443 > 79.120.134.178.44467: tcp 454
22:18:00.481857 IP 79.120.134.178.44467 > 52.168.117.169.443: tcp 0
22:18:00.496267 IP 79.120.134.178.12970 > 84.1.119.110.10051: tcp 24
22:18:00.514297 IP 84.1.119.110.10051 > 79.120.134.178.12970: tcp 0
22:18:00.549269 IP 79.120.134.178.12949 > 192.168.25.205.21: tcp 0
22:18:00.584958 IP 52.168.117.169.443 > 79.120.134.178.44467: tcp 0
22:18:00.588680 IP 79.120.134.178.44467 > 52.168.117.169.443: tcp 0
22:18:00.611771 IP 79.120.134.178.6187 > 18.195.122.69.443: tcp 0
22:18:00.632003 IP 18.195.122.69.443 > 79.120.134.178.6187: tcp 0
22:18:00.647524 IP 79.120.134.178 > 8.8.4.4: ICMP echo request, id 13028, seq 31746, length 9
22:18:00.651927 IP 8.8.4.4 > 79.120.134.178: ICMP echo reply, id 13028, seq 31746, length 9
22:18:00.763266 IP 79.120.134.178.12864 > 84.1.119.110.10051: tcp 24
22:18:00.764260 IP 79.120.134.178.12940 > 84.1.119.110.10051: tcp 24
22:18:00.786030 IP 84.1.119.110.10051 > 79.120.134.178.12864: tcp 0
22:18:00.788430 IP 84.1.119.110.10051 > 79.120.134.178.12940: tcp 0
22:18:00.816260 IP 79.120.134.178.12970 > 84.1.119.110.10051: tcp 24
22:18:00.834433 IP 84.1.119.110.10051 > 79.120.134.178.12970: tcp 0
22:18:00.866265 IP 79.120.134.178.12779 > 84.1.119.110.10051: tcp 24
22:18:00.887217 IP 84.1.119.110.10051 > 79.120.134.178.12779: tcp 0
22:18:00.997270 IP 217.65.100.169.49444 > 79.120.134.178.1194: UDP, length 99
22:18:01.036440 IP 79.120.134.178.12976 > 84.1.119.110.10051: tcp 0
22:18:01.052743 IP 84.1.119.110.10051 > 79.120.134.178.12976: tcp 0
22:18:01.052769 IP 79.120.134.178.12976 > 84.1.119.110.10051: tcp 0
22:18:01.053079 IP 79.120.134.178.12976 > 84.1.119.110.10051: tcp 328
22:18:01.070714 IP 84.1.119.110.10051 > 79.120.134.178.12976: tcp 0
22:18:01.070858 IP 84.1.119.110.10051 > 79.120.134.178.12976: tcp 258
22:18:01.070870 IP 79.120.134.178.12976 > 84.1.119.110.10051: tcp 0
22:18:01.071250 IP 79.120.134.178.12976 > 84.1.119.110.10051: tcp 64
22:18:01.086708 IP 84.1.119.110.10051 > 79.120.134.178.12976: tcp 79
22:18:01.086723 IP 79.120.134.178.12976 > 84.1.119.110.10051: tcp 313
22:18:01.086730 IP 84.1.119.110.10051 > 79.120.134.178.12976: tcp 0
22:18:01.086739 IP 79.120.134.178.12976 > 84.1.119.110.10051: tcp 0
22:18:01.104895 IP 84.1.119.110.10051 > 79.120.134.178.12976: tcp 0
22:18:01.104965 IP 84.1.119.110.10051 > 79.120.134.178.12976: tcp 83
22:18:01.104976 IP 79.120.134.178.12976 > 84.1.119.110.10051: tcp 0
22:18:01.105419 IP 79.120.134.178.12976 > 84.1.119.110.10051: tcp 24
22:18:01.105459 IP 79.120.134.178.12976 > 84.1.119.110.10051: tcp 0
22:18:01.108592 IP 84.1.119.110.10051 > 79.120.134.178.12976: tcp 24
22:18:01.108610 IP 79.120.134.178.12976 > 84.1.119.110.10051: tcp 0
22:18:01.123815 IP 84.1.119.110.10051 > 79.120.134.178.12976: tcp 0
22:18:01.123875 IP 84.1.119.110.10051 > 79.120.134.178.12976: tcp 0
22:18:01.176468 IP 79.120.134.178 > 8.8.4.4: ICMP echo request, id 13028, seq 31747, length 9
22:18:01.180903 IP 8.8.4.4 > 79.120.134.178: ICMP echo reply, id 13028, seq 31747, length 9
22:18:01.256263 IP 79.120.134.178.12970 > 84.1.119.110.10051: tcp 24
22:18:01.274834 IP 84.1.119.110.10051 > 79.120.134.178.12970: tcp 0
22:18:01.359270 IP 79.120.134.178.12593 > 84.1.119.110.10051: tcp 24
22:18:01.378063 IP 84.1.119.110.10051 > 79.120.134.178.12593: tcp 0
22:18:01.466401 IP 84.21.182.51.55922 > 79.120.134.178.1194: UDP, length 40
22:18:01.512302 IP 79.120.134.178.52970 > 91.82.92.228.110: tcp 0
22:18:01.577263 IP 79.120.134.178.12485 > 84.1.119.110.10051: tcp 0
22:18:01.708545 IP 79.120.134.178 > 8.8.4.4: ICMP echo request, id 13028, seq 31748, length 9
22:18:01.712948 IP 8.8.4.4 > 79.120.134.178: ICMP echo reply, id 13028, seq 31748, length 9
22:18:01.848263 IP 79.120.134.178.12870 > 84.1.119.110.10051: tcp 24
22:18:01.866910 IP 84.1.119.110.10051 > 79.120.134.178.12870: tcp 0
22:18:01.936266 IP 79.120.134.178.12970 > 84.1.119.110.10051: tcp 24
22:18:01.956001 IP 84.1.119.110.10051 > 79.120.134.178.12970: tcp 0
22:18:01.990266 IP 79.120.134.178.12786 > 84.1.119.110.10051: tcp 24
22:18:02.012248 IP 84.1.119.110.10051 > 79.120.134.178.12786: tcp 0
