20:14:13.642478 IP 192.168.10.93.1900 > 239.255.255.250.1900: UDP, length 349
20:14:13.642504 IP 192.168.10.93.1900 > 239.255.255.250.1900: UDP, length 366
20:14:13.642551 IP 192.168.10.93.1900 > 239.255.255.250.1900: UDP, length 413
20:14:13.642555 IP 192.168.10.93.1900 > 239.255.255.250.1900: UDP, length 391
20:14:35.186232 IP 192.168.10.19.123 > 141.95.62.57.123: UDP, length 48
20:14:35.209831 IP 141.95.62.57.123 > 192.168.10.19.123: UDP, length 48
20:23:07.190455 IP 192.168.10.19.123 > 141.95.62.57.123: UDP, length 48
20:23:07.213917 IP 141.95.62.57.123 > 192.168.10.19.123: UDP, length 48
