20:06:57.276824 IP 192.168.10.101.49204 > 171.25.178.74.9523: UDP, length 270
20:06:57.310778 IP 171.25.178.74.9523 > 192.168.10.101.49204: UDP, length 325
20:06:57.417403 IP 192.168.10.199.37999 > 3.250.123.105.31004: tcp 282
20:06:57.459293 IP 3.250.123.105.31004 > 192.168.10.199.37999: tcp 0
20:06:57.459361 IP 3.250.123.105.31004 > 192.168.10.199.37999: tcp 142
20:06:57.463615 IP 192.168.10.39.62992 > 255.255.255.255.62976: UDP, length 317
20:06:57.473587 IP 192.168.10.199.37999 > 3.250.123.105.31004: tcp 0
20:06:58.030795 IP 192.168.10.24.46386 > 91.82.92.228.110: tcp 0
20:06:58.087999 ARP, Request who-has 192.168.10.31 tell 192.168.10.173, length 46
20:06:58.170740 IP 192.168.10.37.49154 > 148.6.0.1.123: UDP, length 48
20:06:58.175636 IP 148.6.0.1.123 > 192.168.10.37.49154: UDP, length 48
20:06:58.253187 IP6 fe80::208:a2ff:fe0e:fd02 > ff02::1: ICMP6, router advertisement, length 56
20:06:58.528758 ARP, Request who-has 192.168.10.168 tell 192.168.10.91, length 46
20:06:58.770354 IP 172.16.32.242.54826 > 192.168.10.2.1433: tcp 1
20:06:58.770922 IP 192.168.10.2.1433 > 172.16.32.242.54826: tcp 0
20:06:58.809180 IP 192.168.10.2.1433 > 172.16.32.242.54826: tcp 1
20:06:58.823194 IP 172.16.32.242.54826 > 192.168.10.2.1433: tcp 0
20:06:58.888479 ARP, Request who-has 192.168.10.31 tell 192.168.10.173, length 46
20:06:58.927058 IP 192.168.10.139.58855 > 239.255.255.250.1900: UDP, length 174
20:06:59.218903 IP 192.168.10.139.60596 > 142.251.39.10.443: UDP, length 33